germplasmName,purdy.pedigree,decision,merit,Grain.yield...bu.ac,Grain.test.weight...lbs.bu,Heading.time...Julian.date..JD..,Plant.height.inches,FHB.DON.content...ppm.,FHB.grain.incidence.....,notes3,action,Found,Quick.Note.,range.,row.,plot_me.,Weight..lb.,Moisture....,Test.Weight..lb.bu.,Harvest.Sequence.,seedlot_me,ugid
IL2021-25905,12-17428/14-11916,,440.2,74.4,58.6,131.7,36.4,1.2,21.7,YTUrb22[Mix],DISCARD,TRUE,,12,20,SI_Urb_22-589,7.65,14.6,59.5,1152,SI_Urb_22-589,IL2021-25905
IL2021-26260,12-21235/14-11312,,438.4,74.4,59.1,131.8,36.1,1.4,18.3,"YTNeo22[clean, looks good]",DISCARD,TRUE,,3,31,SI_Urb_22-903,6.57,14.9,60.4,1078,SI_Urb_22-903,IL2021-26260
IL2021-6802,12-8512/IL12-26004,,460.1,74.4,58.5,130.4,36.4,0.7,10.8,YTNeo22[septoria],DISCARD,TRUE,,21,39,SI_Urb_22-1161,6.14,11.5,63.2,580,SI_Urb_22-1161,IL2021-6802
IL2021-11039,14-11312/IL12-26004,,459.6,74.4,58.4,130.5,36.1,0.7,12.4,,DISCARD,TRUE,,7,26,SI_Urb_22-774,6.92,14,60.2,1374,SI_Urb_22-774,
IL2021-46550,MO080104/14-21519//15-27270,,455.8,74.4,58.8,131.5,35.4,0.6,10.9,,KEEP,TRUE,"6/25/2022, 10:35:53 AM, Tare Warning, Test Weight: 6.29",19,12,SI_Urb_22-342,6.14,11.8,63.8,679,SI_Urb_22-342,
IL2021-26235,12-21235/12-26004,,463.4,74.3,59.2,130.1,37.3,0.6,9.8,YTUrb22[Leaning],DISCARD,TRUE,,5,26,SI_Urb_22-776,7.2,14,59.9,1376,SI_Urb_22-776,IL2021-26235
IL2021-7630,12-26448/MO080104,,448.2,74.3,58.9,131.2,36.7,1,17.1,,KEEP,TRUE,,21,11,SI_Urb_22-321,5.28,11.9,62.5,621,SI_Urb_22-321,
IL2021-24802,12-8512/12-17428,,443.1,74.3,59.1,131.9,36.2,1,16.6,YTUrb22[Leaning],DISCARD,TRUE,,5,32,SI_Urb_22-956,6.72,14.5,58.9,1016,SI_Urb_22-956,IL2021-24802
IL2021-44872,14-28468/14-11848//16-9335,,441.8,74.3,58.9,132.1,35.5,1,19.4,,KEEP,TRUE,,7,8,SI_Urb_22-234,7.22,11.1,61.1,427,SI_Urb_22-234,
IL2021-8372,IL13-451/14-21519,,424.2,74.3,59.6,132.9,37.5,1.7,24.3,,DISCARD,TRUE,,10,17,SI_Urb_22-490,6.65,15.1,60.4,970,SI_Urb_22-490,
IL2021-39379,07-4415/14-11848//12-8512,,443,74.2,58.9,131.4,36.3,1.1,18,YTUrb22[Too tall],DISCARD,TRUE,,8,24,SI_Urb_22-713,6.81,14,59.3,1388,SI_Urb_22-713,IL2021-39379
IL2021-11830,14-11772/07-4415,,445.4,74.2,59.4,130.9,38,1.1,18.7,YTNeo22[tall],DISCARD,TRUE,,18,19,SI_Urb_22-558,6.46,14.9,60.7,1098,SI_Urb_22-558,IL2021-11830
IL2021-36163,16-18944/12-17428,,421.9,74.2,57.7,132.2,35.2,1.6,24.9,,KEEP,TRUE,,16,13,SI_Urb_22-376,6.19,12,60.9,736,SI_Urb_22-376,
IL2021-36708,16-27570/14-28462,,449,74.2,59.9,131.5,35.6,0.9,13.1,YTUrb22[Lodging],DISCARD,TRUE,,18,26,SI_Urb_22-763,6.98,14.3,60.3,1363,SI_Urb_22-763,IL2021-36708
IL2021-8747,13-1960/IL12-26004,,439.8,74.1,59,130.3,35.4,1.5,23.8,YTNeo22[lodging],DISCARD,TRUE,,15,26,SI_Urb_22-766,7,13.8,61,1366,SI_Urb_22-766,IL2021-8747
IL2021-8739,13-1960/IL12-26004,,429.4,74.1,58.3,131.3,36.1,1.7,28,YTUrb22[Disease],DISCARD,TRUE,"6/27/2022, 3:56:12 PM, Tare Warning, Test Weight: -9.17",10,29,SI_Urb_22-850,7.23,14.3,59.8,1191,SI_Urb_22-850,IL2021-8739
IL2021-16335,14-11772/14-28462,,426.6,74.1,60.4,131.9,36,1.7,26.8,,DISCARD,TRUE,,11,39,SI_Urb_22-1151,6.99,11.5,65.1,590,SI_Urb_22-1151,
IL2021-33945,14-28468/16-9335,,438.9,74.1,60,130.7,35,1.6,19.4,,KEEP,TRUE,,19,11,SI_Urb_22-319,6.87,11.8,63.2,619,SI_Urb_22-319,
IL2021-34132,15-10568/12-26004,,450.1,74.1,58.4,130.4,35.6,1,18.5,YTUrb22[Ve],DISCARD,TRUE,,20,18,SI_Urb_22-521,6.26,15.1,59.8,1040,SI_Urb_22-521,IL2021-34132
IL2021-1141,MO080104/10-21934,,440.6,74.1,57.6,131.3,36.8,1,14.7,YTUrb22[Thin],DISCARD,TRUE,,1,47,SI_Urb_22-1381,5.84,11.6,62.7,120,SI_Urb_22-1381,IL2021-1141
IL2021-1749,MO150624/07-4415,,433,74.1,58.1,131.8,37.5,1.5,23.5,YTUrb22[Tall],DISCARD,TRUE,,17,37,SI_Urb_22-1097,6.69,11.6,63.1,704,SI_Urb_22-1097,IL2021-1749
IL2021-19868,P05247A1-7-3-108-2/12-26004,,430.7,74.1,58.1,133.2,36.1,1.1,21.9,YTUrb22[Tall],DISCARD,TRUE,,29,18,SI_Urb_22-512,6.26,15.5,58.5,1049,SI_Urb_22-512,IL2021-19868
IL2021-4012,02-19463-5/P0566A1-3-1-52,,444.3,74,58.2,132,35.6,0.8,17.3,YTUrb22[Disease],DISCARD,TRUE,,23,39,SI_Urb_22-1163,5.97,11.8,63.5,578,SI_Urb_22-1163,IL2021-4012
IL2021-45221,07-4415/14-11830//14-28462,,455.7,74,58.8,130.9,35.7,0.7,11.9,YTUrb22[Short],DISCARD,TRUE,,29,25,SI_Urb_22-749,6.91,14,59.7,1412,SI_Urb_22-749,IL2021-45221
IL2021-26279,12-21235/14-11312,,437.7,74,57.9,131.3,36.2,1.3,19.3,,KEEP,TRUE,,29,10,SI_Urb_22-272,6.46,11.5,62.9,569,SI_Urb_22-272,
IL2021-24655,12-8512/P0762A1-2-8,,438.8,74,58.5,132.1,36.2,1.1,18.3,"YTUrb22[Ve, Leaning]",DISCARD,TRUE,,14,20,SI_Urb_22-587,6.72,14.6,59.2,1154,SI_Urb_22-587,IL2021-24655
IL2021-4314,02-19463-5/IL12-26004,,463.6,73.9,58,130.7,35.7,0.3,7.5,,DISCARD,TRUE,,9,43,SI_Urb_22-1269,6.14,11.4,60.8,352,SI_Urb_22-1269,
IL2021-39368,07-4415/14-11848//12-8512,,432.3,73.9,58.7,131.4,35.2,1.6,22.8,YTUrb22[Tall],DISCARD,TRUE,,27,29,SI_Urb_22-867,7.14,15.6,57.8,1174,SI_Urb_22-867,IL2021-39368
IL2021-13738,07-4415/14-28462,,429.9,73.9,57.6,130.3,35.7,1.6,24.8,,KEEP,TRUE,,5,12,SI_Urb_22-356,7.18,11.2,64.6,665,SI_Urb_22-356,
IL2021-25621,12-17428/12-21235,,421,73.9,59.1,131.8,37.5,2,27.4,YTUrb22[Tall],DISCARD,TRUE,,13,20,SI_Urb_22-588,7.2,14.9,60,1153,SI_Urb_22-588,IL2021-25621
IL2021-26880,12-26004/14-11312,,461.8,73.9,58,130.7,36.5,0.6,5.3,,DISCARD,TRUE,,3,33,SI_Urb_22-963,7.75,15.4,59.2,958,SI_Urb_22-963,
IL2021-15734,12-8545/14-28462,,441.7,73.9,59.8,131.6,36.1,1.1,17.2,YTUrb22[Tall],DISCARD,TRUE,,15,16,SI_Urb_22-466,6.48,15.6,59.8,915,SI_Urb_22-466,IL2021-15734
IL2021-20030,P05247A1-7-3-108-2/15-27270,,432,73.9,58.3,131.8,36.3,1.4,24.5,YTUrb22[Mix],DISCARD,TRUE,,20,26,SI_Urb_22-761,6.7,13.7,59,1361,SI_Urb_22-761,IL2021-20030
IL2021-26252,12-21235/14-11312,,450.1,73.8,58.2,130.7,35.7,1,13,,DISCARD,TRUE,,15,20,SI_Urb_22-586,7.47,14.8,59,1155,SI_Urb_22-586,
IL2021-7261,12-21624/10-21934,,444.3,73.8,58.7,131.5,38.5,1,13.8,,DISCARD,TRUE,,14,38,SI_Urb_22-1127,6.17,12.3,62.2,647,SI_Urb_22-1127,
IL2021-16509,14-11772/14-28468,,442.2,73.8,59.8,130.7,37.4,1.4,17,,KEEP,TRUE,,1,13,SI_Urb_22-361,7.58,11.8,63.6,721,SI_Urb_22-361,
IL2021-8247,IL13-451/12-8512,,440.2,73.8,58.9,130.3,36.4,1.5,22.2,YTUrb22[Leaning],DISCARD,TRUE,,4,29,SI_Urb_22-844,7.58,14,61.8,1197,SI_Urb_22-844,IL2021-8247
IL2021-19166,MO080104/14-28444,,464.8,73.7,58.9,130.9,37.3,0.3,1.8,YTUrb22[Tall],DISCARD,TRUE,,12,22,SI_Urb_22-649,6.88,14.2,61.3,1272,SI_Urb_22-649,IL2021-19166
IL2021-26916,12-26004/14-11312,,462.8,73.6,57.7,130.6,37.1,0.1,3.5,,DISCARD,TRUE,,6,42,SI_Urb_22-1255,6.7,11,62,415,SI_Urb_22-1255,
IL2021-29730,14-11312/12-17428,,441.7,73.6,58.2,131.2,36.5,1.1,16.9,YTUrb22[Lodging],DISCARD,TRUE,,17,32,SI_Urb_22-944,7.34,14.9,60.2,1004,SI_Urb_22-944,IL2021-29730
IL2021-36866,16-30378/02-19463-7,,435.6,73.6,58,131.6,35.9,1.2,22,,DISCARD,TRUE,,22,45,SI_Urb_22-1342,4.75,11.7,59.7,219,SI_Urb_22-1342,
IL2021-9317,IL13-20616/MD09W272-8-4-13-3-15,,435,73.6,59.1,132.7,36.4,1,16.6,"YTUrb22[Bearded, Mix]",DISCARD,TRUE,,11,28,SI_Urb_22-830,6.9,14,59.7,1250,SI_Urb_22-830,IL2021-9317
IL2021-18716,MO080104/12-17257,,434.6,73.6,58.8,132.4,35.8,1.2,16.9,YTUrb22[Leaning],DISCARD,TRUE,,15,33,SI_Urb_22-975,6.7,15.8,59,946,SI_Urb_22-975,IL2021-18716
IL2021-3428,P05247A1-7-3-120/07-4415,,450.5,73.6,58.4,131,36.7,0.7,14.3,,KEEP,TRUE,,2,10,SI_Urb_22-299,6.88,11.7,63.5,542,SI_Urb_22-299,
IL2021-22152,07-19334/unknown,,425.9,73.5,59,130.7,36.1,1.8,30.2,YTUrb22[Tall],DISCARD,TRUE,,15,37,SI_Urb_22-1095,6.93,11.8,64.6,706,SI_Urb_22-1095,IL2021-22152
IL2021-46737,07-4415/14-11830//P05247A1-7-3-108-2,,435.7,73.5,58.6,131.3,34.5,1.3,22.2,"YTUrb22[Erect, short, see down row, some disease]",DISCARD,TRUE,,21,25,SI_Urb_22-741,6.48,13.8,60.1,1420,SI_Urb_22-741,IL2021-46737
IL2021-4852,07-4415/IL12-26004,,443,73.5,57.7,130.4,35.3,1.1,15.9,,KEEP,TRUE,,28,15,SI_Urb_22-448,7.56,15.6,58.1,868,SI_Urb_22-448,
IL2021-23826,10-21934/12-17428,,417.9,73.5,58.6,133.1,37.9,1.6,26.3,YTUrb22[Tall],DISCARD,TRUE,,19,37,SI_Urb_22-1099,6.9,11.9,62.7,702,SI_Urb_22-1099,IL2021-23826
IL2021-30449,14-11772/12-21235,,447.8,73.5,59.3,131.4,37.3,0.8,11.6,YTUrb22[Leaning],DISCARD,TRUE,,19,22,SI_Urb_22-642,6.86,14.2,61.2,1279,SI_Urb_22-642,IL2021-30449
IL2021-34749,15-25742/16-21114,,433.5,73.5,59.2,130.7,34.3,1.5,25.6,,DISCARD,TRUE,,30,29,SI_Urb_22-870,5.03,15.4,57,1171,SI_Urb_22-870,
IL2021-35909,16-4939/16-9335,,432.4,73.5,59.1,132.2,35.7,1.1,22.9,,DISCARD,TRUE,,6,19,SI_Urb_22-546,6.47,15.7,59.3,1086,SI_Urb_22-546,
IL2021-4037,02-19463-5/P0566A1-3-1-52,,438.4,73.4,57.9,130.7,34.8,1.1,23.3,YTUrb22[Mix],DISCARD,TRUE,,8,44,SI_Urb_22-1313,5.74,11.6,61.9,293,SI_Urb_22-1313,IL2021-4037
IL2021-25441,12-17257/14-11772,,425.7,73.4,58.9,132.3,34.9,1.5,22.4,,DISCARD,TRUE,,15,40,SI_Urb_22-1186,6.35,11.1,63.4,526,SI_Urb_22-1186,
IL2021-30532,14-11772/16-9335,,428.2,73.4,59.6,132,35.1,1.5,21,,KEEP,TRUE,,22,8,SI_Urb_22-219,6.71,11.3,63.4,442,SI_Urb_22-219,
IL2021-164,GA081628-G1-G2-G1-G23/P0566A1-3-1-52,,420.4,73.4,58,131.6,33.9,1.9,29.8,YTUrb22[Very mixed],DISCARD,TRUE,,13,37,SI_Urb_22-1093,5.65,11.7,61.4,708,SI_Urb_22-1093,IL2021-164
IL2021-3526,P05247A1-7-3-120/14-11750,,439.7,73.4,59.2,132,34.4,0.9,17.6,,KEEP,TRUE,,15,8,SI_Urb_22-226,7.57,11.2,62.8,435,SI_Urb_22-226,
Kaskaskia,,,390.7,73.4,58.6,136.1,41,2.1,32.7,,,,,,,,,,,,,
IL2021-31429,14-11916/12-17257,keep,455.3,73.3,58.7,129.7,36.1,0.9,12.2,,KEEP,TRUE,,8,14,SI_Urb_22-413,7.47,15.2,61.4,788,SI_Urb_22-413,
IL2021-35665,16-4939/12-17428,,437.1,73.3,58.3,130.6,33.8,1.4,21.2,,DISCARD,TRUE,,24,30,SI_Urb_22-877,7.3,14.6,59.9,1117,SI_Urb_22-877,
IL2021-8258,IL13-451/12-8512,,447.6,73.3,59.6,131.4,37.7,0.8,11,YTUrb22[Leaning],DISCARD,TRUE,,11,29,SI_Urb_22-851,7.18,14.9,59,1190,SI_Urb_22-851,IL2021-8258
IL2021-31536,14-11916/12-26004,,441.7,73.2,58.5,131.4,37.1,1,15.3,YTUrb22[Leaning],DISCARD,TRUE,,15,41,SI_Urb_22-1215,6.23,11.3,62.2,466,SI_Urb_22-1215,IL2021-31536
IL2021-40761,07-20728/14-28468//15-25742,,447.2,73.1,59.6,130.2,35.9,0.9,18.5,,DISCARD,TRUE,,13,33,SI_Urb_22-973,6.61,15.5,58.7,948,SI_Urb_22-973,
IL2021-13764,07-4415/14-28468,,463.4,73.1,59.2,130.1,36.6,0.3,5.8,YTNeo22[ve],DISCARD,TRUE,,3,37,SI_Urb_22-1083,6.8,11.6,64.3,718,SI_Urb_22-1083,IL2021-13764
IL2021-31857,14-11916/14-28444,,433.2,73.1,58.2,131.8,36,1.1,22.7,,KEEP,TRUE,,14,9,SI_Urb_22-254,6.76,11.8,59.8,494,SI_Urb_22-254,
IL2021-27958,14-3934/12-8512,,438.1,73.1,59.1,133,37.9,0.8,11,,KEEP,TRUE,,9,15,SI_Urb_22-429,6.53,16.2,59.4,849,SI_Urb_22-429,
IL2021-29008,14-9546/12-8512,,440.9,73.1,58.4,131.1,36.1,1,16.9,YTNeo22[scab],DISCARD,TRUE,,1,37,SI_Urb_22-1081,6.13,11.6,63.1,720,SI_Urb_22-1081,IL2021-29008
IL2021-13877,07-4415/14-28468,,453,73,59.4,130.4,36.3,0.7,10.7,,DISCARD,TRUE,"6/27/2022, 7:27:37 PM, Tare Warning, Test Weight: 8.78",5,25,SI_Urb_22-725,8.02,13.7,62.3,1436,SI_Urb_22-725,
IL2021-41451,12-8545/07-20728//14-28307,,457.8,73,58.6,131.6,36.8,0.1,4.8,"YTNeo22[sept, ve]",DISCARD,TRUE,,11,44,SI_Urb_22-1310,4.22,0,0,290,SI_Urb_22-1310,IL2021-41451
IL2021-39469,07-19334/07-4415//16-9335,,417.3,72.9,58.7,133.1,36.6,1.5,24.7,,KEEP,TRUE,,8,10,SI_Urb_22-293,6.51,12,62.9,548,SI_Urb_22-293,
IL2021-40661,07-20728/14-28462//14-28444,,446.9,72.9,61.1,131.3,36.8,0.7,12.4,,DISCARD,TRUE,,8,43,SI_Urb_22-1268,5.37,11.4,64.2,353,SI_Urb_22-1268,
IL2021-25644,12-17428/12-21235,,426.5,72.9,59.4,131.6,37.2,1.6,22.1,YTUrb22[Tall],DISCARD,TRUE,,18,21,SI_Urb_22-618,7.09,14.6,60.3,1218,SI_Urb_22-618,IL2021-25644
IL2021-26163,12-21235/12-26004,,441.2,72.9,58.7,130.4,37.3,1.2,17.4,YTUrb22[Leaning],DISCARD,TRUE,,14,31,SI_Urb_22-914,6.5,15,59.4,1067,SI_Urb_22-914,IL2021-26163
IL2021-26255,12-21235/14-11312,,423,72.9,58.3,131.8,36.7,1.7,23.6,YTNeo22[leaning],DISCARD,TRUE,,17,31,SI_Urb_22-917,6.58,14.9,59.7,1064,SI_Urb_22-917,IL2021-26255
IL2021-12459,14-23050/12-8512,,441.9,72.9,58.4,130.7,36.6,1.1,16.9,,KEEP,TRUE,,11,9,SI_Urb_22-251,6.28,11.9,58.3,491,SI_Urb_22-251,
IL2021-3178,P05247A1-7-3-108-2/IL13-20616,,420.6,72.9,59.1,131.4,32.4,1.8,29.1,,DISCARD,TRUE,,27,36,SI_Urb_22-1054,6.96,11.6,63.8,754,SI_Urb_22-1054,
IL2021-29356,14-9546/12-26004,keep,465.9,72.8,59.4,128.9,36.2,0.5,5.4,,KEEP,TRUE,,12,11,SI_Urb_22-312,6.97,11.8,62.3,612,SI_Urb_22-312,
IL2021-26303,12-21235/14-11312,,436.7,72.8,58.8,131.2,35.8,1.1,18.1,,DISCARD,TRUE,,20,19,SI_Urb_22-560,6.51,15.2,60.4,1100,SI_Urb_22-560,
IL2021-27103,12-21235/KY09C-1245-99-8-5,,444.1,72.8,57.8,130.7,35.2,0.8,15.9,,DISCARD,TRUE,,14,32,SI_Urb_22-947,7.14,14.9,59.5,1007,SI_Urb_22-947,
IL2021-7959,12-30879/14-9923,,444.8,72.8,58.6,130.7,36.1,0.9,15.5,YTUrb22[Lodg],DISCARD,TRUE,,7,28,SI_Urb_22-834,6.81,14.3,60.8,1254,SI_Urb_22-834,IL2021-7959
IL2021-7017,12-8512/14-9923,,443.2,72.8,58.4,130.7,36.2,1,16.2,,DISCARD,TRUE,,9,40,SI_Urb_22-1192,6.48,11.6,61.8,532,SI_Urb_22-1192,
IL2021-30331,14-11772/12-8512,,439.2,72.8,59.8,130,35.8,1.4,19,YTNeo22[leaning],DISCARD,TRUE,,30,32,SI_Urb_22-931,4.96,15.5,58.7,991,SI_Urb_22-931,IL2021-30331
IL2021-16443,14-11772/14-28468,,432.7,72.8,59.6,132,37.3,1.2,16.5,YTUrb22[Lodg],DISCARD,TRUE,,3,44,SI_Urb_22-1318,6.55,11.4,63.5,298,SI_Urb_22-1318,IL2021-16443
IL2021-2953,P05247A1-7-3-108-2/07-4415,,436.6,72.7,58.2,131.2,36.2,1,20.7,YTUrb22[Tall],DISCARD,TRUE,,12,38,SI_Urb_22-1129,5.05,11.8,62.3,649,SI_Urb_22-1129,IL2021-2953
IL2021-3762,P0566A1-3-1-52/IL12-26004,,442.1,72.7,58.1,131.1,35.2,0.9,16.2,,KEEP,TRUE,,17,8,SI_Urb_22-224,5.68,11.1,62.1,437,SI_Urb_22-224,
IL2021-40858,07-20728/14-28468//15-25742,,448.7,72.6,60,131.3,36.9,0.5,11.8,,DISCARD,TRUE,,20,42,SI_Urb_22-1241,4.63,11.5,61.7,401,SI_Urb_22-1241,
IL2021-33856,14-28468/12-21235,,436.4,72.6,59.2,131.4,36.6,1.1,16.4,"YTUrb22[Bearded, npt]",DISCARD,TRUE,,4,39,SI_Urb_22-1144,6.64,11.7,61.5,597,SI_Urb_22-1144,IL2021-33856
IL2021-39517,07-19334/07-4415//16-9335,,426.7,72.5,59.8,131.1,37,1.5,25.3,YTUrb22[Tall],DISCARD,TRUE,,29,22,SI_Urb_22-632,5.9,14.4,60.6,1289,SI_Urb_22-632,IL2021-39517
IL2021-14278,07-19334/14-11772,,428.9,72.5,59.8,132.5,36.8,1.1,16.4,YTUrb22[Leaning],DISCARD,TRUE,,8,27,SI_Urb_22-788,6.29,13.8,61.3,1313,SI_Urb_22-788,IL2021-14278
IL2021-46760,07-4415/14-11830//P05247A1-7-3-108-2,,430.2,72.5,58.3,131.4,35.4,1.2,21.7,"YTUrb22[Bydv, leaf rust]",DISCARD,TRUE,,19,35,SI_Urb_22-1039,6.82,16.2,59.7,822,SI_Urb_22-1039,IL2021-46760
IL2021-24617,12-8512/P0762A1-2-8,,397.8,72.5,57.2,131.7,35.5,2.1,33.6,,DISCARD,TRUE,,22,46,SI_Urb_22-1359,4.27,0,0,159,SI_Urb_22-1359,
IL2021-10769,14-9527/14-21519,,434.6,72.5,58.6,133.4,36.6,0.6,12,,KEEP,TRUE,,16,9,SI_Urb_22-256,5.75,11.3,62.2,496,SI_Urb_22-256,
IL2021-1748,MO150624/07-4415,,428.2,72.5,57.4,131.3,38.4,1,18,YTUrb22[Tall],DISCARD,TRUE,,26,38,SI_Urb_22-1115,5.91,11.6,61.5,635,SI_Urb_22-1115,IL2021-1748
IL2021-6925,12-8512/14-9527,,442.2,72.4,58.2,131.2,36.1,0.8,13.7,YTUrb22[Leaning],DISCARD,TRUE,,3,45,SI_Urb_22-1323,6.08,11.4,62.3,238,SI_Urb_22-1323,IL2021-6925
IL2021-27626,13-1910/12-17257,,443.5,72.4,59.2,132.6,36.1,0.5,5.8,,DISCARD,TRUE,,23,31,SI_Urb_22-923,7.03,15,60.4,1058,SI_Urb_22-923,
IL2021-47131,14-11848/07-19334//16-18944,,409.5,72.4,57.5,132.2,35.1,1.6,29.1,YTUrb22[Npt],DISCARD,TRUE,,23,43,SI_Urb_22-1283,5.36,11.6,60.6,338,SI_Urb_22-1283,IL2021-47131
IL2021-31425,14-11916/12-17257,,427.6,72.4,59.2,131.6,36.2,1.4,20.5,,KEEP,TRUE,,18,15,SI_Urb_22-438,6.7,15.4,61,858,SI_Urb_22-438,
IL2021-34833,15-25742/,,439.2,72.4,58.3,131.2,36.2,1,14.4,,DISCARD,TRUE,,15,28,SI_Urb_22-826,5.97,14.3,58.4,1246,SI_Urb_22-826,
IL2021-26620,12-21235/16-9335,,437.1,72.3,59.7,131,37.5,1.1,15.8,YTUrb22[Tall],DISCARD,TRUE,,5,22,SI_Urb_22-656,6.49,14.6,60.3,1265,SI_Urb_22-656,IL2021-26620
IL2021-6814,12-8512/IL12-26004,,446.1,72.3,58.5,130.2,35.7,1,11.8,"YTUrb22[Leaning, disease]",DISCARD,TRUE,,9,45,SI_Urb_22-1329,5.29,11.4,61.9,232,SI_Urb_22-1329,IL2021-6814
IL2021-19755,P05247A1-7-3-108-2/12-17257,,438.1,72.3,59,131.7,36.2,0.8,16.3,,DISCARD,TRUE,,11,45,SI_Urb_22-1331,4.87,11.8,60,230,SI_Urb_22-1331,
IL2021-24839,12-8512/14-9542,,439.6,72.2,58.2,131.7,35.7,0.8,12.1,YTUrb22[Leaning],DISCARD,TRUE,,3,46,SI_Urb_22-1378,7.44,11.4,62.6,178,SI_Urb_22-1378,IL2021-24839
IL2021-42453,14-11848/07-20728//P05247A1-7-3-29,,421.2,72.2,59.2,131.5,35.3,1.5,28,,DISCARD,TRUE,,23,21,SI_Urb_22-623,5.83,14.3,60.6,1223,SI_Urb_22-623,
IL2021-33875,14-28468/12-21235,,443.7,72.2,59.1,131.2,35.6,0.7,10.5,,KEEP,TRUE,,28,12,SI_Urb_22-333,5.72,11.7,62.4,688,SI_Urb_22-333,
IL2021-28309,14-3934/15-10568,,449,72.2,59.1,130.3,34.7,0.7,11,,KEEP,TRUE,,14,11,SI_Urb_22-314,7.26,11.7,62.9,614,SI_Urb_22-314,
IL2021-28413,14-3934/15-25742,,432.5,72.2,58.6,131.9,35.9,1,16,YTUrb22[Leaning],DISCARD,TRUE,,1,42,SI_Urb_22-1260,6.15,11.2,62.3,420,SI_Urb_22-1260,IL2021-28413
IL2021-34119,15-10568/12-26004,,443.8,72.2,58.2,131.3,36.3,0.6,12.2,,KEEP,TRUE,,29,13,SI_Urb_22-389,6.55,12.1,62.1,749,SI_Urb_22-389,
IL2021-21127,02-19463-7/16-9335,,419.6,72.1,58.8,132.7,36.7,1.5,19,,KEEP,TRUE,,5,11,SI_Urb_22-305,6.86,12.8,61.1,605,SI_Urb_22-305,
IL2021-25823,12-17428/14-11848,,415.7,72.1,58.2,132.8,35.9,1.4,26.2,YTUrb22[Lodg],DISCARD,TRUE,,28,42,SI_Urb_22-1233,5.36,11.5,60.5,393,SI_Urb_22-1233,IL2021-25823
IL2021-44537,14-28468/14-11848//14-11312,,450.5,72.1,58.9,131.5,36.2,0.3,5.2,YTUrb22[Leaning],DISCARD,TRUE,,2,25,SI_Urb_22-722,6.15,13.6,60.8,1439,SI_Urb_22-722,IL2021-44537
IL2021-46530,MO080104/14-21519//15-27270,,430.3,72.1,58.9,131.3,36.3,1.2,19.7,,KEEP,TRUE,,5,8,SI_Urb_22-236,6.57,11.3,62.2,425,SI_Urb_22-236,
IL2021-15943,14-11772/07-4415,,424.4,72,59,131.9,37.3,1.3,20.9,,DISCARD,TRUE,,2,22,SI_Urb_22-659,6.44,15,59.7,1262,SI_Urb_22-659,
IL2021-31345,14-11916/07-4415,,431.8,72,57.6,131.2,37,0.9,16.1,,KEEP,TRUE,,5,15,SI_Urb_22-425,6.66,16,58.3,845,SI_Urb_22-425,
IL2021-31547,14-11916/12-26004,,438.5,72,58.1,130.8,35.1,1,16.2,,KEEP,TRUE,,14,14,SI_Urb_22-407,7.42,15.3,59.8,794,SI_Urb_22-407,
IL2021-33557,14-28462/12-21235,,428,72,59.3,130.8,36.3,1.4,22.9,,DISCARD,TRUE,,23,19,SI_Urb_22-563,6.69,15.2,60.6,1103,SI_Urb_22-563,
IL2021-34722,15-25742/12-26004,,450.2,72,58.5,129.9,35.5,0.7,10.9,YTUrb22[Lodging],DISCARD,TRUE,,4,17,SI_Urb_22-484,7.05,14.7,60.6,964,SI_Urb_22-484,IL2021-34722
IL2021-1302,MO080104/12-26448,,436.2,72,58.1,131.8,35.7,0.9,11.7,,KEEP,TRUE,,20,10,SI_Urb_22-281,6.11,11.7,63.2,560,SI_Urb_22-281,
IL2021-31560,14-11916/12-26004,,430.8,71.9,58.1,131,36.9,1.2,19.9,,KEEP,TRUE,,23,14,SI_Urb_22-398,6.77,15,60.7,803,SI_Urb_22-398,
IL2021-115,GA081628-G1-G2-G1-G23/P0566A1-3-1-52,,408.9,71.9,57.7,131.9,34.2,1.8,26.7,"YTUrb22[Late, bearded]",DISCARD,TRUE,,29,47,SI_Urb_22-1409,4.66,11.8,61.9,92,SI_Urb_22-1409,IL2021-115
IL2021-6042,07-21847/14-21519,,427.8,71.8,59.5,131.1,34.8,1.3,20.3,,DISCARD,TRUE,,1,29,SI_Urb_22-841,5.47,15.6,57.2,1200,SI_Urb_22-841,
IL2021-25511,12-17257/14-11772,,433,71.8,58.8,130.6,34.7,1.3,18,YTUrb22[Tall],DISCARD,TRUE,,8,40,SI_Urb_22-1193,6.06,11.2,62.6,533,SI_Urb_22-1193,IL2021-25511
IL2021-29470,14-9546/15-25742,,439.6,71.8,58.4,130.3,34.8,0.9,17.4,,DISCARD,TRUE,,16,35,SI_Urb_22-1036,5.69,16,59,825,SI_Urb_22-1036,
IL2021-27145,12-21235/KY09C-1245-99-8-5,,431.4,71.7,58.5,131.4,38.5,1.1,16.1,"YTNeo22[bearded, tall, lodging]",DISCARD,TRUE,,25,47,SI_Urb_22-1405,4.16,0,0,96,SI_Urb_22-1405,IL2021-27145
IL2021-8718,13-1960/IL12-26004,,436.2,71.7,58.6,131.8,38.1,0.9,8.8,YTNeo22[leaning],DISCARD,TRUE,,5,21,SI_Urb_22-605,7.22,15.1,56.6,1205,SI_Urb_22-605,IL2021-8718
IL2021-29842,14-11312/12-21235,,429.4,71.7,57,131.8,34.7,0.5,6.9,"YTUrb22[Bearded, a bit tall]",DISCARD,TRUE,,18,31,SI_Urb_22-918,6.9,14.7,58.9,1063,SI_Urb_22-918,IL2021-29842
IL2021-7637,12-26448/MO080104,,426.4,71.6,58.2,131.8,34.9,1.1,18.7,,DISCARD,TRUE,,9,29,SI_Urb_22-849,7.2,14.3,60,1192,SI_Urb_22-849,
IL2021-43401,14-28462/07-20728//10-21934,,436.1,71.6,58.6,131,35.6,0.9,14.7,YTUrb22[Leaning],DISCARD,TRUE,,7,44,SI_Urb_22-1314,6.82,11.7,60.5,294,SI_Urb_22-1314,IL2021-43401
IL2021-42227,14-11772/14-11830//15-27666,,440.1,71.5,58.7,131.3,36.6,0.6,12.4,,DISCARD,TRUE,,22,22,SI_Urb_22-639,6.67,14.6,59.9,1282,SI_Urb_22-639,
IL2021-25954,12-17428/16-30378,,420.4,71.4,59.1,131.7,37.4,1.3,23.5,YTUrb22[Tall],DISCARD,TRUE,,3,30,SI_Urb_22-898,7.19,14.9,58.9,1138,SI_Urb_22-898,IL2021-25954
IL2021-37047,16-30378/15-10568,,429.6,71.4,59,131.8,34.7,1,16.3,YTUrb22[Short],DISCARD,TRUE,,29,24,SI_Urb_22-692,6.59,14.2,60.4,1409,SI_Urb_22-692,IL2021-37047
IL2021-550,KY02C-3005-25/13-1960,,424.2,71.4,59.4,131.6,35.4,1.2,21.8,,DISCARD,TRUE,,18,37,SI_Urb_22-1098,5.78,11.8,63.5,703,SI_Urb_22-1098,
IL2021-19439,P0762A1-2-8/14-11312,,394.6,71.4,56.2,133.2,35.5,1,16.9,,DISCARD,TRUE,,13,16,SI_Urb_22-468,7.19,16.5,52.8,913,SI_Urb_22-468,
IL2021-11935,14-11772/12-8512,,448.3,71.3,58.8,130.7,36.1,0.5,5.5,,DISCARD,TRUE,,10,26,SI_Urb_22-771,6.71,14,59.1,1371,SI_Urb_22-771,
IL2021-46659,P0566A1-3-1-52/13-1910//12-8512,,429.6,71.3,57.9,131.7,35.9,0.9,16.1,YTUrb22[Scab],DISCARD,TRUE,,27,35,SI_Urb_22-1047,6.75,17,58.3,814,SI_Urb_22-1047,IL2021-46659
IL2021-3941,P0566A1-3-1-52/IL13-20616,,419.6,71.3,58.1,131.8,36.5,1.4,20.4,"YTUrb22[Plot damage 10%, Mix]",DISCARD,TRUE,,12,24,SI_Urb_22-709,6.94,13.5,58.7,1392,SI_Urb_22-709,IL2021-3941
IL2021-4049,02-19463-5/P0566A1-3-1-52,,425.8,71.2,58.9,131.3,34.3,1.1,21.4,,DISCARD,TRUE,,26,45,SI_Urb_22-1346,5.14,11.5,61.8,215,SI_Urb_22-1346,
IL2021-30406,14-11772/12-21235,,436.5,71.2,59.3,130.5,37.1,1,13.6,"YTUrb22[Bearded, tall, ve]",DISCARD,TRUE,,23,32,SI_Urb_22-938,5.91,15.3,59.4,998,SI_Urb_22-938,IL2021-30406
IL2021-18306,14-28468/14-11772,,430.3,71.2,60.3,131.2,36.8,1.1,14.8,"YTNeo22[septoria, ve]",DISCARD,TRUE,,14,33,SI_Urb_22-974,6.86,15.2,60.4,947,SI_Urb_22-974,IL2021-18306
IL2021-10820,14-9527/14-21519,,429.2,71.2,59,132.1,36.2,0.8,14.7,YTUrb22[Tall],DISCARD,TRUE,,1,26,SI_Urb_22-780,5.4,14.2,59.4,1380,SI_Urb_22-780,IL2021-10820
IL2021-29420,14-9546/12-26004,,444.9,71.2,58.6,130.8,36.6,0.5,7.9,,KEEP,TRUE,,10,12,SI_Urb_22-351,5.95,11.7,62.8,670,SI_Urb_22-351,
IL2021-26262,12-21235/14-11312,,428.9,71.1,58.5,131.4,37.6,1,17.5,YTUrb22[Tall],DISCARD,TRUE,,23,23,SI_Urb_22-683,6,14,59.7,1343,SI_Urb_22-683,IL2021-26262
IL2021-15710,12-8545/14-28462,,445.9,71.1,59.9,131,34.7,0.4,5.6,YTUrb22[Leaning],DISCARD,TRUE,,19,44,SI_Urb_22-1302,4.83,11.9,61.6,282,SI_Urb_22-1302,IL2021-15710
