germplasmName,purdy.pedigree,decision,merit,Grain.yield...bu.ac,Grain.test.weight...lbs.bu,Heading.time...Julian.date..JD..,Plant.height.inches,FHB.DON.content...ppm.,FHB.grain.incidence.....,notes3,action,Found,Quick.Note.,range.,row.,plot_me.,Weight..lb.,Moisture....,Test.Weight..lb.bu.,Harvest.Sequence.,seedlot_me,ugid
IL2021-44433,14-28468/07-20728//14-28462,drop,483.2,82.4,59.2,131.2,37,1.5,19.7,YTUrb22[Scab],KEEP,TRUE,,25,25,SI_Urb_22-745,7.64,13.5,59.7,1416,SI_Urb_22-745,IL2021-44433
IL2021-30662,14-11772/16-27570,keep,477.3,82.4,59.4,132.6,37.1,1.4,19,,KEEP,TRUE,,29,15,SI_Urb_22-449,7.83,16,60.9,869,SI_Urb_22-449,
IL2021-28208,14-3934/14-28462,keep,496.6,82.4,58.6,132.6,36.6,0.6,9.2,YTUrb22[Disease],KEEP,TRUE,,14,36,SI_Urb_22-1067,7.35,11.7,63.1,767,SI_Urb_22-1067,IL2021-28208
IL2021-19436,P0762A1-2-8/14-11312,,472.8,82.4,58.1,134.3,36.7,1.1,19.5,,DISCARD,TRUE,,15,27,SI_Urb_22-795,7.8,14,59.4,1306,SI_Urb_22-795,
IL2021-15158,07-20728/14-28462,drop,467.9,82.3,59.3,132.4,35.1,1.6,29,,KEEP,TRUE,,13,44,SI_Urb_22-1308,5.19,11.5,63.2,288,SI_Urb_22-1308,
IL2021-15432,07-20743/14-11830,,477.7,82.3,58.9,133.5,35.3,1,18.1,YTUrb22[Disease],KEEP,TRUE,,21,44,SI_Urb_22-1300,5.78,11.7,61.9,280,SI_Urb_22-1300,IL2021-15432
IL2021-17961,14-28462/14-28468,keep,484.9,82.3,59.6,131.1,35.8,1.4,18.4,"YTNeo22[ve, npt]",KEEP,TRUE,,30,33,SI_Urb_22-990,5.22,16.5,57.3,931,SI_Urb_22-990,IL2021-17961
IL2021-25629,12-17428/12-21235,drop,473.6,82.3,59.6,132.5,38,1.4,22.6,YTUrb22[Tall],DISCARD,TRUE,,10,20,SI_Urb_22-591,7.76,14.5,60.8,1150,SI_Urb_22-591,IL2021-25629
IL2021-43938,14-28462/14-19503//14-28462,keep,500,82.3,59.4,131.3,35.9,0.7,12,"YTNeo22[ve, clean]",KEEP,TRUE,,25,48,SI_Urb_22-1416,6.12,11.8,62.3,36,SI_Urb_22-1416,IL2021-43938
IL2021-16820,02-19463-7/16-9335,keep,494.5,82.3,58.1,131.5,35.9,0.8,15.4,,KEEP,TRUE,,15,18,SI_Urb_22-526,7.48,15.2,59.7,1035,SI_Urb_22-526,
IL2021-43316,14-28462/07-20728//02-19463-7,keep,475.3,82.3,58.8,131.5,35.6,1.6,25.2,,KEEP,TRUE,,15,44,SI_Urb_22-1306,6.56,11.7,61.5,286,SI_Urb_22-1306,
IL2021-38662,14-11312/07-4415//14-28468,drop,475.4,82.3,58.8,131,35.9,1.6,28,YTUrb22[Leaning],KEEP,TRUE,,28,37,SI_Urb_22-1108,6.22,11.4,63.5,693,SI_Urb_22-1108,IL2021-38662
IL2021-43916,14-28462/14-11830//14-28468,keep,494.1,82.3,59.4,131.6,34.3,0.9,12,,KEEP,TRUE,,21,21,SI_Urb_22-621,7.68,14.6,60.3,1221,SI_Urb_22-621,
IL2021-47133,14-11848/07-19334//16-18944,,447.4,82.3,57.4,133.3,36.2,1.8,31.2,YTUrb22[Late],DISCARD,TRUE,,21,43,SI_Urb_22-1281,6.26,11.8,59.4,340,SI_Urb_22-1281,IL2021-47133
IL2021-32902,14-28444/14-11911,keep,512.7,82.3,59,131.9,36.3,0.2,0,,KEEP,TRUE,,9,21,SI_Urb_22-609,8,14,60.1,1209,SI_Urb_22-609,
IL2021-43334,14-28462/07-20728//10-21934,drop,476.3,82.3,57.9,131.6,35.6,1.5,21.9,"YTUrb22[Ve, looks good]",DISCARD,TRUE,,8,35,SI_Urb_22-1028,8.17,15.7,59.5,833,SI_Urb_22-1028,IL2021-43334
IL2021-2038,VA11W-108/07-24841,keep,493,82.3,58.1,132,34.1,0.7,15.3,,KEEP,TRUE,,11,24,SI_Urb_22-710,7.31,13.8,58,1391,SI_Urb_22-710,
IL2021-19221,P0762A1-2-8/12-17257,keep,469.6,82.3,57.9,132.4,35,1.6,22.8,,KEEP,TRUE,,22,12,SI_Urb_22-339,6.55,12.1,61.1,682,SI_Urb_22-339,
IL2021-37516,P0566A1-3-1-52/IL12-26004//14-11772,drop,488.8,82.3,59.6,131.7,38.3,1.1,14.1,,KEEP,TRUE,,25,16,SI_Urb_22-456,6.87,15.6,60.1,925,SI_Urb_22-456,
IL2021-13718,07-4415/14-28462,keep,479.5,82.2,59.4,130.5,35.1,1.6,25.5,,KEEP,TRUE,,25,46,SI_Urb_22-1356,4.85,11.3,63.1,156,SI_Urb_22-1356,
IL2021-36747,16-27570/14-28468,keep,511.1,82.2,59.6,130.6,35.2,0.6,3.2,,KEEP,TRUE,,12,9,SI_Urb_22-252,8.26,11.2,62.9,492,SI_Urb_22-252,
IL2021-42001,14-11772/07-20728//14-28462,drop,473.6,82.2,59,131.8,36.7,1.6,25,YTUrb22[Leaning],DISCARD,TRUE,,4,34,SI_Urb_22-1017,7.79,15.6,60.1,897,SI_Urb_22-1017,IL2021-42001
IL2021-16572,14-11830/07-20728,,489,82.2,58,133.9,35.8,0.4,11.3,"YTUrb22[Mixed, leaning]",KEEP,TRUE,,11,43,SI_Urb_22-1271,5.67,11.4,61,350,SI_Urb_22-1271,IL2021-16572
IL2021-29116,14-9546/12-17257,drop,495.5,82.2,59.4,131.9,35.9,0.8,10.1,YTUrb22[Leaning],KEEP,TRUE,,9,46,SI_Urb_22-1372,5.85,11.6,61.8,172,SI_Urb_22-1372,IL2021-29116
IL2021-19661,P0762A1-2-8/16-18944,drop,458.9,82.2,57.2,131.7,34.7,1.6,26.8,"YTUrb22[Plot damage, discard]",DISCARD,TRUE,,24,17,SI_Urb_22-504,7.88,15.8,58,984,SI_Urb_22-504,IL2021-19661
IL2021-15201,07-20728/14-28462,drop,489.8,82.1,60.5,132.3,38.3,0.9,11.9,,KEEP,TRUE,,7,12,SI_Urb_22-354,7.02,12,61.1,667,SI_Urb_22-354,
IL2021-22719,07-20728/15-13159,drop,465.5,82.1,58.8,132.8,37.3,1.6,26,YTUrb22[Tall],DISCARD,TRUE,,12,23,SI_Urb_22-672,8,14.1,60.4,1332,SI_Urb_22-672,IL2021-22719
IL2021-6132,07-24841/MD09W272-8-4-13-3-15,drop,497,82.1,58.3,131.4,37.7,0.7,15.2,,KEEP,TRUE,,6,10,SI_Urb_22-295,5.81,12.3,61.5,546,SI_Urb_22-295,
IL2021-13513,07-4415/14-11772,drop,466.2,82.1,56.7,130.9,36.9,1.2,21.2,,KEEP,TRUE,,7,46,SI_Urb_22-1374,7.12,11.4,60.9,174,SI_Urb_22-1374,
IL2021-8729,13-1960/IL12-26004,drop,501.7,82.1,58.9,131.2,36.9,0.7,7.7,YTNeo22[lodging],KEEP,TRUE,,20,47,SI_Urb_22-1400,4.76,12.2,60.6,101,SI_Urb_22-1400,IL2021-8729
IL2021-16944,14-11848/07-19334,,471.9,82.1,58.6,133.3,34.8,1.3,19.9,,KEEP,TRUE,,24,14,SI_Urb_22-397,6.96,15.6,59.8,804,SI_Urb_22-397,
IL2021-24241,10-21934/14-28444,keep,485.4,82.1,59.4,131.8,36.6,1.3,13,YTUrb22[A bit tall],KEEP,TRUE,,14,46,SI_Urb_22-1367,4.42,0,0,167,SI_Urb_22-1367,IL2021-24241
IL2021-45957,14-28444/P05247A1-7-3-120,keep,487.9,82.1,58.6,132.6,36.2,0.9,11.4,YTUrb22[Tall],KEEP,TRUE,,4,47,SI_Urb_22-1384,7.28,11.6,62.2,117,SI_Urb_22-1384,IL2021-45957
IL2021-35076,15-27270/12-17257,,479.5,82.1,59,133.1,34.7,1.1,16.2,YTUrb22[Leaning],KEEP,TRUE,,6,30,SI_Urb_22-895,7.5,14.4,61.5,1135,SI_Urb_22-895,IL2021-35076
IL2021-21218,07-4415/KY09C-1245-99-8-5,drop,477.6,82,57.7,130.7,35.6,1.4,24.4,"YTUrb22[Scab, Leaf rust]",KEEP,TRUE,,12,43,SI_Urb_22-1272,4.08,0,0,349,SI_Urb_22-1272,IL2021-21218
IL2021-25979,12-17428/16-30378,drop,469.1,82,59.5,132,36.6,1.7,25.8,YTUrb22[Leaning],DISCARD,TRUE,,6,26,SI_Urb_22-775,7.71,13.8,61.9,1375,SI_Urb_22-775,IL2021-25979
IL2021-827,KY09C-0052-26-12-3/IL13-451,keep,479.7,82,58.7,131.3,35,1.4,21.9,,KEEP,TRUE,,9,35,SI_Urb_22-1029,8.16,16,60.1,832,SI_Urb_22-1029,
IL2021-27036,12-26004/15-13159,drop,485.7,82,58,131.7,36.4,1.1,16.6,YTUrb22[Lodg],DISCARD,TRUE,,28,40,SI_Urb_22-1173,5.65,11.1,61.8,513,SI_Urb_22-1173,IL2021-27036
IL2021-11634,14-11750/IL13-10403,keep,491.8,82,59.1,131.5,34.5,0.8,16.4,,KEEP,TRUE,,21,27,SI_Urb_22-801,7.56,14.1,61.6,1300,SI_Urb_22-801,
IL2021-29011,14-9546/12-8512,keep,487.7,82,58.6,132.2,36.5,1,13.2,YTNeo22[clean],KEEP,TRUE,,14,39,SI_Urb_22-1154,6.23,11.8,63.2,587,SI_Urb_22-1154,IL2021-29011
IL2021-17103,14-11848/14-28462,keep,484.6,82,58.5,132.4,37.3,1,15.4,YTUrb22[Tall],KEEP,TRUE,,9,31,SI_Urb_22-909,7.97,14.8,59.4,1072,SI_Urb_22-909,IL2021-17103
IL2021-26330,12-21235/14-11916,drop,470.8,81.9,59.1,132.4,37.7,1.6,21.3,YTUrb22[Leaning],DISCARD,TRUE,,22,19,SI_Urb_22-562,7.36,14.8,60.9,1102,SI_Urb_22-562,IL2021-26330
IL2021-43277,14-28462/07-20728//02-19463-7,,484.2,81.9,59.2,133.1,37.8,0.8,14.1,,DISCARD,TRUE,,15,30,SI_Urb_22-886,8.32,14.5,60.5,1126,SI_Urb_22-886,
IL2021-24320,10-21934/14-28444,keep,472.6,81.9,58.9,132.1,36.2,1.4,24.8,YTUrb22[Leaning],KEEP,TRUE,,26,37,SI_Urb_22-1106,6.85,11.7,63.5,695,SI_Urb_22-1106,IL2021-24320
IL2021-43960,14-28462/14-19503//14-28462,keep,476.7,81.9,59.4,132.1,35.5,1.4,18.2,"YTNeo22[thin, clean, ve]",KEEP,TRUE,,21,30,SI_Urb_22-880,8.01,14.5,59.6,1120,SI_Urb_22-880,IL2021-43960
IL2021-17156,14-11848/14-28468,keep,485,81.9,58.7,132.4,36.9,1,15.6,,KEEP,TRUE,,26,12,SI_Urb_22-335,7.67,12.2,62.3,686,SI_Urb_22-335,
IL2021-28923,14-9546/P05247A1-7-3-120,drop,464.3,81.9,58.8,131.9,34.2,1.7,31.5,"YTUrb22[Npt, scab]",DISCARD,TRUE,,22,25,SI_Urb_22-742,7.78,13.5,61.1,1419,SI_Urb_22-742,IL2021-28923
IL2021-44235,14-28468/07-20728//02-19463-7,keep,489.4,81.9,58.7,132.8,37,0.7,12.6,,KEEP,TRUE,,8,8,SI_Urb_22-233,7,11.2,61,428,SI_Urb_22-233,
IL2021-1163,MO080104/10-21934,drop,462,81.9,57.8,131,35.4,2,30,YTUrb22[Mix],DISCARD,TRUE,,14,29,SI_Urb_22-854,7.66,15.1,57.6,1187,SI_Urb_22-854,IL2021-1163
IL2021-14775,07-19334/14-28468,drop,460.2,81.8,58.5,132.3,36.6,2,26.7,,DISCARD,TRUE,,30,44,SI_Urb_22-1291,5.5,11.6,61.1,271,SI_Urb_22-1291,
IL2021-7231,12-21624/IL09-3264-T2,keep,500.1,81.8,57.8,130.6,35.9,0.6,8.8,YTUrb22[Leaning],KEEP,TRUE,,3,28,SI_Urb_22-838,7.84,14,60.1,1258,SI_Urb_22-838,IL2021-7231
IL2021-43945,14-28462/14-19503//14-28462,keep,493.7,81.8,59,131.8,36.1,0.8,9.4,,KEEP,TRUE,,2,14,SI_Urb_22-419,7.19,16.1,58.8,782,SI_Urb_22-419,
IL2021-36737,16-27570/14-28468,drop,483.8,81.8,59.7,132.3,36.7,1.1,13.7,YTUrb22[Leaning],DISCARD,TRUE,,11,19,SI_Urb_22-551,7.97,14.4,61,1091,SI_Urb_22-551,IL2021-36737
IL2021-1839,MO150624/IL13-20616,drop,458.4,81.8,57.4,132.4,36.6,1.6,23.8,,KEEP,TRUE,,19,10,SI_Urb_22-282,6.9,11.9,60.8,559,SI_Urb_22-282,
IL2021-21815,07-19334/12-21235,drop,458.3,81.7,58.4,132.2,35.5,2.1,26.6,YTUrb22[Disease],DISCARD,TRUE,,9,36,SI_Urb_22-1072,7.46,11.9,63.2,772,SI_Urb_22-1072,IL2021-21815
IL2021-21708,07-19334/12-8512,,470.7,81.7,57.4,133,36,1,15.7,,KEEP,TRUE,,27,38,SI_Urb_22-1114,6.78,12.3,60.4,634,SI_Urb_22-1114,
IL2021-36658,16-27570/14-28462,keep,483.1,81.7,59.4,130.6,36.6,1.5,18.5,"YTUrb22[Leaning, sea of heads]",KEEP,TRUE,,13,19,SI_Urb_22-553,7.54,14.7,60.8,1093,SI_Urb_22-553,IL2021-36658
IL2021-44007,14-28462/14-19503//14-28462,keep,485.8,81.7,59.8,131.1,35.9,1.3,15.6,"YTNeo22[septoria, leaf rust]",KEEP,TRUE,,25,42,SI_Urb_22-1236,5.07,11.3,63.2,396,SI_Urb_22-1236,IL2021-44007
IL2021-21479,07-4415/14-3934,drop,458.1,81.7,56.4,132.1,36.2,1,16.4,YTUrb22[Tall],DISCARD,TRUE,,16,36,SI_Urb_22-1065,7.44,11.8,62.1,765,SI_Urb_22-1065,IL2021-21479
IL2021-15152,07-20728/14-28462,keep,483.9,81.7,59.1,131.5,36.2,1.1,19.1,,KEEP,TRUE,,16,10,SI_Urb_22-285,6.76,11.8,64.1,556,SI_Urb_22-285,
IL2021-16038,14-11772/07-20728,,463.6,81.7,59.9,133.9,37.1,1.3,23.2,,DISCARD,TRUE,,28,24,SI_Urb_22-693,7.3,13.6,61.3,1408,SI_Urb_22-693,
IL2021-31531,14-11916/12-21235,drop,459.4,81.7,57.9,132,36.5,1.9,29,,KEEP,TRUE,,19,16,SI_Urb_22-462,6.93,15.4,59.4,919,SI_Urb_22-462,
IL2021-43810,14-28462/14-11830//12-26004,drop,472.9,81.7,57.6,132.3,35.1,1.1,18.2,YTUrb22[Npt],DISCARD,TRUE,,5,30,SI_Urb_22-896,8.21,13.9,59.5,1136,SI_Urb_22-896,IL2021-43810
IL2021-44535,14-28468/14-11848//14-11312,drop,502,81.7,58.6,132.2,37.9,0.3,7.2,,KEEP,TRUE,,12,12,SI_Urb_22-349,7.34,11.7,61.3,672,SI_Urb_22-349,
IL2021-28027,14-3934/12-17257,drop,482,81.7,59.7,132.8,37,1.1,12.4,,KEEP,TRUE,,20,8,SI_Urb_22-221,6.22,11.3,60.6,440,SI_Urb_22-221,
IL2021-36435,16-27570/07-20728,,473.1,81.7,59.6,133.3,36,1.1,20.2,,KEEP,TRUE,,27,16,SI_Urb_22-454,8.18,15.8,61.1,927,SI_Urb_22-454,
IL2021-27813,14-3934/P05247A1-7-3-29,keep,485.6,81.7,58.5,132.8,36.3,0.9,11.6,YTUrb22[Late],KEEP,TRUE,,22,40,SI_Urb_22-1179,6.61,11,61.8,519,SI_Urb_22-1179,IL2021-27813
IL2021-19215,P0762A1-2-8/12-17257,drop,458.5,81.7,57.4,132.2,34.9,1.6,23,,DISCARD,TRUE,,21,17,SI_Urb_22-501,7.11,15.2,58.7,981,SI_Urb_22-501,
IL2021-21606,07-19334/12-8512,,471.7,81.6,59,133.1,37.4,1.4,17.4,YTUrb22[Lodging],DISCARD,TRUE,,26,46,SI_Urb_22-1355,5.15,12.5,61,155,SI_Urb_22-1355,IL2021-21606
IL2021-40427,07-20728/14-11848//12-21235,drop,477.4,81.6,60.1,132.4,37.4,1.2,17.7,YTUrb22[Leaning],KEEP,TRUE,,5,43,SI_Urb_22-1265,7.1,11.3,63.3,356,SI_Urb_22-1265,IL2021-40427
IL2021-5753,07-21847/IL13-451,drop,467.6,81.6,59,131.7,36.8,1.7,26.3,,DISCARD,TRUE,"6/27/2022, 3:46:03 PM, Tare Warning, Test Weight: 4.58",23,29,SI_Urb_22-863,7.35,14.7,60.4,1178,SI_Urb_22-863,
IL2021-21416,07-4415/12-17428,drop,458.4,81.6,57,132.7,38.2,1.2,19.7,YTUrb22[Tall],DISCARD,TRUE,,3,39,SI_Urb_22-1143,7.55,12.1,60.1,598,SI_Urb_22-1143,IL2021-21416
IL2021-10969,14-11312/07-4415,drop,471.5,81.6,57.3,130.5,35.6,1.4,20.4,"YTUrb22[Npt, sea of heads]",KEEP,TRUE,,18,28,SI_Urb_22-823,8.15,14.7,59,1243,SI_Urb_22-823,IL2021-10969
IL2021-19545,P0762A1-2-8/14-11911,,482.9,81.6,58.3,133.7,36.8,0.6,13.2,YTUrb22[Tall],KEEP,TRUE,,17,18,SI_Urb_22-524,6.97,14.4,61,1037,SI_Urb_22-524,IL2021-19545
IL2021-5021,07-4415/13-1910,drop,471.6,81.5,57.9,132,37,1.3,22.9,YTUrb22[Leaning],DISCARD,TRUE,,1,39,SI_Urb_22-1141,7.2,11.8,62.8,600,SI_Urb_22-1141,IL2021-5021
IL2021-1815,MO150624/07-4415,keep,487.8,81.5,57.9,131.2,36.6,1,14.6,,KEEP,TRUE,,10,13,SI_Urb_22-370,6.36,11.9,62,730,SI_Urb_22-370,
IL2021-14267,07-19334/14-11772,keep,486.5,81.5,58.6,131.5,36.5,1,15.8,YTUrb22[Lodging],KEEP,TRUE,,8,25,SI_Urb_22-728,7.34,13.9,60.8,1433,SI_Urb_22-728,IL2021-14267
IL2021-44031,14-28462/14-19503//14-28462,keep,505.6,81.5,59.9,131.5,36.8,0.3,4.9,YTUrb22[Npt],KEEP,TRUE,,26,29,SI_Urb_22-866,7.39,14.7,59.7,1175,SI_Urb_22-866,IL2021-44031
IL2021-15967,14-11772/07-4415,drop,446.7,81.5,57.3,132.9,37.2,1.8,28,YTNeo22[septoria],DISCARD,TRUE,,6,37,SI_Urb_22-1086,7.25,11.8,61.5,715,SI_Urb_22-1086,IL2021-15967
IL2021-30578,14-11772/16-18944,keep,476.3,81.5,58.7,131.6,36.5,1.4,22.3,,KEEP,TRUE,,24,8,SI_Urb_22-217,6.47,11.1,62.9,444,SI_Urb_22-217,
IL2021-42064,14-11772/14-11830//14-3934,,471.1,81.5,57.6,133,37,1,17.1,YTUrb22[Tall],DISCARD,TRUE,,30,39,SI_Urb_22-1170,5.53,12.1,60.3,571,SI_Urb_22-1170,IL2021-42064
IL2021-43341,14-28462/07-20728//10-21934,,468.7,81.5,57.8,133.9,37,1.1,15.4,"YTNeo22[tall, late]",DISCARD,TRUE,,17,48,SI_Urb_22-1424,5.65,12.3,60.7,44,SI_Urb_22-1424,IL2021-43341
IL2021-40847,07-20728/14-28468//15-25742,keep,491.6,81.5,58.9,132.1,35.5,0.7,10,YTNeo22[leaning],KEEP,TRUE,,26,44,SI_Urb_22-1295,5.28,11.5,60.7,275,SI_Urb_22-1295,IL2021-40847
IL2021-18501,14-28468/14-11830,drop,478.3,81.5,59.6,131.3,35,1.4,20.9,,DISCARD,TRUE,,18,39,SI_Urb_22-1158,7,11.8,63.9,583,SI_Urb_22-1158,
IL2021-36469,16-27570/07-20728,keep,472.6,81.5,60,132.6,36,1.2,22.5,,KEEP,TRUE,,12,27,SI_Urb_22-792,7.77,14.2,61,1309,SI_Urb_22-792,
IL2021-22113,07-19334/15-25742,keep,482.4,81.5,58.1,132.7,36.5,0.9,14,YTUrb22[Lodg],KEEP,TRUE,,13,22,SI_Urb_22-648,7.77,14.2,60.4,1273,SI_Urb_22-648,IL2021-22113
IL2021-39943,07-20728/07-4415//07-20728,keep,476.3,81.5,59.5,132.8,36.6,1,20.2,YTUrb22[Leaning],KEEP,TRUE,,20,24,SI_Urb_22-701,7.04,13.7,61.5,1400,SI_Urb_22-701,IL2021-39943
IL2021-20207,P05247A1-7-3-120/16-18944,drop,461.5,81.5,58.4,132.3,33.7,1.7,30.5,,DISCARD,TRUE,,9,17,SI_Urb_22-489,7.87,14.8,59.7,969,SI_Urb_22-489,
IL2021-14836,07-20728/07-4415,drop,494.6,81.4,59.5,131.6,37.4,0.5,13.7,,KEEP,TRUE,,1,11,SI_Urb_22-301,7.1,11.7,63.2,601,SI_Urb_22-301,
IL2021-22548,07-20728/14-3934,drop,488.9,81.4,58.8,132.7,37.9,0.6,11.8,,DISCARD,TRUE,,29,23,SI_Urb_22-689,6.92,14.6,59.9,1349,SI_Urb_22-689,
IL2021-41221,07-20743/14-28462//14-28462,drop,473.3,81.4,60.4,132.3,35.9,1.4,18.7,YTUrb22[Tall],DISCARD,TRUE,,26,39,SI_Urb_22-1166,6.08,11.7,64.7,575,SI_Urb_22-1166,IL2021-41221
IL2021-44623,14-28468/14-11848//14-11312,keep,477.7,81.4,58.2,131.2,36.1,1.4,22.1,,KEEP,TRUE,,27,46,SI_Urb_22-1354,4.39,0,0,154,SI_Urb_22-1354,
IL2021-8733,13-1960/IL12-26004,drop,482.1,81.4,58.5,130.7,36.1,1.3,21.3,YTUrb22[Leaning],DISCARD,TRUE,,11,17,SI_Urb_22-491,7.5,14.8,61.3,971,SI_Urb_22-491,IL2021-8733
IL2021-16457,14-11772/14-28468,drop,462.7,81.4,59.9,131.1,36.6,2.1,27.7,"YTUrb22[Tall, late]",DISCARD,TRUE,,7,35,SI_Urb_22-1027,7.8,15.6,60.2,834,SI_Urb_22-1027,IL2021-16457
IL2021-34276,15-10568/14-3934,keep,473.4,81.4,58.4,131.6,35.7,1.5,22.1,,KEEP,TRUE,,13,9,SI_Urb_22-253,6.79,11.2,60.6,493,SI_Urb_22-253,
IL2021-47050,14-11830/07-20728//16-4939,,468,81.4,58.6,133.2,33.7,1.2,25.7,,KEEP,TRUE,,14,25,SI_Urb_22-734,6.72,14,60.1,1427,SI_Urb_22-734,
IL2021-43920,14-28462/14-11830//14-28468,keep,482.5,81.4,59.6,131.7,35,1.1,17.1,YTNeo22[septoria],KEEP,TRUE,,26,21,SI_Urb_22-626,7.73,14.3,61.8,1226,SI_Urb_22-626,IL2021-43920
IL2021-18165,14-28468/07-19334,drop,464.6,81.4,59.4,132.9,36.5,1.6,21,YTUrb22[Leaning],DISCARD,TRUE,,25,36,SI_Urb_22-1056,7.42,11.9,63.7,756,SI_Urb_22-1056,IL2021-18165
IL2021-28068,14-3934/14-11312,,466.4,81.4,57.7,133.1,37.2,1.3,19,YTUrb22[Leaning],DISCARD,TRUE,,27,37,SI_Urb_22-1107,6.82,12,61.4,694,SI_Urb_22-1107,IL2021-28068
IL2021-22818,07-20743/12-17257,drop,479.9,81.3,60.1,132.6,37.2,1,16.7,YTUrb22[Lodging],KEEP,TRUE,,4,23,SI_Urb_22-664,7.8,14.2,60.8,1324,SI_Urb_22-664,IL2021-22818
IL2021-25478,12-17257/14-11772,keep,485.4,81.3,59.2,131.2,35.3,1.2,14,,KEEP,TRUE,,28,14,SI_Urb_22-393,7.65,16,60.4,808,SI_Urb_22-393,
IL2021-27644,13-1910/12-17257,drop,472.5,81.3,59.1,132.3,34.9,1.4,19.4,,DISCARD,TRUE,,25,31,SI_Urb_22-925,6.69,14.9,60.3,1056,SI_Urb_22-925,
IL2021-27659,13-1910/12-17257,drop,456.7,81.3,59,132.7,35,1.9,28.8,YTUrb22[Short],DISCARD,TRUE,,18,42,SI_Urb_22-1243,4.78,11.6,60.7,403,SI_Urb_22-1243,IL2021-27659
IL2021-25226,12-17257/P05247A1-7-3-120,keep,477,81.3,58.4,131.9,35.4,1.3,18.8,,KEEP,TRUE,,6,43,SI_Urb_22-1266,7.09,11.2,62.9,355,SI_Urb_22-1266,
IL2021-17506,14-28462/07-20728,keep,471.4,81.3,60,132.4,35.7,1.3,20.9,,KEEP,TRUE,,30,11,SI_Urb_22-330,6.65,12,61.6,630,SI_Urb_22-330,
IL2021-1571,MO080104/14-29714,drop,460.7,81.3,58.6,132.5,38.1,1.8,26.4,YTUrb22[Tall],DISCARD,TRUE,,14,21,SI_Urb_22-614,7.56,14.7,58.7,1214,SI_Urb_22-614,IL2021-1571
IL2021-19949,P05247A1-7-3-108-2/13-1910,drop,475.5,81.3,58.8,132.5,37.7,1.2,18.5,YTUrb22[Tall],DISCARD,TRUE,,10,22,SI_Urb_22-651,6.35,14.2,58.2,1270,SI_Urb_22-651,IL2021-19949
IL2021-26309,12-21235/14-11312,drop,481.2,81.2,58.4,132.5,39.1,1,13.5,,KEEP,TRUE,,7,13,SI_Urb_22-367,6.04,12,62.5,727,SI_Urb_22-367,
IL2021-15939,14-11772/07-4415,drop,476.4,81.2,58.4,131.7,38.1,1.2,20.8,YTNeo22[tall],DISCARD,TRUE,,13,46,SI_Urb_22-1368,3.95,0,0,168,SI_Urb_22-1368,IL2021-15939
IL2021-30622,14-11772/16-18944,drop,475.4,81.2,58.9,131.3,36.4,1.4,22.4,,DISCARD,TRUE,,21,31,SI_Urb_22-921,6.96,14.8,59.5,1060,SI_Urb_22-921,
IL2021-3532,P05247A1-7-3-120/14-11750,keep,493.3,81.2,58.7,131.6,35.9,0.6,11.3,,KEEP,TRUE,,7,15,SI_Urb_22-427,7.23,15.9,58.5,847,SI_Urb_22-427,
IL2021-18425,14-28468/14-11830,drop,471.5,81.2,58.8,132.1,33.8,1.4,21.1,"YTUrb22[Npt, Mix]",DISCARD,TRUE,,28,33,SI_Urb_22-988,6.89,15.8,59.9,933,SI_Urb_22-988,IL2021-18425
IL2021-39615,07-19334/07-20728//16-18944,keep,472.8,81.2,58.6,132.5,36.1,1.2,21.6,YTUrb22[Leaning],KEEP,TRUE,,30,21,SI_Urb_22-630,6.72,14.8,58.9,1230,SI_Urb_22-630,IL2021-39615
IL2021-45914,14-9542/KY09C-1245-99-8-5,drop,457.5,81.2,58.3,132.7,35.4,1.8,28.5,"YTUrb22[Erect, late]",DISCARD,TRUE,,5,18,SI_Urb_22-536,6.8,14.5,58.6,1025,SI_Urb_22-536,IL2021-45914
IL2021-16772,14-11830/14-28468,keep,482.5,81.2,58.9,132.6,35.2,0.9,13.6,YTUrb22[Leaning],KEEP,TRUE,,3,26,SI_Urb_22-778,7.29,13.8,60.8,1378,SI_Urb_22-778,IL2021-16772
IL2021-19778,P05247A1-7-3-108-2/12-21235,drop,470.2,81.2,58.5,132.7,38.1,1.3,20.8,YTUrb22[Tall],DISCARD,TRUE,,14,16,SI_Urb_22-467,8,15.2,59.6,914,SI_Urb_22-467,IL2021-19778
IL2021-3829,P0566A1-3-1-52/13-1910,drop,481.2,81.2,58.6,131.3,35.3,1.3,14.9,YTUrb22[See down row],DISCARD,TRUE,,15,24,SI_Urb_22-706,8.53,13.9,60.7,1395,SI_Urb_22-706,IL2021-3829
IL2021-40751,07-20728/14-28468//15-25742,keep,503.9,81.1,59.8,130.7,36.4,0.4,8,YTNeo22[leaning],KEEP,TRUE,,22,42,SI_Urb_22-1239,4.82,11.5,61.9,399,SI_Urb_22-1239,IL2021-40751
IL2021-13728,07-4415/14-28462,drop,474.8,81.1,57.4,130.4,34.8,1.2,18.2,,KEEP,TRUE,,17,25,SI_Urb_22-737,7.61,13.5,58.9,1424,SI_Urb_22-737,
IL2021-42343,14-11830/14-28462//12-8512,keep,483.4,81.1,58.1,131.3,34.7,1,18.8,"YTUrb22[Ve, mix]",KEEP,TRUE,,12,42,SI_Urb_22-1249,4.92,11.1,60.9,409,SI_Urb_22-1249,IL2021-42343
IL2021-26766,12-26004/07-19334,,470.9,81.1,58,133.2,36.3,1.2,16.9,,DISCARD,TRUE,,26,23,SI_Urb_22-686,7.69,14,60.3,1346,SI_Urb_22-686,
IL2021-47108,14-11848/07-19334//14-11911,,463.4,81.1,58.1,134.3,35.4,1.2,19.3,,DISCARD,TRUE,,18,35,SI_Urb_22-1038,7.32,15.9,58.7,823,SI_Urb_22-1038,
IL2021-40317,07-20728/14-11830//12-17257,keep,484.8,81.1,59.1,132.7,35.1,0.7,11.8,,KEEP,TRUE,,3,42,SI_Urb_22-1258,6.58,11.3,62.3,418,SI_Urb_22-1258,
IL2021-14673,07-19334/14-28462,,464.4,81,59.1,133.3,37.8,1.4,19.4,YTUrb22[Leaning],DISCARD,TRUE,,3,25,SI_Urb_22-723,8.14,13.6,61,1438,SI_Urb_22-723,IL2021-14673
IL2021-27611,13-1910/12-17257,keep,490.5,81,59.4,131.8,35.3,0.7,11,,KEEP,TRUE,,12,14,SI_Urb_22-409,7.39,15.4,60.1,792,SI_Urb_22-409,
IL2021-14556,07-19334/14-28462,keep,478.3,81,58.6,132.4,34.7,1,16.5,,KEEP,TRUE,,18,13,SI_Urb_22-378,7.28,11.9,63.5,738,SI_Urb_22-378,
IL2021-29441,14-9546/15-13159,drop,460.1,81,59.2,131.4,34.7,1.9,32.1,"YTUrb22[Npt, scab]",DISCARD,TRUE,,25,37,SI_Urb_22-1105,5.82,11.6,62.7,696,SI_Urb_22-1105,IL2021-29441
IL2021-37545,P0566A1-3-1-52/IL12-26004//14-11772,drop,478.5,81,59.4,130.7,36.5,1.5,19.2,YTUrb22[Looks weak],DISCARD,TRUE,,20,40,SI_Urb_22-1181,6.98,11.2,62.5,521,SI_Urb_22-1181,IL2021-37545
IL2021-15029,07-20728/12-8545,,475.1,80.9,59.7,133.4,36.9,0.9,16,YTUrb22[Leaning],KEEP,TRUE,,26,41,SI_Urb_22-1226,5.7,11.2,63.1,455,SI_Urb_22-1226,IL2021-15029
IL2021-25425,12-17257/14-11772,drop,478.5,80.9,59.5,131.8,35.8,1.2,16,YTUrb22[Leaning],DISCARD,TRUE,,6,45,SI_Urb_22-1326,7.08,11.6,62.5,235,SI_Urb_22-1326,IL2021-25425
IL2021-26002,12-17428/16-30378,drop,468.4,80.9,59.4,132.5,37.2,1.4,21.6,YTUrb22[Leaning],DISCARD,TRUE,,24,23,SI_Urb_22-684,7.58,13.9,61.7,1344,SI_Urb_22-684,IL2021-26002
IL2021-41914,14-11772/07-20728//12-8512,drop,485.7,80.9,59.6,132,37.2,0.7,14.2,,DISCARD,TRUE,,15,34,SI_Urb_22-1006,7.33,15.8,60,886,SI_Urb_22-1006,
IL2021-31359,14-11916/12-17257,keep,470.9,80.9,58,131.6,34.3,1.5,22,,KEEP,TRUE,,22,16,SI_Urb_22-459,7.1,14.9,61.9,922,SI_Urb_22-459,
IL2021-27918,14-3934/12-8512,,481.7,80.9,58.6,133.1,35.8,0.7,11.3,YTUrb22[Tall],KEEP,TRUE,,9,32,SI_Urb_22-952,6.99,15.5,58,1012,SI_Urb_22-952,IL2021-27918
IL2021-27863,14-3934/OH09-207-68,drop,452.9,80.9,59.4,132.2,36.2,2,31.2,YTUrb22[Bearded],DISCARD,TRUE,,2,41,SI_Urb_22-1202,6.61,11.5,61.8,479,SI_Urb_22-1202,IL2021-27863
IL2021-1776,MO150624/07-4415,drop,455.4,80.9,57.7,131.5,36.8,1.8,30.6,,DISCARD,TRUE,,3,38,SI_Urb_22-1138,7.36,11.6,62.1,658,SI_Urb_22-1138,
IL2021-18531,,drop,479.8,80.9,59.3,132.3,36.1,1,15.6,YTUrb22[Mix],KEEP,TRUE,,8,31,SI_Urb_22-908,7.74,14.8,61,1073,SI_Urb_22-908,IL2021-18531
IL2021-21560,07-19334/10-21934,,471,80.8,57.7,133.3,36.8,0.9,13.8,YTUrb22[Leaning],KEEP,TRUE,,30,23,SI_Urb_22-690,6.98,14.2,59.2,1350,SI_Urb_22-690,IL2021-21560
