germplasmName,purdy.pedigree,decision,merit,Grain.yield...bu.ac,Grain.test.weight...lbs.bu,Heading.time...Julian.date..JD..,Plant.height.inches,FHB.DON.content...ppm.,FHB.grain.incidence.....,notes3,action,Found,Quick.Note.,range.,row.,plot_me.,Weight..lb.,Moisture....,Test.Weight..lb.bu.,Harvest.Sequence.,seedlot_me,ugid
IL2021-41331,12-8545/07-20728//14-28307,,435.4,71,58.7,132.2,36.3,0.5,9.1,YTUrb22[Leaning],DISCARD,TRUE,,10,43,SI_Urb_22-1270,3.8,0,0,351,SI_Urb_22-1270,IL2021-41331
IL2021-27746,13-1910/16-21114,,425.5,71,59.7,130.5,34.1,1.4,20.7,"YTUrb22[Ve, looks a bit weak]",DISCARD,TRUE,,27,31,SI_Urb_22-927,6.19,14.9,59.7,1054,SI_Urb_22-927,IL2021-27746
IL2021-46521,MO080104/14-21519//15-27270,,427.1,71,58.5,131.8,38.1,1,14.9,YTUrb22[Small heads],DISCARD,TRUE,,21,35,SI_Urb_22-1041,6.47,15.9,59.8,820,SI_Urb_22-1041,IL2021-46521
IL2021-26932,12-26004/14-11312,,455.2,70.9,58.1,130.6,35.7,0,1.3,,DISCARD,TRUE,,29,44,SI_Urb_22-1292,5.04,11.7,60.5,272,SI_Urb_22-1292,
IL2021-31763,14-11916/15-25742,,434.4,70.9,58.4,131.1,36.5,0.8,13.5,YTUrb22[Short],DISCARD,TRUE,,6,20,SI_Urb_22-595,6.24,15.4,56.2,1146,SI_Urb_22-595,IL2021-31763
IL2021-44110,14-28462/14-19503//16-4939,,424.7,70.9,59.3,130.1,35.1,1.4,24,"YTUrb22[Short, early, no disease]",DISCARD,TRUE,,12,25,SI_Urb_22-732,7.9,13.7,60.4,1429,SI_Urb_22-732,IL2021-44110
IL2021-8368,IL13-451/14-21519,,426.6,70.9,59.2,132,37.6,0.9,15.4,YTUrb22[Lodging],DISCARD,TRUE,,12,28,SI_Urb_22-829,6.71,14.5,60.8,1249,SI_Urb_22-829,IL2021-8368
IL2021-7627,12-26448/MO080104,,418.9,70.8,57.3,132.6,35.1,0.7,12.3,,KEEP,TRUE,,20,11,SI_Urb_22-320,5.71,11.9,62.4,620,SI_Urb_22-320,
IL2021-43641,14-28462/12-8545//13-1910,,436.6,70.8,59.3,132,35.6,0.5,7.7,YTUrb22[Tall],DISCARD,TRUE,,28,21,SI_Urb_22-628,6.64,14.4,61.5,1228,SI_Urb_22-628,IL2021-43641
IL2021-34815,15-25742/,,435.1,70.8,58.8,131.4,36.7,0.6,11.4,,DISCARD,TRUE,,21,24,SI_Urb_22-700,6.46,13.6,59.8,1401,SI_Urb_22-700,
IL2021-2158,VA11W-108/12-8512,,412.6,70.8,58.3,131.1,36.2,1.6,30.1,"YTUrb22[Mixed, damaged plot]",DISCARD,TRUE,,7,21,SI_Urb_22-607,7.34,14.5,58.8,1207,SI_Urb_22-607,IL2021-2158
IL2021-4310,02-19463-5/IL12-26004,,426.3,70.7,57.8,130.7,35.2,1,19.8,,KEEP,TRUE,,9,14,SI_Urb_22-412,6.8,16,59,789,SI_Urb_22-412,
IL2021-7037,12-8512/14-9923,,425.6,70.7,57.9,130,36.5,1.3,22.4,YTUrb22[Tall],DISCARD,TRUE,,18,38,SI_Urb_22-1123,6.32,11.7,63.3,643,SI_Urb_22-1123,IL2021-7037
IL2021-32969,14-28444/14-11911,,443.6,70.7,59.2,130.8,35.2,0.5,6,YTUrb22[Leaning],DISCARD,TRUE,,6,38,SI_Urb_22-1135,6.1,11.7,62.9,655,SI_Urb_22-1135,IL2021-32969
IL2021-33408,14-28462/12-26004,,432.2,70.7,57.5,129.4,33.2,1,13.3,"YTUrb22[Ve, short]",DISCARD,TRUE,,29,17,SI_Urb_22-509,6.7,14.4,58.8,989,SI_Urb_22-509,IL2021-33408
IL2021-35661,16-4939/12-17428,,434.3,70.7,59.2,130.9,35.3,0.7,15.2,,DISCARD,TRUE,,17,17,SI_Urb_22-497,7.41,15.3,60.1,977,SI_Urb_22-497,
IL2021-6429,10-21934/14-9923,,427.1,70.6,57.9,130.6,35,1.1,18.4,YTUrb22[Ve],DISCARD,TRUE,"6/27/2022, 3:50:39 PM, Tare Warning, Test Weight: -2.87",19,29,SI_Urb_22-859,7.08,14.7,59.1,1182,SI_Urb_22-859,IL2021-6429
IL2021-269,GA081628-G1-G2-G1-G23/14-9923,,412.6,70.6,56.4,131.2,33.9,0.6,12.9,YTUrb22[Leaning],DISCARD,TRUE,,18,48,SI_Urb_22-1423,3.59,0,0,43,SI_Urb_22-1423,IL2021-269
IL2021-7009,12-8512/14-9923,,433.8,70.5,58.3,131.3,35.6,0.6,12.9,YTUrb22[Tall],DISCARD,TRUE,,29,28,SI_Urb_22-812,6.39,14.4,59.4,1232,SI_Urb_22-812,IL2021-7009
IL2021-6964,12-8512/14-9923,,431.9,70.5,58.1,130.8,36.2,0.8,16.4,YTUrb22[Npt],DISCARD,TRUE,,20,27,SI_Urb_22-800,6.64,14.1,58.7,1301,SI_Urb_22-800,IL2021-6964
IL2021-26274,12-21235/14-11312,,422.9,70.4,58.1,132.8,37.6,0.9,10.2,,DISCARD,TRUE,,23,42,SI_Urb_22-1238,4.88,11.9,60.5,398,SI_Urb_22-1238,
IL2021-30369,14-11772/12-21235,,430.6,70.4,59.9,130.8,35.3,1,14.3,,KEEP,TRUE,,6,15,SI_Urb_22-426,5.97,15.7,58.9,846,SI_Urb_22-426,
IL2021-31744,14-11916/15-25742,,437.5,70.4,59.4,130.2,36.6,0.7,12.1,"YTUrb22[Ve, leaning]",DISCARD,TRUE,,14,24,SI_Urb_22-707,6.5,14,61.3,1394,SI_Urb_22-707,IL2021-31744
IL2021-8412,IL13-451/14-21519,,419.3,70.4,58.7,131.6,37.7,1.3,17.7,YTUrb22[Leaning],DISCARD,TRUE,,6,21,SI_Urb_22-606,5.71,14.7,59,1206,SI_Urb_22-606,IL2021-8412
IL2021-4715,07-4415/MD09W272-8-4-13-3-15,,427.3,70.3,58,130.7,36,1,19.7,YTUrb22[Tall],DISCARD,TRUE,,28,43,SI_Urb_22-1288,4.16,0,0,333,SI_Urb_22-1288,IL2021-4715
IL2021-3271,P05247A1-7-3-108-2/14-21519,,423.8,70.3,58.2,130.7,34.4,1.2,19.6,,DISCARD,TRUE,,4,16,SI_Urb_22-477,6.23,15.6,58.2,904,SI_Urb_22-477,
IL2021-21072,02-19463-7/12-26004,,432.1,70.2,58.6,129.7,34.9,1.1,17.1,,KEEP,TRUE,,6,11,SI_Urb_22-306,6.45,11.9,62.6,606,SI_Urb_22-306,
IL2021-6116,07-21847/14-21519,,410.5,70.2,59.3,130.8,35.4,1.8,27.3,,DISCARD,TRUE,,8,17,SI_Urb_22-488,6.8,15.3,59.4,968,SI_Urb_22-488,
IL2021-26263,12-21235/14-11312,,412.1,70.2,58.1,130.8,35.4,1.8,25.2,,DISCARD,TRUE,,21,45,SI_Urb_22-1341,4.71,11.8,61.5,220,SI_Urb_22-1341,
IL2021-34808,15-25742/,,425.6,70.1,58.1,131.2,35.8,0.9,16.3,YTUrb22[Ve],DISCARD,TRUE,,19,24,SI_Urb_22-702,6.75,13.8,58.5,1399,SI_Urb_22-702,IL2021-34808
IL2021-24479,10-21934/15-13159,,406.8,70,58.1,131.8,36.2,1.6,26.4,,KEEP,TRUE,,6,13,SI_Urb_22-366,5.94,11.9,62.2,726,SI_Urb_22-366,
IL2021-40711,07-20728/14-28462//14-28444,,431.3,69.9,60.7,130.9,37.6,0.8,10.9,,DISCARD,TRUE,,5,42,SI_Urb_22-1256,5.86,11,64.4,416,SI_Urb_22-1256,
IL2021-6761,12-8512/IL12-26004,,441.3,69.9,58.6,129.9,36.4,0.6,8,"YTUrb22[Leaning, ve]",DISCARD,TRUE,,12,35,SI_Urb_22-1032,6.53,15.7,57.7,829,SI_Urb_22-1032,IL2021-6761
IL2021-18732,MO080104/12-17257,,409,69.9,58.6,132.1,36.1,1.5,20.9,,DISCARD,TRUE,,23,33,SI_Urb_22-983,5.48,15.4,60.1,938,SI_Urb_22-983,
IL2021-6841,12-8512/IL12-26004,,435.3,69.7,57.9,129.6,36.1,0.7,13.2,YTUrb22[Tall],DISCARD,TRUE,,18,46,SI_Urb_22-1363,2.52,0,0,163,SI_Urb_22-1363,IL2021-6841
IL2021-377,GA081628-G1-G2-G1-G23/14-11312,,398.5,69.7,56.8,132.2,34.3,1.1,17,YTUrb22[Late],DISCARD,TRUE,,11,40,SI_Urb_22-1190,5.8,11.8,60.4,530,SI_Urb_22-1190,IL2021-377
IL2021-34837,15-25742/,,421,69.5,58.2,130.6,35.5,1.2,17.3,"YTUrb22[Npt, sea of heads, early]",DISCARD,TRUE,,27,30,SI_Urb_22-874,6.7,14.6,59.4,1114,SI_Urb_22-874,IL2021-34837
IL2021-12548,14-26228/07-4415,,429.2,69.4,58.5,129.8,36.1,0.9,16.4,,KEEP,TRUE,,27,13,SI_Urb_22-387,6.83,12,61.7,747,SI_Urb_22-387,
IL2021-1820,MO150624/07-4415,,432.6,69.4,57.9,130.5,37.8,0.6,8.9,,KEEP,TRUE,,8,13,SI_Urb_22-368,5.75,12.4,61.1,728,SI_Urb_22-368,
IL2021-27120,12-21235/KY09C-1245-99-8-5,,430.6,69.2,58,131.7,36.3,0.4,6.1,,DISCARD,TRUE,,29,31,SI_Urb_22-929,7.07,14.7,59.7,1052,SI_Urb_22-929,
IL2021-32965,14-28444/14-11911,,438.1,69.2,59.5,129.7,34.8,0.6,8,YTUrb22[Looks weak],DISCARD,TRUE,,3,20,SI_Urb_22-598,6.35,14.2,60.1,1143,SI_Urb_22-598,IL2021-32965
IL2021-1805,MO150624/07-4415,,402.1,69.2,57.5,130.1,36.2,1.8,27.9,"YTUrb22[Erect, full grains]",DISCARD,TRUE,,17,46,SI_Urb_22-1364,5.07,11.6,59.3,164,SI_Urb_22-1364,IL2021-1805
IL2021-138,GA081628-G1-G2-G1-G23/P0566A1-3-1-52,,407.3,69.1,59,130.3,35.6,1.8,27.3,YTUrb22[Bearded],DISCARD,TRUE,,21,37,SI_Urb_22-1101,6.59,11.5,63.2,700,SI_Urb_22-1101,IL2021-138
IL2021-27067,12-21235/KY09C-1245-99-8-5,,412,69,57.9,131.2,36.1,1.3,17.5,"YTUrb22[Bearded, ve]",DISCARD,TRUE,,27,40,SI_Urb_22-1174,5.34,10.9,62.3,514,SI_Urb_22-1174,IL2021-27067
IL2021-16465,14-11772/14-28468,,404.6,68.9,59.3,131.2,34.9,1.7,23.9,,DISCARD,TRUE,,3,34,SI_Urb_22-1018,6.92,15.8,59.8,898,SI_Urb_22-1018,
IL2021-46526,MO080104/14-21519//15-27270,,419.8,68.7,58.5,131.8,36.4,0.7,12,YTUrb22[Tall],DISCARD,TRUE,,24,43,SI_Urb_22-1284,4.86,12.2,61.1,337,SI_Urb_22-1284,IL2021-46526
IL2021-1778,MO150624/07-4415,,410.3,68.6,57.1,130.2,37.1,1,14.9,"YTUrb22[Mix, tall]",DISCARD,TRUE,,29,46,SI_Urb_22-1352,4.71,11.9,59.3,152,SI_Urb_22-1352,IL2021-1778
IL2021-26323,12-21235/14-11312,,403.5,68.4,57.8,130.7,34.6,1.7,22,YTUrb22[Mix],DISCARD,TRUE,,5,31,SI_Urb_22-905,7.54,15.5,57.8,1076,SI_Urb_22-905,IL2021-26323
IL2021-18661,MO080104/P0762A1-2-8,,383.3,68.4,56.5,131.7,34.1,1.3,23.4,YTUrb22[Leaning],DISCARD,TRUE,,29,33,SI_Urb_22-989,5.19,15.3,56.3,932,SI_Urb_22-989,IL2021-18661
IL2021-9509,IL13-20616/14-9527,,414.2,68.3,58.5,130.9,34.6,1.1,19.1,YTUrb22[Leaning],DISCARD,TRUE,,7,19,SI_Urb_22-547,6.39,15,60.1,1087,SI_Urb_22-547,IL2021-9509
IL2021-11835,14-11772/07-4415,,414.5,68.2,58.5,130.6,36.2,1.1,19.2,,DISCARD,TRUE,,16,27,SI_Urb_22-796,6.57,14.3,58.7,1305,SI_Urb_22-796,
IL2021-34238,15-10568/13-1910,,402.9,68.1,58.5,131.9,34.9,1.3,21.4,,KEEP,TRUE,,24,12,SI_Urb_22-337,7.28,12,62.4,684,SI_Urb_22-337,
IL2021-27713,13-1910/16-21114,,386.7,68,58.7,132.4,37.4,1.9,30.2,YTUrb22[Lodging],DISCARD,TRUE,,28,31,SI_Urb_22-928,6.19,15.1,60.8,1053,SI_Urb_22-928,IL2021-27713
IL2021-30274,14-11772/12-8512,,411.5,68,60.1,131.4,37,1.1,14.7,YTUrb22[Tall],DISCARD,TRUE,,29,32,SI_Urb_22-932,5,15.9,59.1,992,SI_Urb_22-932,IL2021-30274
IL2021-43172,14-28462/07-19334//12-26004,,424.9,68,58.8,130.3,36.4,0.8,9.6,,DISCARD,TRUE,,9,24,SI_Urb_22-712,6.86,13.7,59.7,1389,SI_Urb_22-712,
IL2021-27144,12-21235/KY09C-1245-99-8-5,,407.5,67.6,57.2,131.1,35.8,0.7,12.4,,DISCARD,TRUE,,21,32,SI_Urb_22-940,6.75,15.2,57.2,1000,SI_Urb_22-940,
IL2021-34709,15-25742/12-26004,,425.4,67.6,58.5,129.5,35.8,0.8,12.6,YTUrb22[Leaning],DISCARD,TRUE,,29,30,SI_Urb_22-872,6.17,14.6,59.5,1112,SI_Urb_22-872,IL2021-34709
IL2021-8217,IL13-451/12-8512,,401.3,67.6,59.1,130.7,36.5,1.6,23.9,YTUrb22[Leaning],DISCARD,TRUE,,13,28,SI_Urb_22-828,6.85,14.3,60.9,1248,SI_Urb_22-828,IL2021-8217
IL2021-8714,13-1960/IL12-26004,,417.9,67.5,58.5,130.4,36.2,1,12.1,YTUrb22[Leaning],DISCARD,TRUE,,13,21,SI_Urb_22-613,7.52,14.6,60.1,1213,SI_Urb_22-613,IL2021-8714
IL2021-7615,12-26448/MO080104,,410.2,67.4,58.6,132,35.9,0.8,12.5,YTUrb22[Bearded],DISCARD,TRUE,,10,40,SI_Urb_22-1191,5.53,11.3,62.1,531,SI_Urb_22-1191,IL2021-7615
IL2021-31901,14-11916/W17x118,,410.7,67.4,59.4,130.8,36.5,1.2,14.4,,DISCARD,TRUE,,27,22,SI_Urb_22-634,6.13,14.5,61.5,1287,SI_Urb_22-634,
IL2021-2835,MD09W272-8-4-13-3-15/12-26448,,398.5,67.4,58.6,131,36.2,1.5,25.7,"YTUrb22[Tall, ve]",DISCARD,TRUE,,17,22,SI_Urb_22-644,5.83,14.3,59.1,1277,SI_Urb_22-644,IL2021-2835
IL2021-3521,P05247A1-7-3-120/14-11750,,386.3,67.3,58.9,132.1,34.1,1.8,30.7,YTUrb22[Mix],DISCARD,TRUE,,17,24,SI_Urb_22-704,6.27,13.8,60.7,1397,SI_Urb_22-704,IL2021-3521
IL2021-12341,14-21519/14-11750,,415.3,67.1,59.2,131,34.5,0.7,13.5,YTUrb22[ve],DISCARD,TRUE,,11,26,SI_Urb_22-770,7.18,14.2,60.5,1370,SI_Urb_22-770,IL2021-12341
IL2021-24531,10-21934/15-13159,,396.2,67,57.5,130.2,35.4,1.5,21.5,,DISCARD,TRUE,,23,36,SI_Urb_22-1058,6.76,11.7,62.6,758,SI_Urb_22-1058,
IL2021-6937,12-8512/14-9527,,415.3,67,58.1,130.8,36.1,0.7,13.7,,DISCARD,TRUE,,19,39,SI_Urb_22-1159,5.52,11.7,62.5,582,SI_Urb_22-1159,
IL2021-40877,07-20728/14-28468//15-25742,,429,66.9,60,129.7,35.1,0.3,7.5,YTUrb22[Lodging],DISCARD,TRUE,,9,33,SI_Urb_22-969,6.28,15.3,59.1,952,SI_Urb_22-969,IL2021-40877
IL2021-8468,13-1910/12-30879,,409.4,66.8,59,131.1,36.7,0.9,13.6,YTUrb22[Leaning],DISCARD,TRUE,,9,47,SI_Urb_22-1389,4.39,0,0,112,SI_Urb_22-1389,IL2021-8468
IL2021-30127,14-11312/16-18944,drop,397.9,66.7,57.7,131.4,34.8,1.2,15.6,,KEEP,TRUE,,14,8,SI_Urb_22-227,7.2,11.2,60.5,434,SI_Urb_22-227,
IL2021-39466,07-19334/07-4415//16-9335,,409,66.6,58.9,130.8,35.3,1,13.9,YTUrb22[Leaning],DISCARD,TRUE,,6,24,SI_Urb_22-715,6.22,14,60.9,1386,SI_Urb_22-715,IL2021-39466
IL2021-38603,13-1960/IL12-26004//12-8512,,409.6,66.6,59.1,130.2,36.8,1.1,15.9,YTUrb22[Looks weak],DISCARD,TRUE,,4,20,SI_Urb_22-597,6.19,14.5,60.4,1144,SI_Urb_22-597,IL2021-38603
IL2021-11915,14-11772/12-8512,,401.6,66.4,59.5,130.5,35.7,1.3,20.2,YTUrb22[Ve],DISCARD,TRUE,,17,28,SI_Urb_22-824,6.34,14.5,59.7,1244,SI_Urb_22-824,IL2021-11915
IL2021-33860,14-28468/12-21235,,414.4,66.4,59.2,131,35.5,0.7,7.7,YTUrb22[Bearded],DISCARD,TRUE,,7,39,SI_Urb_22-1147,5.22,11.5,62.7,594,SI_Urb_22-1147,IL2021-33860
IL2021-1956,MO150624/14-21519,,396.1,66.4,59.1,130.8,36.6,1.5,22.4,YTUrb22[Disease],DISCARD,TRUE,,25,38,SI_Urb_22-1116,4.92,11.8,62.3,636,SI_Urb_22-1116,IL2021-1956
IL2021-29823,14-11312/12-21235,,421.2,66.3,58.5,130.9,36.6,0.3,3.2,,DISCARD,TRUE,,18,22,SI_Urb_22-643,6.06,14.1,58.7,1278,SI_Urb_22-643,
IL2021-26129,12-21235/12-26004,,403.5,65.7,58.8,130.6,36.3,1.1,12.7,YTUrb22[Thin],DISCARD,TRUE,,17,20,SI_Urb_22-584,6.22,15.4,57.8,1157,SI_Urb_22-584,IL2021-26129
IL2021-33847,14-28468/12-21235,,409.2,65.7,58.4,130.5,34.7,0.8,12.5,"YTUrb22[Bearded, Npt]",DISCARD,TRUE,,1,33,SI_Urb_22-961,4.55,15.5,57.6,960,SI_Urb_22-961,IL2021-33847
IL2021-24512,10-21934/15-13159,,400.5,65.2,58.6,129.4,36.2,1.3,21.7,,DISCARD,TRUE,mix with 23,22,37,SI_Urb_22-1102,5.85,11.6,62.5,699,SI_Urb_22-1102,
IL2021-30079,14-11312/16-18944,,367.1,64.5,57.2,131.8,34.2,1.7,22.9,,DISCARD,TRUE,,26,32,SI_Urb_22-935,7.11,15.4,59.3,995,SI_Urb_22-935,
IL2021-8367,IL13-451/14-21519,,378.1,64.4,58.8,131.7,36.5,1.6,26.6,YTUrb22[Tall],DISCARD,TRUE,,13,24,SI_Urb_22-708,6.58,13.9,61,1393,SI_Urb_22-708,IL2021-8367
IL2021-39533,07-19334/07-4415//16-9335,,383.6,64.1,59.4,131.2,34.8,1.3,23.9,YTUrb22[Lodg],DISCARD,TRUE,,3,16,SI_Urb_22-478,6.92,16.1,60.6,903,SI_Urb_22-478,IL2021-39533
IL2021-943,KY09C-0052-26-12-3/14-8147,,384.5,62.8,58.5,130.3,33.4,1.2,20.3,YTUrb22[Septoria],DISCARD,TRUE,,24,39,SI_Urb_22-1164,5.05,11.9,63.2,577,SI_Urb_22-1164,IL2021-943
IL2021-7473,IL12-26004/12-26448,,393.1,62.5,57.8,130.3,35.8,0.6,9.9,YTUrb22[Ve],DISCARD,TRUE,,16,46,SI_Urb_22-1365,3.49,0,0,165,SI_Urb_22-1365,IL2021-7473
IL2021-1274,MO080104/12-26448,,368.1,61.7,58.5,131.3,35.8,1.5,24,YTUrb22[Bearded],DISCARD,TRUE,,12,29,SI_Urb_22-852,6.05,14.6,58.7,1189,SI_Urb_22-852,IL2021-1274
IL2021-8375,IL13-451/14-21519,,369.2,60.9,59.5,131,37.4,1.3,21.6,,DISCARD,TRUE,,12,17,SI_Urb_22-492,6.75,15.1,61.1,972,SI_Urb_22-492,
IL2021-25169,12-17257/P05247A1-7-3-120,,,,,,,,,,KEEP,TRUE,,22,26,SI_Urb_22-759,7.02,14.1,59.3,1359,SI_Urb_22-759,
IL2021-15969,14-11772/07-4415,,,,,,,,,,KEEP,TRUE,,15,25,SI_Urb_22-735,7.67,13.4,59,1426,SI_Urb_22-735,
IL2021-16734,14-11830/14-28468,,,,,,,,,,KEEP,TRUE,,9,26,SI_Urb_22-772,8.01,13.8,61.7,1372,SI_Urb_22-772,
IL2021-43265,14-28462/07-20728//02-19463-7,,,,,,,,,YTUrb22[Tall],KEEP,TRUE,,15,47,SI_Urb_22-1395,3.9,0,0,106,SI_Urb_22-1395,IL2021-43265
IL2021-43327,14-28462/07-20728//02-19463-7,,,,,,,,,YTNeo22[lodging],KEEP,TRUE,,3,24,SI_Urb_22-718,7.71,14.5,57.6,1383,SI_Urb_22-718,IL2021-43327
IL2021-43750,14-28462/14-11830//12-21235,,,,,,,,,YTUrb22[Tall],KEEP,TRUE,,20,25,SI_Urb_22-740,6.28,14.4,58.8,1421,SI_Urb_22-740,IL2021-43750
IL2021-43974,14-28462/14-19503//14-28462,,,,,,,,,"YTNeo22[npt, pretty clean]",KEEP,TRUE,,7,25,SI_Urb_22-727,7.64,13.8,61.1,1434,SI_Urb_22-727,IL2021-43974
IL2021-44124,14-28462/14-19503//16-4939,,,,,,,,,,KEEP,TRUE,,29,26,SI_Urb_22-752,6.66,13.9,59.7,1352,SI_Urb_22-752,
IL2021-12773,14-28864/P0566A1-3-1-52,,,,,,,,,,KEEP,TRUE,,15,9,SI_Urb_22-255,7.18,11.1,62.5,495,SI_Urb_22-255,
IL2021-28177,14-3934/14-28462,,,,,,,,,,KEEP,TRUE,,6,8,SI_Urb_22-235,6.7,11.4,61.1,426,SI_Urb_22-235,
IL2021-35965,16-9335/P05247A1-7-3-29,,,,,,,,,,KEEP,TRUE,,10,9,SI_Urb_22-250,5.68,11.2,62.2,490,SI_Urb_22-250,
12-26004,,,,,,,,,,,,,,,,,,,,,,
Pio 25R74,,,,,,,,,,,,,,,,,,,,,,
,,,,,,,,,,,,,,,,,,,,,,