germplasmName,purdy.pedigree,decision,merit,Grain.yield...bu.ac,Grain.test.weight...lbs.bu,Heading.time...Julian.date..JD..,Plant.height.inches,FHB.DON.content...ppm.,FHB.grain.incidence.....,notes3,action,Found,Quick.Note.,range.,row.,plot_me.,Weight..lb.,Moisture....,Test.Weight..lb.bu.,Harvest.Sequence.,seedlot_me,ugid
IL2021-19736,P05247A1-7-3-108-2/12-17257,keep,471.2,79.4,58.8,131.2,33.6,1.1,20.9,"YTUrb22[Ve, npt]",KEEP,TRUE,,27,18,SI_Urb_22-514,7.21,15.4,59.5,1047,SI_Urb_22-514,IL2021-19736
IL2021-41716,12-8545/14-28462//12-17257,,468.5,79.4,58.9,131.8,35.3,1.3,17.6,YTUrb22[Looks a bit weak],DISCARD,TRUE,"6/24/2022, 6:49:48 PM, Tare Warning, Test Weight: 7.85",10,41,SI_Urb_22-1210,6.67,11.2,62.8,471,SI_Urb_22-1210,IL2021-41716
IL2021-16041,14-11772/07-20728,,469.9,79.4,60,132.5,38.5,1,16.6,,DISCARD,TRUE,,16,25,SI_Urb_22-736,6.96,13.8,61.9,1425,SI_Urb_22-736,
IL2021-43647,14-28462/14-11830//12-21235,,469.4,79.4,59.5,131.9,36.3,1.1,17.5,YTUrb22[Leaning],DISCARD,TRUE,,30,30,SI_Urb_22-871,5.69,15,60.4,1111,SI_Urb_22-871,IL2021-43647
IL2021-46057,14-28462/14-11911,,461.2,79.4,58.8,130.8,36.1,1.7,26.3,,DISCARD,TRUE,,13,43,SI_Urb_22-1273,4.8,11.4,62.1,348,SI_Urb_22-1273,
IL2021-28074,14-3934/14-11312,,469.9,79.4,57.9,134,35.8,0.6,7.8,"YTUrb22[Npt, late]",KEEP,TRUE,,30,45,SI_Urb_22-1350,5.83,12.2,59.2,211,SI_Urb_22-1350,IL2021-28074
IL2021-34207,15-10568/13-1910,,464,79.4,58.6,131.8,35.3,1.3,22.1,YTUrb22[Looks weak],DISCARD,TRUE,,14,26,SI_Urb_22-767,7.37,13.7,60.4,1367,SI_Urb_22-767,IL2021-34207
IL2021-40626,07-20728/14-28462//12-26004,,468.9,79.3,58.8,131.4,36.6,1.1,23.6,YTUrb22[Lodging],KEEP,TRUE,,12,41,SI_Urb_22-1212,5.91,11.2,62.2,469,SI_Urb_22-1212,IL2021-40626
IL2021-44064,14-28462/14-19503//16-4939,keep,472.8,79.3,58.3,131.1,34.5,1,20.9,,KEEP,TRUE,,10,25,SI_Urb_22-730,7.98,13.7,60.8,1431,SI_Urb_22-730,
IL2021-24114,10-21934/14-11772,,464.8,79.3,58.7,133.2,38.1,0.9,18.5,,KEEP,TRUE,,4,9,SI_Urb_22-244,5.94,11.1,61.8,484,SI_Urb_22-244,
IL2021-31432,14-11916/12-17257,keep,482.8,79.3,58.2,131.3,35.9,0.8,10.8,,KEEP,TRUE,,2,15,SI_Urb_22-422,7.1,15.5,59.7,842,SI_Urb_22-422,
IL2021-25879,12-17428/14-11916,,463,79.3,59,131.9,36.3,1.3,22.6,YTUrb22[Lodging],DISCARD,TRUE,,11,20,SI_Urb_22-590,7.39,14.2,61.4,1151,SI_Urb_22-590,IL2021-25879
IL2021-12636,14-26228/07-4415,,476.9,79.3,58.8,131.5,38,1,14.1,YTUrb22[Tall],DISCARD,TRUE,,16,26,SI_Urb_22-765,6.97,14.1,60.1,1365,SI_Urb_22-765,IL2021-12636
IL2021-43732,14-28462/14-11830//12-21235,,459.4,79.3,60.2,132.5,37.7,1.4,20.4,YTUrb22[Lodg],DISCARD,TRUE,,30,41,SI_Urb_22-1230,5.38,11.7,62.7,451,SI_Urb_22-1230,IL2021-43732
IL2021-28048,14-3934/14-11312,,438.1,79.3,56.9,133.9,35.8,1.3,18.7,,KEEP,TRUE,,20,13,SI_Urb_22-380,6.72,12.2,60.4,740,SI_Urb_22-380,
IL2021-34910,15-27270/P05247A1-7-3-120,,464.6,79.3,58.7,131.8,34.9,1.2,23.6,,DISCARD,TRUE,,28,30,SI_Urb_22-873,6.97,14.6,60.3,1113,SI_Urb_22-873,
IL2021-43973,14-28462/14-19503//14-28462,keep,481.3,79.2,59.9,130.6,36,1,12.7,YTUrb22[Leaning],KEEP,TRUE,,9,25,SI_Urb_22-729,7.44,13.7,61.6,1432,SI_Urb_22-729,IL2021-43973
IL2021-40635,07-20728/14-28462//12-26004,drop,460.1,79.2,59.1,132.2,35.8,1.3,24.3,,KEEP,TRUE,,16,16,SI_Urb_22-465,7.28,16.3,60.3,916,SI_Urb_22-465,
IL2021-13605,07-4415/14-11772,,471.1,79.2,58.5,131.7,37.6,1,18.1,,DISCARD,TRUE,,1,25,SI_Urb_22-721,6.71,13.9,58.8,1440,SI_Urb_22-721,
IL2021-7837,12-30879/14-8147,,464.1,79.2,58.6,132.2,37.1,1.3,16.6,,DISCARD,TRUE,,5,29,SI_Urb_22-845,6.62,14.4,59.6,1196,SI_Urb_22-845,
IL2021-15745,12-8545/14-28468,,472.6,79.2,59.3,132.4,36.3,0.9,11.8,YTUrb22[Npt],DISCARD,TRUE,,8,33,SI_Urb_22-968,7.47,15.5,59.4,953,SI_Urb_22-968,IL2021-15745
IL2021-27928,14-3934/12-8512,,469.5,79.2,58.1,132.9,35.4,0.9,12.4,YTUrb22[Looks weak],KEEP,TRUE,,10,32,SI_Urb_22-951,7.3,15.1,58.9,1011,SI_Urb_22-951,IL2021-27928
IL2021-34922,15-27270/P05247A1-7-3-120,,465.9,79.2,58,132,35.6,1.1,19.2,,KEEP,TRUE,,9,8,SI_Urb_22-232,7.3,11,62.4,429,SI_Urb_22-232,
IL2021-2535,DH11SRW8-59/IL12-26004,drop,470.1,79.2,57.7,131.3,37.3,1,16.6,,KEEP,TRUE,,9,9,SI_Urb_22-249,7.47,11.1,61.5,489,SI_Urb_22-249,
IL2021-2559,DH11SRW8-59/IL12-26004,drop,444.8,79.2,57.4,132.1,36.2,1.7,24.7,,KEEP,TRUE,,22,9,SI_Urb_22-262,6.34,11.3,61.1,502,SI_Urb_22-262,
IL2021-46907,07-20728/14-11830//12-8512,drop,475.9,79.1,59.3,132.3,37.4,0.7,11.9,YTUrb22[Tall],DISCARD,TRUE,,15,43,SI_Urb_22-1275,6.36,11.7,62,346,SI_Urb_22-1275,IL2021-46907
IL2021-31368,14-11916/12-17257,keep,463.5,79.1,58.3,130.8,34.2,1.6,23.3,,KEEP,TRUE,,10,14,SI_Urb_22-411,7.33,15.5,60.1,790,SI_Urb_22-411,
IL2021-22262,07-20728/MO080104,drop,455.4,79.1,60,132.9,37.7,1.4,20.7,YTUrb22[Mix],DISCARD,TRUE,,16,37,SI_Urb_22-1096,6.81,12,64.3,705,SI_Urb_22-1096,IL2021-22262
IL2021-5801,07-21847/IL13-451,drop,450.9,79.1,59,132.3,37,1.7,25.5,YTUrb22[Lodging],DISCARD,TRUE,,19,47,SI_Urb_22-1399,5.83,11.9,61.4,102,SI_Urb_22-1399,IL2021-5801
IL2021-13844,07-4415/14-28468,drop,481.7,79.1,58.5,131.4,37.3,0.7,10.7,"YTNeo22[ve, leaning]",KEEP,TRUE,,11,25,SI_Urb_22-731,7.29,14,60.4,1430,SI_Urb_22-731,IL2021-13844
IL2021-16421,14-11772/14-28468,keep,463.9,79.1,60.5,131.3,36.7,1.5,18.8,,KEEP,TRUE,,13,12,SI_Urb_22-348,7.17,11.6,64.6,673,SI_Urb_22-348,
IL2021-26949,12-26004/14-11312,drop,485.4,79.1,57.5,130.1,36,0.6,8.3,,KEEP,TRUE,,21,26,SI_Urb_22-760,7.57,13.9,59.6,1360,SI_Urb_22-760,
IL2021-11703,14-11750/IL13-20616,,465.4,79.1,59,132,34.1,1.2,18.7,,KEEP,TRUE,,27,9,SI_Urb_22-267,7.23,11,63.2,507,SI_Urb_22-267,
IL2021-17641,14-28462/12-8545,drop,461.1,79.1,59.4,132.9,36.2,1.2,17.7,,KEEP,TRUE,,27,11,SI_Urb_22-327,6.61,11.6,63.6,627,SI_Urb_22-327,
IL2021-18665,MO080104/P0762A1-2-8,drop,450,79.1,57.3,132.4,38.1,1.3,20.3,YTUrb22[Tall],DISCARD,TRUE,,20,33,SI_Urb_22-980,5.74,15.1,57.6,941,SI_Urb_22-980,IL2021-18665
IL2021-15177,07-20728/14-28462,drop,459.2,79,59.1,131.7,35.2,1.4,25.8,YTUrb22[Npt],DISCARD,TRUE,,1,44,SI_Urb_22-1320,6.78,11.3,62.9,300,SI_Urb_22-1320,IL2021-15177
IL2021-39342,07-4415/14-11848//12-8512,,469.5,79,58.2,132.5,36.6,0.8,16.7,,KEEP,TRUE,,13,8,SI_Urb_22-228,7.45,11.2,62.5,433,SI_Urb_22-228,
IL2021-44011,14-28462/14-19503//14-28462,keep,466,79,59.7,131.2,35.3,1.4,19.3,YTUrb22[Disease],KEEP,TRUE,,24,24,SI_Urb_22-697,7.79,13.5,61.1,1404,SI_Urb_22-697,IL2021-44011
IL2021-25853,12-17428/14-11848,,455.7,79,58.3,133.4,34.8,1.2,21.4,,DISCARD,TRUE,,16,41,SI_Urb_22-1216,6.43,11.3,61.4,465,SI_Urb_22-1216,
IL2021-26316,12-21235/14-11312,,473.9,79,58.3,131.1,36.9,1.1,14.2,,DISCARD,TRUE,,1,43,SI_Urb_22-1261,6.62,11.3,62.1,360,SI_Urb_22-1261,
IL2021-26952,12-26004/14-11312,,478.6,79,58.3,130.8,36.3,1,12.9,"YTUrb22[Looks good, early]",DISCARD,TRUE,,9,44,SI_Urb_22-1312,5.86,11.3,61.8,292,SI_Urb_22-1312,IL2021-26952
IL2021-27461,13-1910/12-8512,drop,478.7,79,59.2,131.9,37.3,0.7,11.5,YTUrb22[Leaning],DISCARD,TRUE,,22,31,SI_Urb_22-922,6.92,14.5,61.6,1059,SI_Urb_22-922,IL2021-27461
IL2021-16620,14-11830/14-11772,,456.6,79,59.2,132.4,37.3,1.5,22.1,,KEEP,TRUE,,13,10,SI_Urb_22-288,7.84,11.8,64.5,553,SI_Urb_22-288,
IL2021-16742,14-11830/14-28468,,471.3,79,58.7,132.7,36.3,0.8,13.5,,DISCARD,TRUE,,1,30,SI_Urb_22-900,5.68,14.5,60.4,1140,SI_Urb_22-900,
IL2021-8173,IL13-451/10-21934,drop,445.5,79,57.9,132.4,36.1,1.9,25.8,"YTUrb22[Npt, Tip awned]",DISCARD,TRUE,,13,17,SI_Urb_22-493,7.41,14.8,60.3,973,SI_Urb_22-493,IL2021-8173
IL2021-8251,IL13-451/12-8512,drop,456,79,58.4,132,36.1,1.6,23.8,YTUrb22[Leaning],DISCARD,TRUE,,18,24,SI_Urb_22-703,7.46,14.1,59.9,1398,SI_Urb_22-703,IL2021-8251
IL2021-26929,12-26004/14-11312,keep,477.7,78.9,57.6,130.3,35.4,0.9,12.3,,KEEP,TRUE,,7,9,SI_Urb_22-247,6.67,11,61.5,487,SI_Urb_22-247,
IL2021-22478,07-20728/13-1910,,470.3,78.9,59.4,132.4,37.1,0.8,15.9,YTUrb22[Leaning],KEEP,TRUE,"6/27/2022, 5:01:25 PM, Tare Warning, Test Weight: 6.37",5,28,SI_Urb_22-836,7.59,14.2,61.4,1256,SI_Urb_22-836,IL2021-22478
IL2021-40733,07-20728/14-28462//14-28444,,478,78.9,60.1,131.6,38.8,0.7,11.8,YTUrb22[Leaning],DISCARD,TRUE,,10,33,SI_Urb_22-970,6.71,15.3,60.9,951,SI_Urb_22-970,IL2021-40733
IL2021-25607,12-17428/12-21235,,462.2,78.9,59.6,131.5,37,1.3,23,YTUrb22[Lodging],DISCARD,TRUE,,26,42,SI_Urb_22-1235,5.78,11.4,63.1,395,SI_Urb_22-1235,IL2021-25607
IL2021-15576,12-8545/07-19334,,470.6,78.9,59.8,132.6,37.5,0.9,12.8,,KEEP,TRUE,,18,10,SI_Urb_22-283,7.05,11.7,63.5,558,SI_Urb_22-283,
IL2021-43359,14-28462/07-20728//10-21934,keep,475.3,78.9,58.9,131.5,37,1,11.5,,KEEP,TRUE,,3,14,SI_Urb_22-418,8.23,15.9,59.7,783,SI_Urb_22-418,
IL2021-42108,14-11772/14-11830//14-3934,,440.1,78.9,56.8,132.9,36.9,1.2,18.2,YTNeo22[ve],DISCARD,TRUE,,7,30,SI_Urb_22-894,7.2,14.2,60.4,1134,SI_Urb_22-894,IL2021-42108
IL2021-43404,14-28462/07-20728//10-21934,,462.4,78.9,59.7,132.7,37.9,1.1,18.2,YTNeo22[leaning],DISCARD,TRUE,,12,30,SI_Urb_22-889,7.29,14.3,62.6,1129,SI_Urb_22-889,IL2021-43404
IL2021-27845,14-3934/OH09-207-68,,452.6,78.9,58.9,132.6,35.2,1.6,23.1,,DISCARD,TRUE,,21,40,SI_Urb_22-1180,7.14,11.1,62.1,520,SI_Urb_22-1180,
IL2021-1768,MO150624/07-4415,,451.8,78.9,58,130.7,35.8,1.9,32.1,YTUrb22[Mix],DISCARD,TRUE,,14,22,SI_Urb_22-647,7.72,14.4,58.5,1274,SI_Urb_22-647,IL2021-1768
IL2021-46634,P0566A1-3-1-52/13-1910//12-8512,,450.4,78.9,59.2,131.9,36.4,1.8,26.7,,DISCARD,TRUE,,30,35,SI_Urb_22-1050,5.31,16.3,59.9,811,SI_Urb_22-1050,
IL2021-38714,14-11312/07-4415//14-28468,keep,487.4,78.8,60,130.2,37.2,0.8,8.2,YTUrb22[Leaning],KEEP,TRUE,,2,20,SI_Urb_22-599,6.98,14.9,60.1,1142,SI_Urb_22-599,IL2021-38714
IL2021-40662,07-20728/14-28462//14-28444,drop,483.1,78.8,60.3,130.9,38.1,0.8,7.9,YTUrb22[Very early],DISCARD,TRUE,,28,44,SI_Urb_22-1293,3.67,0,0,273,SI_Urb_22-1293,IL2021-40662
IL2021-28970,14-9546/12-8512,keep,476.4,78.8,58.5,131.1,35.9,0.9,14.6,,KEEP,TRUE,,12,34,SI_Urb_22-1009,7.05,15.9,59.8,889,SI_Urb_22-1009,
IL2021-6854,12-8512/IL12-26004,,478.4,78.8,58.1,130.9,36.7,0.9,12.8,YTUrb22[Lodging],DISCARD,TRUE,,7,29,SI_Urb_22-847,7.29,14.3,58,1194,SI_Urb_22-847,IL2021-6854
IL2021-28411,14-3934/15-25742,keep,489.6,78.8,58.1,131.4,35.5,0.3,5.4,YTUrb22[Leaning],KEEP,TRUE,,16,42,SI_Urb_22-1245,6.34,11.3,61.8,405,SI_Urb_22-1245,IL2021-28411
IL2021-41328,12-8545/07-20728//14-28307,,462.5,78.8,59.6,131.8,36.7,1.4,17.7,,DISCARD,TRUE,,8,45,SI_Urb_22-1328,5.85,11.4,63.9,233,SI_Urb_22-1328,
IL2021-29568,14-11312/10-21934,,449.6,78.8,57.6,132,36.4,1.5,23.4,,DISCARD,TRUE,,24,25,SI_Urb_22-744,7.8,13.8,58.4,1417,SI_Urb_22-744,
IL2021-47168,14-11848/14-28462//16-9335,,446.2,78.8,59.3,132.2,35.1,1.8,29.5,YTNeo22[leaning],DISCARD,TRUE,,30,19,SI_Urb_22-570,6.4,15.4,60.8,1110,SI_Urb_22-570,IL2021-47168
IL2021-46245,14-28468/12-26004,,450.8,78.8,57.6,132.8,34.5,1.3,21.2,YTUrb22[Short],DISCARD,TRUE,,16,19,SI_Urb_22-556,6.77,15,56.9,1096,SI_Urb_22-556,IL2021-46245
IL2021-36549,16-27570/12-26004,,470.6,78.8,58.9,131.1,37.5,1.1,18.1,YTUrb22[Tall],DISCARD,TRUE,,25,17,SI_Urb_22-505,6.68,15.6,59.9,985,SI_Urb_22-505,IL2021-36549
IL2021-18638,KY09C-1245-99-8-5/12-8512,,452.6,78.8,58.1,132.1,36.2,1.6,25.1,YTUrb22[Leaning],DISCARD,TRUE,,18,33,SI_Urb_22-978,7.21,15.4,59.8,943,SI_Urb_22-978,IL2021-18638
IL2021-2944,P05247A1-7-3-108-2/07-4415,,465.8,78.8,58.5,131.7,36.4,1.1,22.5,,KEEP,TRUE,,29,12,SI_Urb_22-332,7.43,11.9,62.9,689,SI_Urb_22-332,
IL2021-38976,14-11312/IL12-26004//12-26004,keep,483.5,78.7,57.7,130.2,35.4,0.6,9.9,"YTUrb22[Ve, npt]",KEEP,TRUE,,6,17,SI_Urb_22-486,6.57,14.8,59.5,966,SI_Urb_22-486,IL2021-38976
IL2021-28549,14-9542/12-21235,keep,473.4,78.7,58.4,130.8,35.7,1.1,16.7,YTUrb22[Short],KEEP,TRUE,,6,32,SI_Urb_22-955,7.45,15.1,59.3,1015,SI_Urb_22-955,IL2021-28549
IL2021-40930,07-20728/14-28468//15-27666,,475.9,78.7,59.9,130.7,37.3,0.9,18.2,YTUrb22[Tall],DISCARD,TRUE,,27,48,SI_Urb_22-1414,4.99,11.6,63.4,34,SI_Urb_22-1414,IL2021-40930
IL2021-4765,07-4415/02-19463-5,drop,468,78.7,57.9,130.3,35.3,1.2,22.6,YTUrb22[Mix],KEEP,TRUE,,15,38,SI_Urb_22-1126,6.72,11.7,62.5,646,SI_Urb_22-1126,IL2021-4765
IL2021-7223,12-21624/IL09-3264-T2,,453.5,78.7,59.4,132.8,35.6,1.4,21.8,,KEEP,TRUE,,27,14,SI_Urb_22-394,6.6,16,58,807,SI_Urb_22-394,
IL2021-6648,12-8512/10-21934,drop,455.5,78.7,58.2,130.5,35.8,2,24.8,,DISCARD,TRUE,,11,38,SI_Urb_22-1130,6.75,11.6,62.5,650,SI_Urb_22-1130,
IL2021-39812,07-19334/14-28462//12-26004,keep,475,78.7,60.1,131.5,36,0.8,14.9,,KEEP,TRUE,,27,19,SI_Urb_22-567,6.93,15,60.8,1107,SI_Urb_22-567,
IL2021-16325,14-11772/14-28462,,452,78.7,59.6,132.2,36.5,1.7,23.3,,DISCARD,TRUE,,24,20,SI_Urb_22-577,7.51,14.4,61.1,1164,SI_Urb_22-577,
IL2021-31356,14-11916/12-17257,,450.9,78.7,58.7,132.2,34.1,1.7,24.6,,KEEP,TRUE,,7,14,SI_Urb_22-414,7.35,15.6,60.4,787,SI_Urb_22-414,
IL2021-31613,14-11916/12-26004,drop,487.1,78.7,58.7,131.4,37.5,0.3,8,YTUrb22[Tall],DISCARD,TRUE,,10,31,SI_Urb_22-910,7.37,14.3,61.5,1071,SI_Urb_22-910,IL2021-31613
IL2021-3407,P05247A1-7-3-120/07-4415,,466.1,78.7,59,131.4,35.5,1.1,22.1,,DISCARD,TRUE,,2,16,SI_Urb_22-479,7.17,15.4,59.2,902,SI_Urb_22-479,
IL2021-13951,07-19334/07-4415,,448.2,78.6,57.4,130.7,35.9,1.7,27,,KEEP,TRUE,,24,9,SI_Urb_22-264,7.22,11.1,62.6,504,SI_Urb_22-264,
IL2021-24847,12-8512/14-9542,keep,488,78.6,58.2,131.1,36.6,0.3,7.7,YTUrb22[Ve],KEEP,TRUE,,3,32,SI_Urb_22-958,7.02,15.3,58.7,1018,SI_Urb_22-958,IL2021-24847
IL2021-8804,13-1960/IL12-26004,,433.8,78.6,57,131.8,36.7,1.8,27.5,YTUrb22[Looks weak],DISCARD,TRUE,,18,29,SI_Urb_22-858,7.3,14.7,58.3,1183,SI_Urb_22-858,IL2021-8804
IL2021-10963,14-11312/07-4415,,440.8,78.6,56.9,131.9,36.5,1.4,22.9,YTUrb22[Lodging],DISCARD,TRUE,,16,28,SI_Urb_22-825,7.56,14.4,58.6,1245,SI_Urb_22-825,IL2021-10963
IL2021-11374,14-11750/02-19463-5,,462.5,78.6,59.4,132.1,36.8,1.1,20.6,YTUrb22[Tall],DISCARD,TRUE,,18,27,SI_Urb_22-798,7.33,13.9,61,1303,SI_Urb_22-798,IL2021-11374
IL2021-42346,14-11830/14-28462//12-8512,,468.4,78.6,58,131.8,35.5,1,16.6,,DISCARD,TRUE,,24,48,SI_Urb_22-1417,5.59,11.8,60.8,37,SI_Urb_22-1417,
IL2021-33161,14-28462/10-21934,drop,485.6,78.6,58.8,131.3,37.1,0.6,4.4,YTUrb22[Npt],DISCARD,TRUE,,17,39,SI_Urb_22-1157,6.42,11.9,62.1,584,SI_Urb_22-1157,IL2021-33161
IL2021-45172,14-28462/12-17428,,455.8,78.6,59.4,131.8,36.9,1.6,20.9,,KEEP,TRUE,,24,13,SI_Urb_22-384,7.8,11.9,62.9,744,SI_Urb_22-384,
IL2021-33673,14-28468/12-17257,,470.1,78.6,59.1,130.9,34.6,1.2,15.8,"YTUrb22[Ve, npt]",DISCARD,TRUE,,9,38,SI_Urb_22-1132,6.92,11.7,63,652,SI_Urb_22-1132,IL2021-33673
IL2021-46242,14-28468/12-26004,,440.1,78.6,57.5,132.8,34.8,1.6,25.8,,DISCARD,TRUE,,5,19,SI_Urb_22-545,6.66,15.3,57.9,1085,SI_Urb_22-545,
IL2021-7562,IL12-26004/14-11750,drop,481.3,78.6,58.4,131.2,35.3,0.6,10.8,,DISCARD,TRUE,,22,27,SI_Urb_22-802,7.59,14.2,60.6,1299,SI_Urb_22-802,
IL2021-21630,07-19334/12-8512,,456.2,78.5,58.4,132.5,36.1,1.4,19.5,YTNeo22[clean],DISCARD,TRUE,,14,28,SI_Urb_22-827,6.57,14.4,60.4,1247,SI_Urb_22-827,IL2021-21630
IL2021-40042,07-20728/07-4415//16-9335,,450.8,78.5,59.5,132.5,37,1.5,25.5,YTUrb22[Leaning],DISCARD,TRUE,,21,48,SI_Urb_22-1420,5.8,11.9,63.8,40,SI_Urb_22-1420,IL2021-40042
IL2021-5009,07-4415/13-1910,,465.8,78.5,58,131.2,37,1.2,19.8,YTNeo22[sept],DISCARD,TRUE,,11,36,SI_Urb_22-1070,7.13,11.7,63.8,770,SI_Urb_22-1070,IL2021-5009
IL2021-13561,07-4415/14-11772,,467.9,78.5,57.9,131.8,36.8,1,14.2,,KEEP,TRUE,,21,12,SI_Urb_22-340,6.62,11.9,62.5,681,SI_Urb_22-340,
IL2021-21665,07-19334/12-8512,keep,470.9,78.5,58.2,131.2,33.4,1.1,15.7,"YTNeo22[npt, clean]",KEEP,TRUE,,14,37,SI_Urb_22-1094,6.8,12.1,62.2,707,SI_Urb_22-1094,IL2021-21665
IL2021-37710,07-4415/IL12-26004//10-21934,drop,472.7,78.5,58.8,132.3,36.6,0.7,12.8,,KEEP,TRUE,,21,9,SI_Urb_22-261,6.16,11.3,61.8,501,SI_Urb_22-261,
IL2021-46007,14-28462/14-9546,,465.9,78.5,58.8,132.8,37.1,0.9,14.5,YTNeo22[leaning],KEEP,TRUE,,3,19,SI_Urb_22-543,6.87,14.8,59.1,1083,SI_Urb_22-543,IL2021-46007
IL2021-6252,IL09-3264-T2/10-21934,,458,78.5,58.1,131.3,35.1,1.4,25.5,,KEEP,TRUE,,18,12,SI_Urb_22-343,6.12,12.2,60.1,678,SI_Urb_22-343,
IL2021-1444,MO080104/14-8147,,456.9,78.5,58.2,132.1,37,1.4,21.9,YTUrb22[Tall],DISCARD,TRUE,,15,21,SI_Urb_22-615,7.57,14.9,59.5,1215,SI_Urb_22-615,IL2021-1444
IL2021-20508,P05247A1-7-3-29/14-9546,,459.6,78.5,58.2,131.4,34.5,1.4,24.1,,KEEP,TRUE,,25,12,SI_Urb_22-336,7.45,11.7,62.8,685,SI_Urb_22-336,
IL2021-14337,07-19334/14-11772,,462.2,78.4,60.1,132.6,38.1,1.1,13.7,,DISCARD,TRUE,,2,24,SI_Urb_22-719,6.86,14,61.5,1382,SI_Urb_22-719,
IL2021-14511,07-19334/14-28462,,463.7,78.4,59.2,132.4,37.4,1.1,14.1,YTUrb22[Leaning],DISCARD,TRUE,,2,27,SI_Urb_22-782,7.07,13.7,60.6,1319,SI_Urb_22-782,IL2021-14511
IL2021-40002,07-20728/07-4415//16-9335,,460.4,78.4,59.5,131.6,36.3,1.3,22,,DISCARD,TRUE,,2,43,SI_Urb_22-1262,6.69,11.3,63.1,359,SI_Urb_22-1262,
IL2021-43966,14-28462/14-19503//14-28462,keep,483.2,78.4,60.1,130.9,35.5,0.6,9.6,"YTNeo22[ve, clean, npt, bright]",KEEP,TRUE,,24,29,SI_Urb_22-864,7.11,15,59.5,1177,SI_Urb_22-864,IL2021-43966
IL2021-25721,12-17428/12-26004,,469.4,78.4,58.3,130.6,36,1.2,19.2,,DISCARD,TRUE,,17,21,SI_Urb_22-617,7.08,14,59.7,1217,SI_Urb_22-617,
IL2021-27349,13-1910/07-4415,,455,78.4,57.3,131,35.9,1.2,19.5,YTUrb22[Mix],DISCARD,TRUE,,25,32,SI_Urb_22-936,7.26,15,58.7,996,SI_Urb_22-936,IL2021-27349
IL2021-30208,14-11772/12-8512,,469.6,78.4,59.4,131.5,37.1,1.1,11.8,,DISCARD,TRUE,,24,32,SI_Urb_22-937,7.37,15.3,59,997,SI_Urb_22-937,
IL2021-43833,14-28462/14-11830//12-26004,,478.4,78.4,58.7,131.3,37.2,0.8,7.6,YTUrb22[Late],DISCARD,TRUE,,20,22,SI_Urb_22-641,7.24,14.2,60.1,1280,SI_Urb_22-641,IL2021-43833
IL2021-43862,14-28462/14-11830//14-28468,,467.3,78.4,58.3,132.4,34.4,0.9,14.4,YTNeo22[scab],DISCARD,TRUE,,7,24,SI_Urb_22-714,7.72,13.8,59.6,1387,SI_Urb_22-714,IL2021-43862
IL2021-17835,14-28462/14-28468,,463.2,78.4,59.9,131.7,36.3,1.3,17.6,YTUrb22[Leaning],DISCARD,TRUE,,22,33,SI_Urb_22-982,6.62,15.8,60.2,939,SI_Urb_22-982,IL2021-17835
IL2021-28249,14-3934/14-28462,,465.9,78.4,58.5,132.6,37.2,1,11.8,YTUrb22[Tall],DISCARD,TRUE,,1,40,SI_Urb_22-1200,5.79,11.2,61.6,540,SI_Urb_22-1200,IL2021-28249
IL2021-29438,14-9546/15-13159,,460.4,78.4,57.9,131.9,34,1.2,20,,DISCARD,TRUE,,22,38,SI_Urb_22-1119,6.68,11.6,62.1,639,SI_Urb_22-1119,
IL2021-7549,IL12-26004/14-11750,,473.2,78.4,59.4,132.3,36.3,0.7,9.7,YTUrb22[Npt],DISCARD,TRUE,,19,27,SI_Urb_22-799,7.75,14,60.4,1302,SI_Urb_22-799,IL2021-7549
IL2021-46629,P0566A1-3-1-52/13-1910//12-8512,,456.4,78.4,57.6,132.1,37,1.2,19,,KEEP,TRUE,,26,10,SI_Urb_22-275,6.68,11.9,62.4,566,SI_Urb_22-275,
IL2021-46909,07-20728/14-11830//12-8512,,455.3,78.3,59.4,132.3,35.2,1.3,22.8,YTUrb22[Leaning],DISCARD,TRUE,,17,43,SI_Urb_22-1277,5.17,11.6,62.2,344,SI_Urb_22-1277,IL2021-46909
IL2021-27657,13-1910/12-17257,keep,467.3,78.3,59.2,130.8,35,1.2,18.6,,KEEP,TRUE,,16,14,SI_Urb_22-405,7.35,16.3,59.6,796,SI_Urb_22-405,
IL2021-23566,07-21847/16-9335,,474.5,78.3,59,130.6,37.5,1,13.6,,DISCARD,TRUE,,8,20,SI_Urb_22-593,7.67,14.3,60.8,1148,SI_Urb_22-593,
IL2021-24328,10-21934/14-28444,,463.9,78.3,59,130.9,37,1.4,18.8,,KEEP,TRUE,,24,15,SI_Urb_22-444,7.99,15.4,60.4,864,SI_Urb_22-444,
IL2021-2364,VA11W-108/12-26448,keep,466.4,78.3,59.5,131.5,35.3,1.1,17.2,,KEEP,TRUE,,19,14,SI_Urb_22-402,6.74,16.2,58.5,799,SI_Urb_22-402,
IL2021-31563,14-11916/12-26004,,460.7,78.3,58.3,131.3,37.1,1.3,22.7,,KEEP,TRUE,,6,14,SI_Urb_22-415,6.34,15.7,60.2,786,SI_Urb_22-415,
IL2021-12314,14-21519/14-11750,,469,78.3,59.1,132,36.6,0.8,15.2,YTUrb22[Tall],DISCARD,TRUE,,24,27,SI_Urb_22-804,7.52,14.5,61.1,1297,SI_Urb_22-804,IL2021-12314
IL2021-43231,14-28462/07-19334//12-26004,,474.4,78.3,58,130.5,35.8,1.1,13.8,YTUrb22[Lodg],DISCARD,TRUE,,1,24,SI_Urb_22-720,6.93,13.9,59.9,1381,SI_Urb_22-720,IL2021-43231
IL2021-33753,14-28468/12-17257,,470.7,78.3,59.3,130.7,35.5,1.2,15.3,,DISCARD,TRUE,,16,18,SI_Urb_22-525,6.08,14.7,60.2,1036,SI_Urb_22-525,
IL2021-1405,MO080104/14-8147,,453.3,78.3,58.6,131.8,35.8,1.7,21,YTUrb22[Mix],DISCARD,TRUE,,28,38,SI_Urb_22-1113,6.19,11.8,63.3,633,SI_Urb_22-1113,IL2021-1405
IL2021-3927,P0566A1-3-1-52/IL13-20616,,454.1,78.3,57.5,131.8,36,1.4,16.3,,KEEP,TRUE,,17,16,SI_Urb_22-464,7.33,15.3,59.4,917,SI_Urb_22-464,
IL2021-19676,P0762A1-2-8/16-18944,,468.6,78.3,58.3,131.9,36,0.9,15.6,,DISCARD,TRUE,,14,27,SI_Urb_22-794,7.96,14,60.2,1307,SI_Urb_22-794,
IL2021-19650,P0762A1-2-8/16-18944,,436.4,78.3,57.6,133.1,35.3,1.6,29.2,,KEEP,TRUE,,1,15,SI_Urb_22-421,6.55,16.3,54.1,841,SI_Urb_22-421,
IL2021-20960,02-19463-7/12-17257,,459.7,78.2,58.7,132.6,37.5,1.1,17.4,YTUrb22[Sea of heads],DISCARD,TRUE,,1,38,SI_Urb_22-1140,6.94,11.6,64.2,660,SI_Urb_22-1140,IL2021-20960
IL2021-22137,07-19334/15-25742,,464.2,78.2,58.8,132.2,36.7,1,16.9,,KEEP,FALSE,,27,8,SI_Urb_22-214,7.54,11.2,60.9,447,SI_Urb_22-214,
IL2021-37528,P0566A1-3-1-52/IL12-26004//14-11772,keep,468.5,78.2,58.5,131.1,36.4,1.2,15.4,,KEEP,TRUE,,4,13,SI_Urb_22-364,7.01,11.8,62.8,724,SI_Urb_22-364,
IL2021-38609,13-1960/IL12-26004//12-8512,,460.6,78.2,59.1,132.4,36.3,1.2,16.1,YTUrb22[Leaning],DISCARD,TRUE,,23,45,SI_Urb_22-1343,4.57,11.9,61,218,SI_Urb_22-1343,IL2021-38609
IL2021-11820,14-11772/07-4415,,456.3,78.2,60.2,132.3,37.8,1.3,19.4,YTUrb22[Lodging],DISCARD,TRUE,,23,28,SI_Urb_22-818,7.01,14.2,62.3,1238,SI_Urb_22-818,IL2021-11820
IL2021-44721,14-28468/14-11848//16-4939,,462.9,78.2,58.9,131.5,36.1,1.1,22.9,YTUrb22[Thin],DISCARD,TRUE,,16,47,SI_Urb_22-1396,4.5,12.1,60.4,105,SI_Urb_22-1396,IL2021-44721
IL2021-3563,P05247A1-7-3-120/14-11750,,466.1,78.2,58.1,131.5,34,1,19.2,,DISCARD,TRUE,,10,19,SI_Urb_22-550,6.77,14.7,59.3,1090,SI_Urb_22-550,
IL2021-40807,07-20728/14-28468//15-25742,keep,484.1,78.1,59.7,129.9,36,0.7,11.5,"YTUrb22[ve, looks weak]",KEEP,TRUE,,11,42,SI_Urb_22-1250,4.97,11,61.5,410,SI_Urb_22-1250,IL2021-40807
IL2021-5861,07-21847/14-8147,keep,480.5,78.1,58.9,130.3,34,0.8,10.7,"YTUrb22[Npt, some leaf rust]",KEEP,TRUE,,6,29,SI_Urb_22-846,7.08,14.6,59.4,1195,SI_Urb_22-846,IL2021-5861
IL2021-15050,07-20728/14-11830,,469.8,78.1,58.7,132.8,35.8,0.5,12.4,,DISCARD,TRUE,,10,42,SI_Urb_22-1251,5.57,11.3,61.7,411,SI_Urb_22-1251,
IL2021-40667,07-20728/14-28462//14-28444,drop,486.1,78.1,60.4,131.5,37.4,0.4,2.4,,KEEP,TRUE,,23,9,SI_Urb_22-263,5.68,11.3,64.7,503,SI_Urb_22-263,
IL2021-22715,07-20728/15-13159,,457.8,78.1,59.4,132,37.8,1.2,23.3,,DISCARD,TRUE,"6/27/2022, 6:16:56 PM, Tare Warning, Test Weight: 9.24",22,23,SI_Urb_22-682,7.51,14.2,62.6,1342,SI_Urb_22-682,
