germplasmName,purdy.pedigree,decision,merit,Grain.yield...bu.ac,Grain.test.weight...lbs.bu,Heading.time...Julian.date..JD..,Plant.height.inches,FHB.DON.content...ppm.,FHB.grain.incidence.....,notes3,action,Found,Quick.Note.,range.,row.,plot_me.,Weight..lb.,Moisture....,Test.Weight..lb.bu.,Harvest.Sequence.,seedlot_me,ugid
IL2021-28478,14-9542/12-21235,drop,484.6,84.3,59.2,132.9,37.7,1.5,19.3,,DISCARD,TRUE,,29,41,SI_Urb_22-1229,5.49,11.3,61.8,452,SI_Urb_22-1229,
IL2021-33678,14-28468/12-17257,keep,490.3,84.2,59.3,130.9,35.3,1.7,21.2,,KEEP,TRUE,,4,33,SI_Urb_22-964,7.33,14.9,61.6,957,SI_Urb_22-964,
IL2021-23332,07-21847/14-11312,keep,500.5,84.2,58.6,131.1,37.1,1,20.2,YTUrb22[Leaning],KEEP,TRUE,,27,45,SI_Urb_22-1347,5.02,11.8,60.8,214,SI_Urb_22-1347,IL2021-23332
IL2021-43305,14-28462/07-20728//02-19463-7,drop,489.3,84.2,58.9,134,36.9,1,14.2,YTNeo22[leaning],KEEP,TRUE,,26,25,SI_Urb_22-746,8.06,13.7,60.7,1415,SI_Urb_22-746,IL2021-43305
IL2021-22621,07-20728/14-28444,keep,516,84.2,59.6,132.2,37.1,0.4,4.5,YTUrb22[Tall],KEEP,TRUE,,13,23,SI_Urb_22-673,8.07,13.7,62,1333,SI_Urb_22-673,IL2021-22621
IL2021-14513,07-19334/14-28462,keep,496.7,84.2,59.7,132.3,37.2,1.1,15.2,YTUrb22[Leaning],KEEP,TRUE,,25,26,SI_Urb_22-756,7.86,13.8,60.7,1356,SI_Urb_22-756,IL2021-14513
IL2021-16810,02-19463-7/16-9335,drop,486.2,84.1,57.3,132.2,36,0.9,17.4,,KEEP,TRUE,,26,11,SI_Urb_22-326,7.74,11.7,62.1,626,SI_Urb_22-326,
IL2021-43956,14-28462/14-19503//14-28462,keep,495.2,84.1,59.6,131.3,36.1,1.3,18.2,,KEEP,TRUE,,11,30,SI_Urb_22-890,8.18,14.3,62.3,1130,SI_Urb_22-890,
IL2021-27463,13-1910/12-8512,drop,480.6,84.1,58.8,132.7,37.3,1.4,26,YTUrb22[Tall],DISCARD,TRUE,,11,32,SI_Urb_22-950,8.17,15.2,60.4,1010,SI_Urb_22-950,IL2021-27463
IL2021-25362,12-17257/07-20728,keep,500.4,84.1,59.1,132.7,35.6,0.8,13.8,,KEEP,TRUE,,13,35,SI_Urb_22-1033,7.74,15.4,61.7,828,SI_Urb_22-1033,
IL2021-43962,14-28462/14-19503//14-28462,keep,494.9,84.1,59.3,132.7,36.6,1,14.1,,KEEP,TRUE,,23,30,SI_Urb_22-878,8.14,14.2,59.8,1118,SI_Urb_22-878,
IL2021-1156,MO080104/10-21934,drop,489.1,84.1,57.9,133.3,36.1,1,17.5,,KEEP,TRUE,,10,28,SI_Urb_22-831,7.02,14.8,57.6,1251,SI_Urb_22-831,
IL2021-46641,P0566A1-3-1-52/13-1910//12-8512,drop,460.5,84.1,57,132.8,36.5,1.7,23.7,,DISCARD,TRUE,,18,43,SI_Urb_22-1278,4.87,11.7,59.3,343,SI_Urb_22-1278,
IL2021-14476,07-19334/14-28462,drop,500.6,84,59.5,132.2,38.1,0.9,12.1,YTUrb22[Tall],DISCARD,TRUE,,21,34,SI_Urb_22-1000,7.74,15.8,59.5,880,SI_Urb_22-1000,IL2021-14476
IL2021-17949,14-28462/14-28468,keep,486.1,84,59.6,131.7,34.8,1.6,21.1,YTUrb22[npt],KEEP,TRUE,,16,22,SI_Urb_22-645,7.99,14.1,60.8,1276,SI_Urb_22-645,IL2021-17949
IL2021-42360,14-11830/14-28462//12-8512,drop,486.8,84,57.9,132.6,38,1.2,19.6,YTUrb22[Lodg],DISCARD,TRUE,,20,21,SI_Urb_22-620,7.41,14.8,58.6,1220,SI_Urb_22-620,IL2021-42360
IL2021-45561,07-19334/15-10568,keep,482.9,84,57.8,132.3,35.1,1.5,18.5,,KEEP,TRUE,,7,18,SI_Urb_22-534,7.35,15.1,58,1027,SI_Urb_22-534,
IL2021-45979,14-28462/14-9546,drop,505.9,84,59.2,132.3,37.9,0.7,9,"YTUrb22[Tall, leaning]",DISCARD,TRUE,,6,18,SI_Urb_22-535,7.23,15,60.9,1026,SI_Urb_22-535,IL2021-45979
IL2021-46166,14-28468/12-26004,keep,486.7,84,58.5,132.4,37.2,1.3,21.5,,KEEP,TRUE,,14,43,SI_Urb_22-1274,5.58,11.5,61.8,347,SI_Urb_22-1274,
IL2021-36418,16-27570/07-20728,drop,495,84,59.3,132.9,37.5,0.9,16.1,YTUrb22[Disease],DISCARD,TRUE,,10,30,SI_Urb_22-891,7.71,14.7,61.1,1131,SI_Urb_22-891,IL2021-36418
IL2021-22358,07-20728/P0762A1-2-8,drop,472.4,83.9,59.1,134.4,36.6,1.3,26,,KEEP,TRUE,,9,23,SI_Urb_22-669,8.01,14,60.8,1329,SI_Urb_22-669,
IL2021-15944,14-11772/07-4415,drop,491.4,83.9,58.5,132.8,37.5,1,17.2,,DISCARD,TRUE,,30,48,SI_Urb_22-1411,6.59,11.9,61.7,31,SI_Urb_22-1411,
IL2021-17958,14-28462/14-28468,keep,495.4,83.9,59.3,131.7,35.7,1.2,15.6,,KEEP,TRUE,,19,18,SI_Urb_22-522,8.2,15,60.1,1039,SI_Urb_22-522,
IL2021-18435,14-28468/14-11830,keep,495.4,83.9,59.2,131.9,35.2,1.2,15.9,,KEEP,TRUE,,20,34,SI_Urb_22-1001,8.31,15.6,61,881,SI_Urb_22-1001,
IL2021-21123,02-19463-7/12-26004,keep,486.9,83.9,59.6,133.1,37.4,1.2,17.7,,KEEP,TRUE,,7,32,SI_Urb_22-954,7.13,15.6,60.4,1014,SI_Urb_22-954,
IL2021-15117,07-20728/14-11848,keep,488.4,83.9,58.6,133.5,35.8,0.9,19.2,,KEEP,TRUE,,10,34,SI_Urb_22-1011,7.58,15.8,60.4,891,SI_Urb_22-1011,
IL2021-22464,07-20728/13-1910,drop,494.9,83.8,58.9,133.6,37.2,0.8,11.4,,DISCARD,TRUE,,19,23,SI_Urb_22-679,8.26,14.2,59,1339,SI_Urb_22-679,
IL2021-17972,14-28462/14-28468,keep,490.8,83.8,59.1,131.4,34.4,1.4,19.7,YTNeo22[npt],KEEP,TRUE,,23,17,SI_Urb_22-503,7.63,15.2,60.7,983,SI_Urb_22-503,IL2021-17972
IL2021-42072,14-11772/14-11830//14-3934,drop,473.2,83.8,57.5,133.7,35.8,1.2,18.8,,KEEP,TRUE,,28,39,SI_Urb_22-1168,6.5,12.1,61.1,573,SI_Urb_22-1168,
IL2021-16272,14-11772/14-28462,drop,470,83.8,59,132.2,36.1,2,29.2,YTUrb22[Leaning],DISCARD,TRUE,,2,35,SI_Urb_22-1022,7.4,15.7,60.9,839,SI_Urb_22-1022,IL2021-16272
IL2021-46822,07-19334/14-11830//15-25742,keep,489.8,83.8,58.5,131.8,34,1.4,18.7,,KEEP,TRUE,,16,43,SI_Urb_22-1276,5.47,11.6,61.1,345,SI_Urb_22-1276,
IL2021-46044,14-28462/14-11911,drop,486.2,83.8,59,131.6,36.1,1.6,20.6,,KEEP,TRUE,,9,18,SI_Urb_22-532,7.47,14.8,60.4,1029,SI_Urb_22-532,
IL2021-44565,14-28468/14-11848//14-11312,drop,493.9,83.8,57.7,133.6,38.2,0.6,10.2,,DISCARD,TRUE,,13,47,SI_Urb_22-1393,4.64,11.9,59.2,108,SI_Urb_22-1393,
IL2021-22578,07-20728/14-28444,keep,503.5,83.8,59.6,132.5,36,0.6,10.9,YTUrb22[Lodging],KEEP,TRUE,,14,23,SI_Urb_22-674,7.71,14.1,61.3,1334,SI_Urb_22-674,IL2021-22578
IL2021-24365,10-21934/14-28468,keep,516.5,83.7,58.1,131.1,36.9,0.5,4.3,,KEEP,TRUE,,17,36,SI_Urb_22-1064,7.77,12.1,62.6,764,SI_Urb_22-1064,
IL2021-41727,12-8545/14-28462//12-17257,drop,472.7,83.7,58.8,133.2,35.8,1.7,24,,DISCARD,TRUE,,8,41,SI_Urb_22-1208,6.96,11.1,62.4,473,SI_Urb_22-1208,
IL2021-5364,07-21847/14-11750,keep,494,83.7,59.5,131.9,37.2,1.1,16.6,,KEEP,TRUE,,16,17,SI_Urb_22-496,7.13,15.5,59.7,976,SI_Urb_22-496,
IL2021-20345,P05247A1-7-3-29/12-8512,keep,489.1,83.7,58.1,132.1,35.5,1.2,21,YTUrb22[Mix],KEEP,TRUE,,7,37,SI_Urb_22-1087,7.61,11.8,62.3,714,SI_Urb_22-1087,IL2021-20345
IL2021-43633,14-28462/12-8545//13-1910,keep,509.7,83.6,58.7,130.5,35.4,0.7,14.4,YTUrb22[Leaning],KEEP,TRUE,,19,30,SI_Urb_22-882,8.19,14.4,61.7,1122,SI_Urb_22-882,IL2021-43633
IL2021-3936,P0566A1-3-1-52/IL13-20616,keep,483.9,83.6,57.9,130.9,34,1.7,22.1,,KEEP,TRUE,,26,15,SI_Urb_22-446,8.32,16.4,56.6,866,SI_Urb_22-446,
IL2021-25344,12-17257/07-20728,keep,500.8,83.6,59.8,131.6,34.8,0.9,14.4,,KEEP,TRUE,,30,40,SI_Urb_22-1171,5.53,11.3,62.8,511,SI_Urb_22-1171,
IL2021-47156,14-11848/14-28462//16-9335,drop,470.7,83.6,59.3,132.9,34.6,1.7,28.7,YTUrb22[Lodging],KEEP,TRUE,,16,20,SI_Urb_22-585,7.24,14.4,62,1156,SI_Urb_22-585,IL2021-47156
IL2021-43370,14-28462/07-20728//10-21934,drop,486.1,83.6,58.7,133.7,36.8,1.1,13.1,"YTNeo22[tall, late]",KEEP,TRUE,,23,22,SI_Urb_22-638,6.9,13.8,60.1,1283,SI_Urb_22-638,IL2021-43370
IL2021-14624,07-19334/14-28462,drop,478.5,83.5,59.6,131.7,38.1,1.7,25.3,,DISCARD,TRUE,,21,42,SI_Urb_22-1240,5.81,11.4,62.6,400,SI_Urb_22-1240,
IL2021-19718,P05247A1-7-3-108-2/12-17257,keep,483.2,83.5,59,131.7,33.1,1.5,24.2,YTUrb22[Leaning],KEEP,TRUE,,20,17,SI_Urb_22-500,7.2,15.4,59.2,980,SI_Urb_22-500,IL2021-19718
IL2021-43261,14-28462/07-20728//02-19463-7,drop,488.4,83.5,58.7,133.1,38.2,1.1,14.6,YTUrb22[Tall],DISCARD,TRUE,,22,24,SI_Urb_22-699,8.43,13.5,60.8,1402,SI_Urb_22-699,IL2021-43261
IL2021-28804,14-9542/16-27570,keep,493.3,83.5,59.3,132.3,35.5,1,15.9,,KEEP,TRUE,,6,27,SI_Urb_22-786,7.22,14,60.8,1315,SI_Urb_22-786,
IL2021-44661,14-28468/14-11848//16-4939,drop,485.1,83.5,57.6,132.1,35,1.1,19,YTUrb22[Npt],KEEP,TRUE,,24,46,SI_Urb_22-1357,4.97,11.8,59.8,157,SI_Urb_22-1357,IL2021-44661
IL2021-19217,P0762A1-2-8/12-17257,drop,493.8,83.5,57.6,130.7,35.7,1.1,17,,KEEP,TRUE,,12,31,SI_Urb_22-912,7.24,15.2,58.7,1069,SI_Urb_22-912,
IL2021-26068,12-21235/KY09C-1245-99-8-5,drop,472,83.4,59.3,131.4,37.5,2,29,YTUrb22[Npt],KEEP,TRUE,,20,23,SI_Urb_22-680,7.14,14.3,59.7,1340,SI_Urb_22-680,IL2021-26068
IL2021-43909,14-28462/14-11830//14-28468,keep,489.2,83.4,60,131.5,34.2,1.4,18,,KEEP,TRUE,,29,21,SI_Urb_22-629,7.25,14.4,60.6,1229,SI_Urb_22-629,
IL2021-40648,07-20728/14-28462//12-26004,keep,502.3,83.4,59.4,131.6,35.5,0.8,13.2,YTUrb22[Npt],KEEP,TRUE,,14,42,SI_Urb_22-1247,6.26,10.9,63.2,407,SI_Urb_22-1247,IL2021-40648
IL2021-43970,14-28462/14-19503//14-28462,keep,497.2,83.4,59.6,131.6,37.2,1.1,13.8,YTUrb22[Lodging],KEEP,TRUE,,2,31,SI_Urb_22-902,6.53,14.7,59.7,1079,SI_Urb_22-902,IL2021-43970
IL2021-24937,12-8512/14-9542,keep,493.3,83.4,58.5,132,36.2,1,17.3,YTUrb22[Tall],KEEP,TRUE,,7,36,SI_Urb_22-1074,7.21,11.6,63.2,774,SI_Urb_22-1074,IL2021-24937
IL2021-26632,12-26004/P05247A1-7-3-120,keep,496.4,83.4,58.9,132.2,36,1,10.6,YTUrb22[Leaning],KEEP,TRUE,,6,23,SI_Urb_22-666,7.35,14.8,60.1,1326,SI_Urb_22-666,IL2021-26632
IL2021-17752,14-28462/14-11830,keep,503.3,83.4,59.2,132.3,35.9,0.6,8.9,,KEEP,TRUE,,27,34,SI_Urb_22-994,7.01,15.5,60.1,874,SI_Urb_22-994,
IL2021-16645,14-11830/14-11848,keep,493,83.4,58.2,132.4,35.2,0.9,16.7,"YTUrb22[Npt, mix]",KEEP,TRUE,,7,27,SI_Urb_22-787,7.12,13.7,59.1,1314,SI_Urb_22-787,IL2021-16645
IL2021-45202,15-10568/07-19334,drop,478.7,83.4,57.9,132.9,35.8,1.3,22.5,YTUrb22[Looks weak],KEEP,TRUE,,26,26,SI_Urb_22-755,7.03,14.2,58.5,1355,SI_Urb_22-755,IL2021-45202
IL2021-21732,07-19334/12-21235,drop,459.2,83.3,58.8,132.2,37.6,2.4,32,YTUrb22[Leaning],DISCARD,TRUE,,30,38,SI_Urb_22-1111,6.29,11.6,62.9,631,SI_Urb_22-1111,IL2021-21732
IL2021-13805,07-4415/14-28468,drop,480.1,83.3,57.7,131.5,38.6,1.3,24,,KEEP,TRUE,,22,11,SI_Urb_22-322,6.67,11.7,63.2,622,SI_Urb_22-322,
IL2021-16120,14-11772/07-20743,keep,508,83.3,59.4,131.2,36.6,0.6,12.8,,KEEP,TRUE,,21,13,SI_Urb_22-381,6.39,12,63.9,741,SI_Urb_22-381,
IL2021-36723,16-27570/14-28468,keep,499,83.3,59.4,132,36.7,0.8,13.1,,KEEP,TRUE,,9,13,SI_Urb_22-369,7.25,11.8,63.7,729,SI_Urb_22-369,
IL2021-18153,14-28468/07-19334,drop,473.5,83.3,59.3,133,37.5,1.6,22.6,YTUrb22[Lodg],DISCARD,TRUE,,11,37,SI_Urb_22-1091,7.33,11.9,63.7,710,SI_Urb_22-1091,IL2021-18153
IL2021-25334,12-17257/07-20728,keep,487.3,83.3,59.4,132.6,36.4,1.1,17.7,YTUrb22[Lodg],KEEP,TRUE,,16,40,SI_Urb_22-1185,6.83,11.4,62.9,525,SI_Urb_22-1185,IL2021-25334
IL2021-43972,14-28462/14-19503//14-28462,keep,484,83.2,58.8,131.6,36.4,1.6,19.3,"YTNeo22[npt, thin, septoria]",KEEP,TRUE,,21,47,SI_Urb_22-1401,6.02,11.6,62.1,100,SI_Urb_22-1401,IL2021-43972
IL2021-42618,14-11848/14-28462//02-19463-7,drop,477.9,83.2,57,133,36.3,0.7,13.1,YTUrb22[Leaning],KEEP,TRUE,,22,48,SI_Urb_22-1419,5.42,12,59.7,39,SI_Urb_22-1419,IL2021-42618
IL2021-43205,14-28462/07-19334//12-26004,keep,492.2,83.2,58,131.9,36.5,1.2,13.7,"YTUrb22[Npt, clean, lot of heads]",KEEP,TRUE,,6,25,SI_Urb_22-726,7.57,13.4,58,1435,SI_Urb_22-726,IL2021-43205
IL2021-15263,07-20728/14-28468,keep,505,83.2,59.6,132,36.4,0.6,8.9,,KEEP,TRUE,,1,35,SI_Urb_22-1021,6.87,15.9,59.7,840,SI_Urb_22-1021,
IL2021-15809,12-8545/14-28468,keep,487.4,83.2,59.5,132,35.5,1.4,15.7,YTUrb22[Mix],KEEP,TRUE,,10,46,SI_Urb_22-1371,5.08,11.8,62.1,171,SI_Urb_22-1371,IL2021-15809
IL2021-16728,14-11830/14-28462,keep,505.6,83.2,58.8,132.3,36.5,0.4,8.8,,KEEP,TRUE,,26,14,SI_Urb_22-395,7.72,16,59.1,806,SI_Urb_22-395,
IL2021-18320,14-28468/14-11772,drop,485.6,83.2,58.8,131.8,37,1.5,16.4,"YTNeo22[ve, tall]",DISCARD,TRUE,,29,34,SI_Urb_22-992,6.61,15.6,59.3,872,SI_Urb_22-992,IL2021-18320
IL2021-28768,14-9542/16-27570,drop,478.2,83.2,57.7,132,34.5,1.4,21.2,,KEEP,TRUE,,1,27,SI_Urb_22-781,6.38,14.2,58.7,1320,SI_Urb_22-781,
IL2021-14779,07-19334/14-28468,keep,485.5,83.2,59.5,132.6,36,1.2,16.5,YTUrb22[Lodg],KEEP,TRUE,,2,32,SI_Urb_22-959,6.79,15,61.1,1019,SI_Urb_22-959,IL2021-14779
IL2021-43941,14-28462/14-19503//14-28462,keep,492.4,83.2,59,132.6,35.8,1,12.9,,KEEP,TRUE,,28,41,SI_Urb_22-1228,5.24,11.1,62.5,453,SI_Urb_22-1228,
IL2021-19438,P0762A1-2-8/14-11312,keep,479.5,83.2,58.1,132.8,37.2,1.3,22.2,,KEEP,TRUE,,21,18,SI_Urb_22-520,7.01,15.5,59.3,1041,SI_Urb_22-520,
IL2021-16722,14-11830/14-28462,keep,488.2,83.2,58.6,133.2,36.5,0.9,15.8,,KEEP,TRUE,,23,11,SI_Urb_22-323,7.48,11.6,63.6,623,SI_Urb_22-323,
IL2021-8749,13-1960/IL12-26004,keep,499,83.1,58.6,130,35.6,1.2,18,YTNeo22[septoria],KEEP,TRUE,,25,28,SI_Urb_22-816,7.71,14.2,59.5,1236,SI_Urb_22-816,IL2021-8749
IL2021-21733,07-19334/12-21235,drop,474.8,83.1,59.3,132.2,37,1.7,23.2,,KEEP,TRUE,,4,15,SI_Urb_22-424,7.07,15.3,61.1,844,SI_Urb_22-424,
IL2021-6771,12-8512/IL12-26004,drop,488,83.1,57.8,130.6,35.7,1.4,21.6,YTUrb22[Leaning],KEEP,TRUE,,20,39,SI_Urb_22-1160,6.42,11.4,62.8,581,SI_Urb_22-1160,IL2021-6771
IL2021-6811,12-8512/IL12-26004,drop,469.4,83.1,57.2,131.3,36.1,1.6,22.5,YTNeo22[leaning],DISCARD,TRUE,,22,29,SI_Urb_22-862,8.05,13.4,59.9,1179,SI_Urb_22-862,IL2021-6811
IL2021-43963,14-28462/14-19503//14-28462,keep,487.4,83.1,58.7,131.5,35.4,1.4,18.7,,KEEP,TRUE,,27,20,SI_Urb_22-574,7.37,14.3,59.5,1167,SI_Urb_22-574,
IL2021-15207,07-20728/14-28462,keep,498.1,83.1,59.8,132.5,36.9,0.7,12.6,YTNeo22[ve],KEEP,TRUE,,11,34,SI_Urb_22-1010,8.06,15.4,61.2,890,SI_Urb_22-1010,IL2021-15207
IL2021-21635,07-19334/12-8512,keep,483.9,83.1,58.7,132.8,35.3,1.2,16.7,YTNeo22[leaning],KEEP,TRUE,,27,23,SI_Urb_22-687,7.73,14,60.4,1347,SI_Urb_22-687,IL2021-21635
IL2021-15070,07-20728/14-11830,,475.8,83,59,133.5,35.3,1.2,23.4,YTUrb22[Leaning],KEEP,TRUE,,4,22,SI_Urb_22-657,6.81,14.6,59.8,1264,SI_Urb_22-657,IL2021-15070
IL2021-5065,07-4415/13-1910,keep,499.8,83,58.4,130.8,35.6,0.9,16.8,YTNeo22[septoria],KEEP,TRUE,,5,45,SI_Urb_22-1325,7.13,11.3,62.9,236,SI_Urb_22-1325,IL2021-5065
IL2021-44705,14-28468/14-11848//16-4939,keep,491.5,83,58.3,131,37.1,1,24.7,,KEEP,TRUE,,25,10,SI_Urb_22-276,6.42,11.8,62.2,565,SI_Urb_22-276,
IL2021-22937,07-20743/15-10568,drop,496.3,83,58.8,133,35.3,0.6,12.1,,KEEP,TRUE,,2,33,SI_Urb_22-962,6.72,15.7,58.9,959,SI_Urb_22-962,
IL2021-21471,07-4415/14-3934,drop,481.6,83,57.1,132.5,35.8,0.8,11.9,YTUrb22[Tall],KEEP,TRUE,,8,32,SI_Urb_22-953,6.92,15.3,57.6,1013,SI_Urb_22-953,IL2021-21471
IL2021-17863,14-28462/14-28468,keep,484.4,83,59.9,131.4,35.3,1.5,20.5,YTUrb22[Npt],KEEP,,,26,34,SI_Urb_22-995,7.73,15.9,60,875,SI_Urb_22-995,IL2021-17863
IL2021-40641,07-20728/14-28462//12-26004,keep,496.1,83,59.6,131.8,35.8,0.9,14.8,"YTUrb22[Npt, late]",KEEP,TRUE,,19,42,SI_Urb_22-1242,6.44,11.2,62.2,402,SI_Urb_22-1242,IL2021-40641
IL2021-43253,14-28462/07-20728//02-19463-7,drop,484.7,83,58.7,132.2,37,1.2,20,YTNeo22[sept],KEEP,TRUE,,28,22,SI_Urb_22-633,8.08,14.3,60.3,1288,SI_Urb_22-633,IL2021-43253
IL2021-17919,14-28462/14-28468,keep,484.7,83,59.5,131.9,35.5,1.4,18.5,"YTNeo22[early, npt]",KEEP,TRUE,,29,36,SI_Urb_22-1052,6.33,11.8,63.8,752,SI_Urb_22-1052,IL2021-17919
IL2021-24110,10-21934/14-11772,keep,486.7,83,58.5,132.4,36.8,1.1,17.5,,KEEP,TRUE,,20,38,SI_Urb_22-1121,6.75,11.8,61.7,641,SI_Urb_22-1121,
IL2021-34245,15-10568/13-1910,keep,485.6,83,59.1,132.4,35.4,1.2,19,YTUrb22[Leaning],KEEP,TRUE,,30,18,SI_Urb_22-511,7.09,15.6,59.7,1050,SI_Urb_22-511,IL2021-34245
IL2021-17431,14-28462/07-19334,keep,495.3,83,59.4,132.6,36.5,0.8,11,,KEEP,TRUE,,19,20,SI_Urb_22-582,8.61,14.3,59.9,1159,SI_Urb_22-582,
IL2021-1546,MO080104/14-29714,drop,469.6,83,57.4,132.4,36.4,1.4,21.2,,KEEP,TRUE,,18,8,SI_Urb_22-223,6.45,11.1,60.4,438,SI_Urb_22-223,
IL2021-16212,14-11772/14-11830,keep,490.4,83,58.9,132.9,35.9,0.8,15,,KEEP,TRUE,"6/25/2022, 10:10:53 AM, Tare Warning, Test Weight: 4.97",13,38,SI_Urb_22-1128,6.47,11.5,64.4,648,SI_Urb_22-1128,
IL2021-39945,07-20728/07-4415//07-20728,drop,498.9,82.9,59,132,38.6,0.7,13.1,YTUrb22[Lodging],DISCARD,TRUE,,29,29,SI_Urb_22-869,7.51,13.6,63.4,1172,SI_Urb_22-869,IL2021-39945
IL2021-5101,07-4415/13-1910,drop,483.6,82.9,57.1,131.9,36.3,0.7,13.7,,KEEP,TRUE,,8,28,SI_Urb_22-833,7.62,14.3,57.3,1253,SI_Urb_22-833,
IL2021-34213,15-10568/13-1910,keep,492.1,82.9,59.4,131.4,36.1,1.1,18.2,YTUrb22[Leaning],KEEP,TRUE,,13,27,SI_Urb_22-793,7.71,14.3,61,1308,SI_Urb_22-793,IL2021-34213
IL2021-43913,14-28462/14-11830//14-28468,keep,493.5,82.9,59.4,131.6,33.8,1.1,13.9,YTUrb22[Lodg],KEEP,TRUE,,21,22,SI_Urb_22-640,7.3,14,61.9,1281,SI_Urb_22-640,IL2021-43913
IL2021-33378,14-28462/12-26004,drop,472.7,82.9,58.4,131.4,36.9,1.9,27.9,,KEEP,TRUE,,3,13,SI_Urb_22-363,6.83,11.7,62.1,723,SI_Urb_22-363,
IL2021-46024,14-28462/14-9546,,488.7,82.9,58.2,133.8,37.4,0.8,11.1,YTNeo22[late],DISCARD,TRUE,,18,47,SI_Urb_22-1398,4.86,11.9,60.8,103,SI_Urb_22-1398,IL2021-46024
IL2021-28811,14-9542/16-27570,drop,492.9,82.9,59.3,132.9,37.1,0.7,13.9,,KEEP,TRUE,,11,46,SI_Urb_22-1370,5.08,12.5,59.4,170,SI_Urb_22-1370,
IL2021-35122,15-27270/12-17257,keep,489,82.9,59.2,132.5,36,1,15.4,,KEEP,TRUE,,4,31,SI_Urb_22-904,7.24,15,60.1,1077,SI_Urb_22-904,
IL2021-7568,IL12-26004/14-11750,drop,496.8,82.9,58.1,131.3,36.4,1,15.2,YTUrb22[Ve],DISCARD,TRUE,,30,28,SI_Urb_22-811,5.81,14,59.6,1231,SI_Urb_22-811,IL2021-7568
IL2021-28578,14-9542/14-9546,keep,497,82.8,58.9,130.7,35.7,1.1,15.9,YTUrb22[Leaning],KEEP,TRUE,,18,41,SI_Urb_22-1218,6.57,11.1,62.3,463,SI_Urb_22-1218,IL2021-28578
IL2021-40638,07-20728/14-28462//12-26004,drop,498.1,82.8,59.5,132,37.9,0.7,12.7,,KEEP,TRUE,,25,9,SI_Urb_22-265,6.9,11.1,61.9,505,SI_Urb_22-265,
IL2021-28770,14-9542/16-27570,keep,495.7,82.8,58.3,131.5,35.4,0.8,17.2,YTUrb22[Npt],KEEP,TRUE,,20,35,SI_Urb_22-1040,7.69,16.3,59,821,SI_Urb_22-1040,IL2021-28770
IL2021-35538,15-27666/12-21235,keep,485.9,82.8,59,132.2,36.2,1.2,16.1,,KEEP,TRUE,,8,29,SI_Urb_22-848,7.29,14.4,58,1193,SI_Urb_22-848,
IL2021-19241,P0762A1-2-8/12-17257,drop,467.6,82.8,57.5,132.3,33.9,1.5,25,,KEEP,TRUE,"6/27/2022, 4:01:16 PM, Tare Warning, Test Weight: 4.89",2,29,SI_Urb_22-842,6.48,14.9,56.9,1199,SI_Urb_22-842,
IL2021-14041,07-19334/07-4415,drop,455.9,82.7,56.9,131.9,36.6,1.6,24.8,YTUrb22[Tall],DISCARD,TRUE,,8,26,SI_Urb_22-773,7.87,14.2,57.6,1373,SI_Urb_22-773,IL2021-14041
IL2021-22610,07-20728/14-28444,drop,495.6,82.7,59.5,132.8,37.9,0.7,9.9,,KEEP,TRUE,,23,8,SI_Urb_22-218,7.03,11.4,62.9,443,SI_Urb_22-218,
IL2021-13723,07-4415/14-28462,keep,499,82.7,58.5,131.2,35.7,0.9,13.7,,KEEP,TRUE,,19,25,SI_Urb_22-739,8.43,13.6,60.6,1422,SI_Urb_22-739,
IL2021-24426,10-21934/14-28468,drop,477.7,82.7,57.9,132.6,37.1,1.3,20.7,,KEEP,TRUE,,29,37,SI_Urb_22-1109,6.34,12.3,60.2,692,SI_Urb_22-1109,
IL2021-41976,14-11772/07-20728//14-28462,drop,483.2,82.7,59.8,131.7,37.5,1.4,19,YTUrb22[Tall],DISCARD,TRUE,,1,32,SI_Urb_22-960,6.12,14.9,61.1,1020,SI_Urb_22-960,IL2021-41976
IL2021-16031,14-11772/07-4415,drop,482.6,82.7,58.9,132.6,38.5,1.2,19,,KEEP,TRUE,,18,9,SI_Urb_22-258,6.98,11,62.2,498,SI_Urb_22-258,
IL2021-43330,14-28462/07-20728//10-21934,keep,490.3,82.7,58,131.6,36.1,1.1,17.2,,KEEP,TRUE,,11,12,SI_Urb_22-350,7.44,12.2,62.2,671,SI_Urb_22-350,
IL2021-43932,14-28462/14-11830//14-28468,keep,491.8,82.7,59.6,132,35.3,1,12.6,,KEEP,TRUE,,1,31,SI_Urb_22-901,6.72,14.7,61.1,1080,SI_Urb_22-901,
IL2021-28535,14-9542/12-21235,keep,482.1,82.7,58.4,132.4,36,1.2,19.7,,KEEP,TRUE,,17,41,SI_Urb_22-1217,7.09,11.2,62.1,464,SI_Urb_22-1217,
IL2021-3613,P0566A1-3-1-52/11-6543,keep,476.5,82.7,58.7,132.4,36.5,1.4,23.6,,KEEP,TRUE,,25,14,SI_Urb_22-396,7.13,16.2,57.7,805,SI_Urb_22-396,
IL2021-46013,14-28462/14-9546,keep,488.9,82.7,58.9,132.7,36.3,0.9,14.3,"YTNeo22[scab, thick]",KEEP,TRUE,,5,47,SI_Urb_22-1385,6.89,11.6,62.5,116,SI_Urb_22-1385,IL2021-46013
IL2021-17848,14-28462/14-28468,keep,485.7,82.6,60,131.3,35.3,1.3,19.4,YTUrb22[Npt],KEEP,TRUE,,25,33,SI_Urb_22-985,7.47,15.8,59.9,936,SI_Urb_22-985,IL2021-17848
IL2021-34203,15-10568/13-1910,keep,492.9,82.6,59.8,131.3,37.1,1.1,15.8,YTUrb22[Looks weak],KEEP,TRUE,,23,18,SI_Urb_22-518,6.94,15.2,61.6,1043,SI_Urb_22-518,IL2021-34203
IL2021-35723,16-4939/12-17428,keep,480.4,82.6,58.6,131.9,34.5,1.3,22.9,YTUrb22[Npt],KEEP,TRUE,,19,26,SI_Urb_22-762,8.31,13.8,59.4,1362,SI_Urb_22-762,IL2021-35723
IL2021-44005,14-28462/14-19503//14-28462,keep,484.8,82.6,58.9,132,35.2,1.3,17,"YTNeo22[clean, sea of heads]",KEEP,TRUE,,11,47,SI_Urb_22-1391,5.09,11.7,62.1,110,SI_Urb_22-1391,IL2021-44005
IL2021-28030,14-3934/12-17257,drop,482.7,82.6,57.9,132.6,35,1.2,16.7,,KEEP,TRUE,,25,8,SI_Urb_22-216,6.27,11.4,61.9,445,SI_Urb_22-216,
IL2021-14676,07-19334/14-28462,keep,480.4,82.6,59,132.6,36.6,1.2,20.6,,KEEP,TRUE,,17,11,SI_Urb_22-317,6.8,11.7,62.9,617,SI_Urb_22-317,
IL2021-46857,07-20728/07-4415//15-27270,keep,485.5,82.6,58.7,133,35.9,1,15.4,YTUrb22[Lodg],KEEP,TRUE,,28,35,SI_Urb_22-1048,7.3,15.6,59.6,813,SI_Urb_22-1048,IL2021-46857
IL2021-37737,07-4415/IL12-26004//10-21934,keep,512.5,82.5,59,130,35.1,0.6,8,YTUrb22[Npt],KEEP,TRUE,,12,16,SI_Urb_22-469,7.44,16,58.3,912,SI_Urb_22-469,IL2021-37737
IL2021-17859,14-28462/14-28468,keep,486.5,82.5,59.9,130.9,35.1,1.4,18.8,,KEEP,TRUE,,16,33,SI_Urb_22-976,7.04,15.8,59.9,945,SI_Urb_22-976,
IL2021-26762,12-26004/07-19334,drop,488.4,82.5,58.2,132.6,37.4,1.1,11.6,,DISCARD,TRUE,,18,23,SI_Urb_22-678,7.68,14.2,58.8,1338,SI_Urb_22-678,
IL2021-15733,12-8545/14-28462,drop,491.1,82.5,59.6,131.4,37,1.1,14.9,,KEEP,TRUE,,15,11,SI_Urb_22-315,7.76,11.7,63.5,615,SI_Urb_22-315,
IL2021-27417,13-1910/07-4415,drop,488.2,82.5,57.4,130.5,36.8,1.1,13.7,,KEEP,TRUE,,21,8,SI_Urb_22-220,7.13,11.5,60.4,441,SI_Urb_22-220,
IL2021-17838,14-28462/14-28468,keep,484,82.5,59.6,131.7,34.8,1.3,18.2,"YTUrb22[ve, npt]",KEEP,TRUE,,22,17,SI_Urb_22-502,7.1,15,60.9,982,SI_Urb_22-502,IL2021-17838
IL2021-46237,14-28468/12-26004,drop,478.8,82.5,57.3,132.1,35.9,1,13.8,YTUrb22[Leaning],KEEP,TRUE,,19,19,SI_Urb_22-559,7.29,14.6,57.7,1099,SI_Urb_22-559,IL2021-46237
IL2021-29957,14-11312/14-28307,drop,485.3,82.4,57.8,132.8,36.8,0.9,13.5,,KEEP,TRUE,,5,14,SI_Urb_22-416,7.24,15.9,58.4,785,SI_Urb_22-416,
IL2021-42056,14-11772/14-11830//14-3934,drop,493.6,82.4,58.9,132.9,38.3,0.7,10.1,YTUrb22[Tall],DISCARD,TRUE,,7,34,SI_Urb_22-1014,7.36,15.8,59.5,894,SI_Urb_22-1014,IL2021-42056
IL2021-30921,14-11848/10-21934,drop,472,82.4,57.2,132.6,35.4,1.1,14.3,,KEEP,TRUE,,30,10,SI_Urb_22-271,6.58,12.1,60.6,570,SI_Urb_22-271,
IL2021-43809,14-28462/14-11830//12-26004,drop,488.2,82.4,58.1,131.6,35.1,1.2,14.3,,DISCARD,TRUE,,28,45,SI_Urb_22-1348,4.93,11.6,61,213,SI_Urb_22-1348,
