germplasmName,purdy.pedigree,decision,merit,Grain.yield...bu.ac,Grain.test.weight...lbs.bu,Heading.time...Julian.date..JD..,Plant.height.inches,FHB.DON.content...ppm.,FHB.grain.incidence.....,notes3,action,Found,Quick.Note.,range.,row.,plot_me.,Weight..lb.,Moisture....,Test.Weight..lb.bu.,Harvest.Sequence.,seedlot_me,ugid
IL2021-34260,15-10568/14-3934,,460.4,76.6,57.9,131.8,36.2,0.9,13,,KEEP,TRUE,,17,13,SI_Urb_22-377,6.65,12.1,61.4,737,SI_Urb_22-377,
IL2021-2661,DH11SRW8-59/IL13-20616,,434,76.6,58.7,132.5,35.2,1.9,26.7,,DISCARD,TRUE,,11,35,SI_Urb_22-1031,8.17,15.6,60.6,830,SI_Urb_22-1031,
IL2021-4047,02-19463-5/P0566A1-3-1-52,,440.6,76.5,57.5,132,35.9,1.1,25.3,,KEEP,TRUE,,17,15,SI_Urb_22-437,5.93,16.1,55.8,857,SI_Urb_22-437,
IL2021-26311,12-21235/14-11312,,447,76.5,57.5,131.7,35.6,1.2,17,YTUrb22[Leaning],DISCARD,TRUE,,5,23,SI_Urb_22-665,7.32,14.4,59.2,1325,SI_Urb_22-665,IL2021-26311
IL2021-30869,14-11830/14-3934,,454.2,76.5,58.2,132.4,36.4,0.9,18.3,,DISCARD,TRUE,,3,41,SI_Urb_22-1203,6.74,11.2,62.2,478,SI_Urb_22-1203,
IL2021-32720,14-28444/12-26004,drop,480.1,76.4,58.3,130,35.4,0.5,6.7,,DISCARD,TRUE,,1,21,SI_Urb_22-601,6.57,14.3,59.9,1201,SI_Urb_22-601,
IL2021-33722,14-28468/12-17257,,453.3,76.4,60.4,130,35.1,1.6,22.3,YTUrb22[Looks weak],DISCARD,TRUE,,17,38,SI_Urb_22-1124,6.31,11.4,64.6,644,SI_Urb_22-1124,IL2021-33722
IL2021-18405,14-28468/14-11772,,453.1,76.4,59.9,130.7,36.8,1.5,20,,DISCARD,TRUE,,30,34,SI_Urb_22-991,6.29,15.7,59.7,871,SI_Urb_22-991,
IL2021-29465,14-9546/15-25742,,464.6,76.4,58.5,130.5,33.2,0.9,16.6,"YTUrb22[ve, short]",DISCARD,TRUE,,5,46,SI_Urb_22-1376,6.32,11.2,62.2,176,SI_Urb_22-1376,IL2021-29465
IL2021-9478,IL13-20616/14-9527,,441.4,76.4,58.7,132,35.6,1.5,26.3,YTUrb22[Leaning],DISCARD,TRUE,,27,27,SI_Urb_22-807,6.85,14.4,60.6,1294,SI_Urb_22-807,IL2021-9478
IL2021-18738,MO080104/12-17257,,447.5,76.4,58.6,132.5,36.5,1.4,15.5,YTUrb22[Tall],DISCARD,TRUE,,23,34,SI_Urb_22-998,6.39,16.4,57.9,878,SI_Urb_22-998,IL2021-18738
IL2021-41207,07-20743/14-28462//14-28462,,454.1,76.3,60.9,132.5,37.1,0.9,16.3,YTUrb22[Tall],DISCARD,TRUE,,25,40,SI_Urb_22-1176,5.91,11.1,64.3,516,SI_Urb_22-1176,IL2021-41207
IL2021-26777,12-26004/07-19334,,447.8,76.3,58,132.4,37.5,1.3,15.5,YTUrb22[Leaning],DISCARD,TRUE,,25,23,SI_Urb_22-685,7.83,13.7,60.5,1345,SI_Urb_22-685,IL2021-26777
IL2021-8769,13-1960/IL12-26004,,460.9,76.3,58,131.5,35.1,0.9,12.9,,DISCARD,TRUE,,20,28,SI_Urb_22-821,7.84,14.1,60,1241,SI_Urb_22-821,
IL2021-47129,14-11848/07-19334//16-18944,,410.9,76.3,57.3,132.5,36,2.1,37.2,YTUrb22[Leaning],DISCARD,TRUE,,27,47,SI_Urb_22-1407,4.78,12,59.4,94,SI_Urb_22-1407,IL2021-47129
IL2021-12915,14-28864/12-8512,,452.8,76.3,58.6,131.6,36.5,1.2,17.9,,KEEP,TRUE,,26,13,SI_Urb_22-386,6.9,11.8,62.5,746,SI_Urb_22-386,
IL2021-4235,02-19463-5/IL12-26004,,448.6,76.2,57.4,131.1,36.3,1,19.1,,KEEP,TRUE,,11,14,SI_Urb_22-410,7.03,15.7,59.5,791,SI_Urb_22-410,
IL2021-39673,07-19334/14-28462//12-17257,,448.6,76.2,59.2,130.4,35.2,1.7,23.1,,DISCARD,TRUE,,23,24,SI_Urb_22-698,7.08,13.9,60.3,1403,SI_Urb_22-698,
IL2021-27113,12-21235/KY09C-1245-99-8-5,,462,76.2,57.9,132.3,37.9,0.5,10.5,YTNeo22[late],DISCARD,TRUE,,24,31,SI_Urb_22-924,6.71,15.2,58.4,1057,SI_Urb_22-924,IL2021-27113
IL2021-41437,12-8545/07-20728//14-28307,,468.9,76.2,59.1,131.1,35.9,0.6,11.4,,DISCARD,TRUE,,9,34,SI_Urb_22-1012,7.43,16,59.4,892,SI_Urb_22-1012,
IL2021-11441,14-11750/07-4415,,463.9,76.2,58.3,131.3,36.4,0.7,14.5,,DISCARD,TRUE,,26,28,SI_Urb_22-815,7,14.5,59.5,1235,SI_Urb_22-815,
IL2021-30255,14-11772/12-8512,,452.8,76.2,59.6,131.2,37,1.3,18.2,YTUrb22[Sea of heads],DISCARD,TRUE,,27,32,SI_Urb_22-934,6.55,15.5,59.6,994,SI_Urb_22-934,IL2021-30255
IL2021-47149,14-11848/14-28462//16-9335,,432.3,76.2,59.7,132.3,35.6,1.8,30,YTUrb22[Npt],DISCARD,TRUE,,29,19,SI_Urb_22-569,7.86,14.9,60.7,1109,SI_Urb_22-569,IL2021-47149
IL2021-28806,14-9542/16-27570,,457.1,76.2,59,132.3,35.7,0.8,14.5,,DISCARD,TRUE,,8,36,SI_Urb_22-1073,6.49,11.7,64.3,773,SI_Urb_22-1073,
IL2021-29030,14-9546/12-8512,,428,76.2,57.1,131.3,32.9,1.7,25.5,YTNeo22[disease],DISCARD,TRUE,,20,36,SI_Urb_22-1061,7.4,11.9,61.5,761,SI_Urb_22-1061,IL2021-29030
IL2021-28930,14-9546/P05247A1-7-3-120,,450.7,76.2,59.2,129.9,35,1.5,27.7,,KEEP,TRUE,,20,12,SI_Urb_22-341,6.65,11.7,62.2,680,SI_Urb_22-341,
IL2021-34720,15-25742/12-26004,,469.9,76.2,58.6,130.7,36.2,0.6,11.5,,KEEP,TRUE,,5,10,SI_Urb_22-296,6,11.6,62.5,545,SI_Urb_22-296,
IL2021-36811,16-30378/P05247A1-7-3-108-2,,448.7,76.2,59.5,132.5,35.9,1.1,18.5,,KEEP,TRUE,,15,15,SI_Urb_22-435,8.22,15.9,59.8,855,SI_Urb_22-435,
IL2021-35660,16-4939/12-17428,,452.7,76.2,58.9,131.8,33.8,1.1,18,YTUrb22[septoria],DISCARD,TRUE,,22,30,SI_Urb_22-879,6.85,14.8,59.9,1119,SI_Urb_22-879,IL2021-35660
IL2021-39337,07-4415/14-11848//12-8512,,447.5,76.1,58,131.8,35.3,1.3,21.8,,DISCARD,TRUE,,5,16,SI_Urb_22-476,7.05,16,58.6,905,SI_Urb_22-476,
IL2021-26173,12-21235/12-26004,,443.6,76.1,59,131.1,35.8,1.6,26.3,YTUrb22[Mix],DISCARD,TRUE,,4,26,SI_Urb_22-777,7.35,13.8,61.5,1377,SI_Urb_22-777,IL2021-26173
IL2021-6804,12-8512/IL12-26004,,467,76.1,58.3,130.4,37.3,0.8,13.9,YTUrb22[Lodg],DISCARD,TRUE,,21,46,SI_Urb_22-1360,4.78,11.5,61.4,160,SI_Urb_22-1360,IL2021-6804
IL2021-8465,13-1910/12-30879,,448.5,76.1,58.5,131.4,36.9,1.3,21.7,YTUrb22[Leaning],DISCARD,TRUE,,1,20,SI_Urb_22-600,6.54,14.9,60.7,1141,SI_Urb_22-600,IL2021-8465
IL2021-11622,14-11750/13-1960,,467.2,76.1,59.2,131.3,36.3,0.6,11.2,,KEEP,TRUE,,25,13,SI_Urb_22-385,6.96,11.9,64.2,745,SI_Urb_22-385,
IL2021-43225,14-28462/07-19334//12-26004,,470.3,76.1,58.6,130.6,36.6,0.7,9.6,,DISCARD,TRUE,,29,20,SI_Urb_22-572,6.79,14.6,58.8,1169,SI_Urb_22-572,
IL2021-4811,07-4415/IL12-26004,keep,473.5,76,58,130.3,36.2,0.5,10.7,,KEEP,TRUE,,9,12,SI_Urb_22-352,6.55,11.7,61.7,669,SI_Urb_22-352,
IL2021-24324,10-21934/14-28444,,461,76,58.6,130.7,36.8,1.2,11.1,,KEEP,TRUE,,2,8,SI_Urb_22-239,6.77,11.2,61.5,422,SI_Urb_22-239,
IL2021-41349,12-8545/07-20728//14-28307,,478,76,59,131.4,34.6,0.1,2.4,"YTNeo22[septoria, ve]",DISCARD,TRUE,,16,48,SI_Urb_22-1425,4.97,11.7,61,45,SI_Urb_22-1425,IL2021-41349
IL2021-41433,12-8545/07-20728//14-28307,,465.2,76,59.2,131.3,35.8,0.7,9.4,,DISCARD,TRUE,,17,34,SI_Urb_22-1004,6.27,15.5,58.9,884,SI_Urb_22-1004,
IL2021-30565,14-11772/16-18944,,434.8,76,59.6,132,36.1,1.8,27.3,,DISCARD,TRUE,,22,32,SI_Urb_22-939,6.43,15.2,60.6,999,SI_Urb_22-939,
IL2021-45112,14-11830/12-8512,,445.9,76,57.6,133,36.3,0.8,14.2,,DISCARD,TRUE,,14,47,SI_Urb_22-1394,3.98,0,0,107,SI_Urb_22-1394,
IL2021-47112,14-11848/07-19334//16-18944,,432.9,76,56.8,132.9,34.9,0.8,15.8,YTUrb22[Looks strong],DISCARD,TRUE,,19,48,SI_Urb_22-1422,5.86,12.1,59,42,SI_Urb_22-1422,IL2021-47112
IL2021-35649,16-4939/12-17428,,443.4,76,59,130.9,34.2,1.6,26.9,"YTUrb22[Npt, tip awned]",DISCARD,TRUE,,9,16,SI_Urb_22-472,8.31,15.2,61,909,SI_Urb_22-472,IL2021-35649
IL2021-953,KY09C-0052-26-12-3/14-8147,,446.2,76,57.4,131.4,36.6,1.1,16.9,YTUrb22[Septoria],DISCARD,TRUE,,5,20,SI_Urb_22-596,5.83,14.4,57.9,1145,SI_Urb_22-596,IL2021-953
IL2021-2907,P0762A1-2-8/13-1910,,442.4,76,57.7,131.8,32.4,1.3,20.9,,KEEP,TRUE,,13,13,SI_Urb_22-373,7.57,11.8,62.9,733,SI_Urb_22-373,
IL2021-26266,12-21235/14-11312,,447.4,75.9,58.2,131.4,36.2,1.4,20.4,YTNeo22[sept],DISCARD,TRUE,,11,31,SI_Urb_22-911,7.41,14.9,58.7,1070,SI_Urb_22-911,IL2021-26266
IL2021-29657,14-11312/12-8512,,454.4,75.9,58.7,131.3,35.3,1.1,16.2,,KEEP,TRUE,,19,15,SI_Urb_22-439,6.64,16.1,59.4,859,SI_Urb_22-439,
IL2021-29865,14-11312/13-1910,,446.6,75.9,58.5,132.8,37,1.2,13.9,,DISCARD,TRUE,,20,32,SI_Urb_22-941,7.24,15.2,59.4,1001,SI_Urb_22-941,
IL2021-11225,14-11750/KY09C-0052-26-12-3,,459.6,75.9,58.6,131.2,35,0.9,14.9,,DISCARD,TRUE,,21,28,SI_Urb_22-820,7.13,14.2,60.8,1240,SI_Urb_22-820,
IL2021-15949,14-11772/07-4415,,448.3,75.9,59.2,131.6,38.4,1.3,20.3,YTUrb22[Tall],DISCARD,TRUE,,10,37,SI_Urb_22-1090,6.22,11.6,64,711,SI_Urb_22-1090,IL2021-15949
IL2021-42132,14-11772/14-11830//14-3934,,464.6,75.9,58.2,132.3,35.9,0.5,5.8,YTNeo22[disease],DISCARD,TRUE,,6,34,SI_Urb_22-1015,7.53,15.4,59.4,895,SI_Urb_22-1015,IL2021-42132
IL2021-6846,12-8512/IL12-26004,,463.2,75.8,58.6,131.2,37.6,0.8,10.7,YTUrb22[Lodging],DISCARD,TRUE,,29,38,SI_Urb_22-1112,5.85,11.8,62.4,632,SI_Urb_22-1112,IL2021-6846
IL2021-47116,14-11848/07-19334//16-18944,,428.5,75.8,58.2,133.1,36.6,1.7,28.2,,DISCARD,TRUE,,26,35,SI_Urb_22-1046,7.47,16.2,59.2,815,SI_Urb_22-1046,
IL2021-31401,14-11916/12-17257,,468.9,75.8,58.7,130.5,35.8,0.7,9.9,,DISCARD,TRUE,,3,40,SI_Urb_22-1198,6.36,11.3,62.9,538,SI_Urb_22-1198,
IL2021-46249,14-28468/12-26004,,425.5,75.8,57,133,34.6,1.1,21.7,,DISCARD,TRUE,,4,18,SI_Urb_22-537,6.82,14.7,57.7,1024,SI_Urb_22-537,
IL2021-28212,14-3934/14-28462,,462.6,75.8,58.8,132.1,36.7,0.6,7.5,,KEEP,TRUE,,2,9,SI_Urb_22-242,5.53,11,60.7,482,SI_Urb_22-242,
IL2021-34823,15-25742/,,452.8,75.8,58.4,131.6,36.4,1,17.5,YTUrb22[Leaning],DISCARD,TRUE,,5,17,SI_Urb_22-485,7.14,15,59.5,965,SI_Urb_22-485,IL2021-34823
IL2021-6212,IL09-3264-T2/07-4415,,424.2,75.8,57.4,132.2,35.4,1.6,29.1,YTUrb22[Mix],DISCARD,TRUE,,9,28,SI_Urb_22-832,7.84,14.2,59.7,1252,SI_Urb_22-832,IL2021-6212
IL2021-8279,IL13-451/12-8512,,433.4,75.8,59,132.2,38.5,1.7,26.9,YTUrb22[Lodging],DISCARD,TRUE,,12,21,SI_Urb_22-612,7.42,14.2,61.3,1212,SI_Urb_22-612,IL2021-8279
IL2021-2917,P0762A1-2-8/13-1910,,433.5,75.8,58.1,132.3,33.7,1.7,26.3,,KEEP,TRUE,,16,12,SI_Urb_22-345,6.75,11.7,62.2,676,SI_Urb_22-345,
IL2021-14230,07-19334/12-8545,,461.1,75.7,58.7,132.1,35.4,0.5,11.2,,KEEP,TRUE,,22,15,SI_Urb_22-442,6.06,15.8,59.4,862,SI_Urb_22-442,
IL2021-5120,07-4415/14-28864,,450.2,75.7,58.2,131.1,36.7,1.3,19.4,YTUrb22[Npt],DISCARD,TRUE,,14,45,SI_Urb_22-1334,4.78,12,60.4,227,SI_Urb_22-1334,IL2021-5120
IL2021-6525,10-21934/14-11750,,468.3,75.7,58.4,130.5,37.2,0.6,12.6,"YTUrb22[Tall, lodging]",DISCARD,TRUE,,18,40,SI_Urb_22-1183,6.51,11.4,61.6,523,SI_Urb_22-1183,IL2021-6525
IL2021-25829,12-17428/14-11848,,439.1,75.7,57.8,132,35.9,1.2,25,YTUrb22[Npt],DISCARD,TRUE,,29,42,SI_Urb_22-1232,5.24,11.7,60.3,392,SI_Urb_22-1232,IL2021-25829
IL2021-26639,12-26004/P05247A1-7-3-120,,445.1,75.7,58.4,131.4,35.4,1.3,24.2,,KEEP,TRUE,,14,15,SI_Urb_22-434,7.35,15.5,58.4,854,SI_Urb_22-434,
IL2021-11252,14-11750/KY09C-0052-26-12-3,,469.3,75.7,58.8,131.9,34,0.3,5.3,"YTUrb22[Npt, ve]",DISCARD,TRUE,,22,28,SI_Urb_22-819,7.24,14.4,60.7,1239,SI_Urb_22-819,IL2021-11252
IL2021-27960,14-3934/12-8512,,455.8,75.7,58.6,131.6,36.2,1,12.2,,DISCARD,TRUE,,4,40,SI_Urb_22-1197,6.83,11.3,62.5,537,SI_Urb_22-1197,
IL2021-22056,07-19334/15-25742,,468.1,75.6,58.6,131.3,35.4,0.4,9.1,,KEEP,TRUE,,28,10,SI_Urb_22-273,7.73,11.7,62.3,568,SI_Urb_22-273,
IL2021-15454,07-20743/14-28462,,458.7,75.6,60.1,130.9,36.3,1,12.9,,DISCARD,TRUE,,1,45,SI_Urb_22-1321,6.21,11.4,63.7,240,SI_Urb_22-1321,
IL2021-5779,07-21847/IL13-451,,428.1,75.6,58.4,131.3,37.1,2.1,32.4,YTUrb22[Lodg],DISCARD,TRUE,,28,25,SI_Urb_22-748,7.17,14,60.7,1413,SI_Urb_22-748,IL2021-5779
IL2021-41676,12-8545/14-28462//12-17257,,453.3,75.6,59.1,130.5,34.8,1.4,17.4,"YTUrb22[Npt, ve]",DISCARD,TRUE,,4,35,SI_Urb_22-1024,7.05,15.8,59.4,837,SI_Urb_22-1024,IL2021-41676
IL2021-29545,14-11312/07-4415,,432.3,75.6,57.1,131.7,36.3,1.3,19.4,,KEEP,TRUE,,15,10,SI_Urb_22-286,7.87,11.9,62.5,555,SI_Urb_22-286,
IL2021-18305,14-28468/14-11772,,446.6,75.6,60.1,131.7,37,1.3,18.7,YTUrb22[Tall],DISCARD,TRUE,,3,23,SI_Urb_22-663,7.03,14,61.1,1323,SI_Urb_22-663,IL2021-18305
IL2021-39970,07-20728/07-4415//07-20728,,452.5,75.5,59.4,131.3,36.1,1.1,17.5,YTUrb22[Leaning],DISCARD,TRUE,,9,30,SI_Urb_22-892,7.79,14.4,61,1132,SI_Urb_22-892,IL2021-39970
IL2021-29622,14-11312/12-8512,,434.2,75.5,59.1,132.5,36.3,1.6,23.8,,DISCARD,TRUE,,15,46,SI_Urb_22-1366,3.81,0,0,166,SI_Urb_22-1366,
IL2021-16721,14-11830/14-28462,,446.2,75.5,58.4,131.2,34.6,1.4,19.7,,KEEP,TRUE,,29,14,SI_Urb_22-392,7.19,16,58.8,809,SI_Urb_22-392,
IL2021-17568,14-28462/12-8545,,448.9,75.5,60.2,131,35.8,1.4,18.9,,DISCARD,TRUE,,27,33,SI_Urb_22-987,6.48,15.6,59.8,934,SI_Urb_22-987,
IL2021-12925,14-28864/12-8512,,452.7,75.5,58,131.8,36.2,1,15.5,,KEEP,TRUE,,3,11,SI_Urb_22-303,7.31,11.9,62.8,603,SI_Urb_22-303,
IL2021-39462,07-19334/07-4415//16-9335,,434.5,75.4,58.4,133,36.4,1.4,23,,DISCARD,TRUE,,26,30,SI_Urb_22-875,7.63,14.9,59.9,1115,SI_Urb_22-875,
IL2021-5824,07-21847/14-8147,,440.1,75.4,58.5,131.4,35.9,1.6,23.5,,DISCARD,TRUE,,8,16,SI_Urb_22-473,7.84,15.4,60.8,908,SI_Urb_22-473,
IL2021-25931,12-17428/14-11916,,441.5,75.4,58.9,132.4,37.1,1.2,21.2,YTUrb22[Lodging],DISCARD,TRUE,,17,26,SI_Urb_22-764,7.14,13.8,61.1,1364,SI_Urb_22-764,IL2021-25931
IL2021-27049,12-26004/15-13159,,417.6,75.4,56.8,132.7,36.4,1.4,24,YTUrb22[Lodging],DISCARD,TRUE,,7,41,SI_Urb_22-1207,7.18,11,61,474,SI_Urb_22-1207,IL2021-27049
IL2021-29977,14-11312/14-28307,,459.5,75.4,58.7,131.7,34.5,0.7,10.9,"YTUrb22[Short, weak]",DISCARD,TRUE,,19,31,SI_Urb_22-919,7.66,14.9,59.7,1062,SI_Urb_22-919,IL2021-29977
IL2021-18374,14-28468/14-11772,,445.2,75.4,59.7,131.8,37.5,1.3,18.1,YTUrb22[Mix],DISCARD,TRUE,,28,34,SI_Urb_22-993,6.44,16.1,59.1,873,SI_Urb_22-993,IL2021-18374
IL2021-35704,16-4939/12-17428,,454.2,75.4,59.5,131.6,34.5,0.8,16.1,YTUrb22[Lodg],DISCARD,TRUE,,3,17,SI_Urb_22-483,7.21,14.8,61.6,963,SI_Urb_22-483,IL2021-35704
IL2021-2869,P0762A1-2-8/13-1910,,467.8,75.4,58.4,130.5,34.5,0.6,10.7,YTUrb22[Lodging],DISCARD,TRUE,,22,36,SI_Urb_22-1059,7.13,11.8,63.2,759,SI_Urb_22-1059,IL2021-2869
IL2021-38956,14-11312/IL12-26004//12-26004,keep,464.8,75.3,58,130,35.5,0.9,9.3,,KEEP,TRUE,,27,12,SI_Urb_22-334,6.7,11.8,62,687,SI_Urb_22-334,
IL2021-22708,07-20728/15-13159,,457.8,75.3,59.9,132.2,37.6,0.5,12.4,YTUrb22[Tall],DISCARD,TRUE,,1,22,SI_Urb_22-660,5.92,15,59.7,1261,SI_Urb_22-660,IL2021-22708
IL2021-15748,12-8545/14-28468,,451.4,75.3,59.2,132,36.4,1,13.3,,DISCARD,TRUE,,7,33,SI_Urb_22-967,7.2,15.5,59.4,954,SI_Urb_22-967,
IL2021-9524,IL13-20616/14-9527,,455.8,75.3,58.4,131.1,34.4,0.9,17.2,,KEEP,TRUE,,17,9,SI_Urb_22-257,6.08,11.1,61.6,497,SI_Urb_22-257,
IL2021-25834,12-17428/14-11848,,432.9,75.2,58.4,131.9,35.5,1.7,27.2,YTUrb22[Leaning],DISCARD,TRUE,,27,42,SI_Urb_22-1234,5.26,11.7,61.6,394,SI_Urb_22-1234,IL2021-25834
IL2021-26357,12-21235/14-11916,,443.2,75.2,59,130.9,36.3,1.5,22.7,YTUrb22[Leaning],DISCARD,TRUE,,10,44,SI_Urb_22-1311,5.32,11.4,62.2,291,SI_Urb_22-1311,IL2021-26357
IL2021-17043,14-11848/14-11772,,451.2,75.2,60,133.1,37.1,0.5,13.9,,DISCARD,TRUE,,25,20,SI_Urb_22-576,7.04,14.6,62.4,1165,SI_Urb_22-576,
IL2021-33677,14-28468/12-17257,,455,75.2,59.8,130,35.5,1.3,17.2,,DISCARD,TRUE,,5,38,SI_Urb_22-1136,6.58,11.5,64,656,SI_Urb_22-1136,
IL2021-4279,02-19463-5/IL12-26004,,445.7,75.1,57.6,130.5,36.4,1.2,18.9,,KEEP,TRUE,,8,11,SI_Urb_22-308,7.41,11.8,60.9,608,SI_Urb_22-308,
IL2021-11020,14-11312/IL12-26004,,451.5,75.1,58,131.8,36.1,1,13.1,YTUrb22[Leaning],DISCARD,TRUE,,27,28,SI_Urb_22-814,7.61,14.4,59.9,1234,SI_Urb_22-814,IL2021-11020
IL2021-32904,14-28444/14-11911,,455.3,75.1,59.6,131.1,35.9,1,12.2,,KEEP,TRUE,,30,9,SI_Urb_22-270,6.5,11.5,61.4,510,SI_Urb_22-270,
IL2021-33446,14-28462/12-26004,,458.3,75.1,59.2,130.9,37.4,0.9,11.5,"YTUrb22[Sea of heads, a bit tall]",DISCARD,TRUE,,27,17,SI_Urb_22-507,6.5,14.9,60.3,987,SI_Urb_22-507,IL2021-33446
IL2021-34115,15-10568/12-26004,,462.9,75.1,58.7,130.2,37,0.8,14.3,,KEEP,TRUE,,29,11,SI_Urb_22-329,6.67,11.7,62.8,629,SI_Urb_22-329,
IL2021-41011,07-20728/14-28468//15-27666,,450.4,75,60,131.8,34.9,0.8,17.4,YTUrb22[Npt*],DISCARD,TRUE,,25,39,SI_Urb_22-1165,5.69,11.9,63.2,576,SI_Urb_22-1165,IL2021-41011
IL2021-25818,12-17428/14-11848,,432.5,75,58.7,131.3,35.5,1.7,30.7,,KEEP,TRUE,,28,13,SI_Urb_22-388,6.36,12,63,748,SI_Urb_22-388,
IL2021-26308,12-21235/14-11312,,441.2,75,57.8,132.4,35.9,1.1,16.1,,DISCARD,TRUE,,13,31,SI_Urb_22-913,7.29,14.9,59.8,1068,SI_Urb_22-913,
IL2021-18546,14-28468/14-19503,,460.9,75,59.3,130.5,35.5,0.9,10.5,,DISCARD,TRUE,,9,22,SI_Urb_22-652,6.67,14.4,59.7,1269,SI_Urb_22-652,
IL2021-39058,14-28864/14-9923//10-21934,,426,75,57.8,131.8,36.6,1.9,27.1,,KEEP,TRUE,,7,10,SI_Urb_22-294,7,11.6,62.1,547,SI_Urb_22-294,
IL2021-36161,16-18944/12-17428,,435,75,58.4,131.7,34,1.5,27.1,,DISCARD,TRUE,,24,26,SI_Urb_22-757,7.52,14.3,59.7,1357,SI_Urb_22-757,
IL2021-1937,MO150624/14-21519,,430,75,57.6,131.5,38.1,1.7,22.3,YTUrb22[Tall],DISCARD,TRUE,,30,46,SI_Urb_22-1351,5.26,11.6,61.3,151,SI_Urb_22-1351,IL2021-1937
IL2021-6855,12-8512/IL12-26004,,464.3,74.9,58.5,130.1,36.7,0.8,11.9,,DISCARD,TRUE,,24,38,SI_Urb_22-1117,5.57,11.7,62.6,637,SI_Urb_22-1117,
IL2021-11772,14-11750/14-9527,,463.1,74.9,59.3,131.1,37.1,0.4,11.3,,DISCARD,TRUE,,28,28,SI_Urb_22-813,6.87,14.1,60.5,1233,SI_Urb_22-813,
IL2021-33427,14-28462/12-26004,,468.2,74.9,58.7,130.7,37.3,0.4,7,YTUrb22[Mix],DISCARD,TRUE,,4,38,SI_Urb_22-1137,6.53,11.6,62.7,657,SI_Urb_22-1137,IL2021-33427
IL2021-28471,14-9542/12-21235,,450.6,74.9,59,131.6,35.5,1,15.3,,DISCARD,TRUE,,20,41,SI_Urb_22-1220,5.18,11.4,62.5,461,SI_Urb_22-1220,
IL2021-1828,MO150624/IL13-20616,,434.4,74.9,58.2,132.4,35.3,1.5,22,,DISCARD,TRUE,,23,38,SI_Urb_22-1118,6.38,11.8,61.4,638,SI_Urb_22-1118,
IL2021-26535,12-21235/16-9335,,430,74.8,59.5,132,35.9,1.7,26.8,,DISCARD,TRUE,,7,22,SI_Urb_22-654,7.67,14.9,60,1267,SI_Urb_22-654,
IL2021-24578,12-8512/P0762A1-2-8,,436,74.8,57.3,131.6,36.9,1.1,17.8,YTUrb22[Leaning],DISCARD,TRUE,,29,40,SI_Urb_22-1172,5.4,11.8,58.9,512,SI_Urb_22-1172,IL2021-24578
IL2021-27641,13-1910/12-17257,,463.3,74.8,59,131.3,35.7,0.5,7.8,,KEEP,TRUE,,18,14,SI_Urb_22-403,7.15,16.3,58.5,798,SI_Urb_22-403,
IL2021-11322,14-11750/MD09W272-8-4-13-3-15,,438.6,74.8,58.4,132.1,37,1.3,21.3,,DISCARD,TRUE,,12,26,SI_Urb_22-769,7.41,13.8,60.8,1369,SI_Urb_22-769,
IL2021-15963,14-11772/07-4415,,446.5,74.8,58.5,130.2,37.2,1.4,22.6,,KEEP,TRUE,,27,15,SI_Urb_22-447,7.42,15.9,57.7,867,SI_Urb_22-447,
IL2021-30867,14-11830/14-3934,,437.6,74.8,58.2,132.8,36.2,1.1,20.8,,DISCARD,TRUE,,18,32,SI_Urb_22-943,7.07,15.6,58.8,1003,SI_Urb_22-943,
IL2021-45972,14-28462/14-9546,,455.6,74.8,58.8,132.1,36.4,0.7,8.8,,KEEP,TRUE,,19,9,SI_Urb_22-259,6.59,11.4,60.8,499,SI_Urb_22-259,
IL2021-29115,14-9546/12-17257,,449.3,74.8,58.7,130.9,33.5,1.1,19.9,YTUrb22[Early and short],DISCARD,TRUE,,9,39,SI_Urb_22-1149,6.21,11.6,63.8,592,SI_Urb_22-1149,IL2021-29115
IL2021-35645,16-4939/12-17428,,447.1,74.8,58.4,131.1,33.9,1.2,18.1,YTUrb22[Short],DISCARD,TRUE,,18,30,SI_Urb_22-883,7.5,14.6,59.5,1123,SI_Urb_22-883,IL2021-35645
IL2021-45344,IL13-20616/IL12-26004,,454.2,74.8,59,132,38.2,0.6,12.4,,DISCARD,TRUE,"6/27/2022, 6:52:01 PM, Tare Warning, Test Weight: 6.29",5,24,SI_Urb_22-716,7.59,13.9,60.6,1385,SI_Urb_22-716,
IL2021-26561,12-21235/16-9335,,443.7,74.7,60.1,132.2,36.7,1.1,16.1,"YTUrb22[Mix, Tall]",DISCARD,TRUE,,7,23,SI_Urb_22-667,7.13,15.1,59.8,1327,SI_Urb_22-667,IL2021-26561
IL2021-15749,12-8545/14-28468,,463.3,74.7,59.4,130.8,34.9,0.6,6.9,YTUrb22[Scrappy],DISCARD,TRUE,,6,33,SI_Urb_22-966,6.29,15.7,58.6,955,SI_Urb_22-966,IL2021-15749
IL2021-15778,12-8545/14-28468,,459.5,74.7,59.3,130.7,36.3,0.8,12.2,YTUrb22[Leaning],DISCARD,TRUE,,4,37,SI_Urb_22-1084,6.98,11.6,63,717,SI_Urb_22-1084,IL2021-15778
IL2021-32646,14-28444/12-26004,,447.8,74.7,57.9,129.1,34.9,1.5,24.1,YTUrb22[Leaning],DISCARD,TRUE,,2,26,SI_Urb_22-779,5.73,13.5,59.1,1379,SI_Urb_22-779,IL2021-32646
IL2021-37116,MO080104/10-21934//02-19463-7,,447.8,74.7,58.3,132,37.4,1,13,YTUrb22[Tall],DISCARD,TRUE,,24,45,SI_Urb_22-1344,4.81,11.7,61.4,217,SI_Urb_22-1344,IL2021-37116
IL2021-1763,MO150624/07-4415,,416.1,74.7,56.8,132.7,36.9,1.3,22.3,,KEEP,TRUE,,4,14,SI_Urb_22-417,7.52,16.6,54.1,784,SI_Urb_22-417,
IL2021-3978,02-19463-5/P0566A1-3-1-52,,453.2,74.6,57.9,131.2,33.5,0.7,15,YTNeo22[sept],DISCARD,TRUE,,22,39,SI_Urb_22-1162,6.27,11.8,62.1,579,SI_Urb_22-1162,IL2021-3978
IL2021-6924,12-8512/14-9527,,438.1,74.6,58.1,131.3,35.9,1.5,23.8,,DISCARD,TRUE,,19,40,SI_Urb_22-1182,6.85,11.4,61.4,522,SI_Urb_22-1182,
IL2021-7015,12-8512/14-9923,,453.5,74.6,58.7,130.5,34.1,1,16.5,"YTUrb22[short, ve]",DISCARD,TRUE,,8,38,SI_Urb_22-1133,7.02,11.7,64,653,SI_Urb_22-1133,IL2021-7015
IL2021-8752,13-1960/IL12-26004,,427.6,74.6,58.7,130.8,37.1,2,32.3,,DISCARD,TRUE,,29,27,SI_Urb_22-809,6.44,14.2,59.9,1292,SI_Urb_22-809,
IL2021-30179,14-11772/12-8512,,448.1,74.6,59.8,130.5,37.1,1.3,17.1,,KEEP,TRUE,,17,14,SI_Urb_22-404,7.07,15.9,60.7,797,SI_Urb_22-404,
IL2021-16151,14-11772/12-8545,,452,74.6,59.7,131.6,36.2,0.8,12.2,YTUrb22[Leaning],DISCARD,TRUE,,8,39,SI_Urb_22-1148,6.36,11.7,63.5,593,SI_Urb_22-1148,IL2021-16151
IL2021-33954,14-28468/16-9335,,431.2,74.6,59.6,132.3,36.6,1.5,23.7,,KEEP,TRUE,,16,11,SI_Urb_22-316,7.22,12,63.5,616,SI_Urb_22-316,
IL2021-28405,14-3934/15-25742,,455.6,74.6,58.4,131.5,36.8,0.7,12.1,YTUrb22[Leaning],DISCARD,TRUE,,8,42,SI_Urb_22-1253,6.43,11,61.6,413,SI_Urb_22-1253,IL2021-28405
IL2021-36742,16-27570/14-28468,,449.8,74.6,59.1,131.2,36.1,1.1,13,YTUrb22[Lodg],DISCARD,TRUE,,12,19,SI_Urb_22-552,8.3,14.7,60.4,1092,SI_Urb_22-552,IL2021-36742
IL2021-40873,07-20728/14-28468//15-25742,,466.6,74.5,59.6,131,35.2,0.3,6.5,YTNeo22[leaning],DISCARD,TRUE,,29,39,SI_Urb_22-1169,5.02,11.8,61.9,572,SI_Urb_22-1169,IL2021-40873
IL2021-40910,07-20728/14-28468//15-25742,,451.7,74.5,59.2,130.7,34,1,16.9,YTUrb22[Leaning],DISCARD,TRUE,,17,40,SI_Urb_22-1184,6.03,11,63.2,524,SI_Urb_22-1184,IL2021-40910
IL2021-25858,12-17428/14-11848,,431.5,74.5,58.3,132.4,35.7,1.3,27.1,YTUrb22[Looks weak],DISCARD,TRUE,,16,21,SI_Urb_22-616,7.45,14.6,60.6,1216,SI_Urb_22-616,IL2021-25858
IL2021-27134,12-21235/KY09C-1245-99-8-5,,456.9,74.5,58.4,132.3,37.1,0.5,6.9,YTNeo22[leaning],DISCARD,TRUE,,15,32,SI_Urb_22-946,7.18,14.9,59.6,1006,SI_Urb_22-946,IL2021-27134
IL2021-31541,14-11916/12-26004,,440.4,74.5,57.9,130.5,35.3,1.5,23.5,YTUrb22[Lodging],DISCARD,TRUE,,14,41,SI_Urb_22-1214,6.03,11.3,61.4,467,SI_Urb_22-1214,IL2021-31541
IL2021-33668,14-28468/12-17257,,422.7,74.5,59.3,131.6,35.9,2.2,27.3,,KEEP,TRUE,,9,11,SI_Urb_22-309,6.76,11.6,64.2,609,SI_Urb_22-309,
IL2021-4265,02-19463-5/IL12-26004,,449,74.4,58.5,130.5,34.3,1.1,20.6,YTUrb22[Ve],DISCARD,TRUE,,6,44,SI_Urb_22-1315,6.88,11.1,62.1,295,SI_Urb_22-1315,IL2021-4265
IL2021-23771,10-21934/12-17428,,454,74.4,58.4,131.7,36.3,0.6,11.7,,KEEP,TRUE,,28,9,SI_Urb_22-268,7.09,11.3,61.5,508,SI_Urb_22-268,
