germplasmName,purdy.pedigree,decision,merit,Grain.yield...bu.ac,Grain.test.weight...lbs.bu,Heading.time...Julian.date..JD..,Plant.height.inches,FHB.DON.content...ppm.,FHB.grain.incidence.....,notes3,action,Found,Quick.Note.,range.,row.,plot_me.,Weight..lb.,Moisture....,Test.Weight..lb.bu.,Harvest.Sequence.,seedlot_me,ugid
IL2021-14773,07-19334/14-28468,drop,463.5,80.8,59.2,131.8,36,1.8,22.7,YTUrb22[Lodging],DISCARD,TRUE,,25,41,SI_Urb_22-1225,6.44,11.2,62.6,456,SI_Urb_22-1225,IL2021-14773
IL2021-22453,07-20728/13-1910,,474.1,80.8,57.4,133.5,35.7,0.5,10.9,YTUrb22[Lodging],KEEP,TRUE,,17,23,SI_Urb_22-677,7.72,14.3,57,1337,SI_Urb_22-677,IL2021-22453
IL2021-3558,P05247A1-7-3-120/14-11750,keep,489.3,80.8,58.5,130.8,36.2,0.8,16,,KEEP,TRUE,,11,16,SI_Urb_22-470,7.8,15.9,58.7,911,SI_Urb_22-470,
IL2021-11962,14-11772/12-8512,drop,479.6,80.8,57.9,132.3,37.2,0.8,17.7,,KEEP,TRUE,,22,13,SI_Urb_22-382,6.74,11.9,61.5,742,SI_Urb_22-382,
IL2021-23464,07-21847/14-28462,keep,472,80.8,59.1,132,35.9,1.3,21.9,YTUrb22[Leaning],KEEP,TRUE,,8,47,SI_Urb_22-1388,6.31,11.5,63,113,SI_Urb_22-1388,IL2021-23464
IL2021-44530,14-28468/14-11848//14-11312,drop,478.6,80.8,57.9,132.3,37.7,0.9,15,,KEEP,TRUE,,4,8,SI_Urb_22-237,6.97,11.4,60.4,424,SI_Urb_22-237,
IL2021-18549,14-28468/14-19503,drop,469.3,80.8,59.6,131.7,36.1,1.6,20.3,,DISCARD,TRUE,,6,31,SI_Urb_22-906,7.78,14.5,61,1075,SI_Urb_22-906,
IL2021-28373,14-3934/15-25742,drop,467.1,80.8,57.3,132.9,35.2,0.8,16.2,YTUrb22[Lodging],KEEP,TRUE,,24,40,SI_Urb_22-1177,6.22,11.2,60.9,517,SI_Urb_22-1177,IL2021-28373
IL2021-28510,14-9542/12-21235,drop,464,80.8,58.2,132,36.9,1.7,24,,KEEP,TRUE,,18,16,SI_Urb_22-463,7.3,15.7,59.4,918,SI_Urb_22-463,
IL2021-36466,16-27570/07-20728,,464.1,80.8,60.2,133.1,36.2,1.3,22.8,,DISCARD,TRUE,,23,26,SI_Urb_22-758,7.69,14.2,62,1358,SI_Urb_22-758,
IL2021-14567,07-19334/14-28462,keep,468.7,80.8,59.3,132.9,36.7,1.2,21.1,YTUrb22[Leaning],KEEP,TRUE,,27,26,SI_Urb_22-754,7.03,13.9,60.4,1354,SI_Urb_22-754,IL2021-14567
IL2021-47145,14-11848/14-28462//16-9335,,472.7,80.7,59.6,132.2,36,1.2,18.5,YTNeo22[septoria],DISCARD,TRUE,,24,21,SI_Urb_22-624,7.73,14.6,61.6,1224,SI_Urb_22-624,IL2021-47145
IL2021-36376,16-27570/07-19334,keep,477.9,80.7,58.5,131.9,34.7,1.1,16,,KEEP,TRUE,,26,16,SI_Urb_22-455,7.48,15.7,59.7,926,SI_Urb_22-455,
IL2021-26838,12-26004/07-19334,keep,474.3,80.7,58.3,132,35.2,1.3,15.6,,KEEP,TRUE,,24,11,SI_Urb_22-324,7.91,11.9,61.8,624,SI_Urb_22-324,
IL2021-26850,12-26004/07-19334,keep,487.1,80.7,59,132.3,37.2,0.7,9.5,,KEEP,TRUE,,8,9,SI_Urb_22-248,7.51,11.3,62.9,488,SI_Urb_22-248,
IL2021-35449,15-27666/10-21934,drop,481.7,80.7,59.1,132.3,37,0.8,14.9,YTUrb22[Leaning],KEEP,TRUE,,2,17,SI_Urb_22-482,6.74,15.2,60,962,SI_Urb_22-482,IL2021-35449
IL2021-41319,12-8545/07-20728//14-28307,keep,467.3,80.7,59.1,132.8,36.5,1.3,19.4,YTNeo22[sept],KEEP,TRUE,,11,41,SI_Urb_22-1211,7.09,11.1,63.9,470,SI_Urb_22-1211,IL2021-41319
IL2021-1438,MO080104/14-8147,drop,463.2,80.7,58.6,131.4,34.9,1.9,23.8,,KEEP,TRUE,,4,10,SI_Urb_22-297,6.43,11.7,63.9,544,SI_Urb_22-297,
IL2021-34113,15-10568/12-26004,keep,488.4,80.6,58.7,130.7,36.9,0.9,13.9,YTUrb22[Leaning],KEEP,TRUE,,13,18,SI_Urb_22-528,7.8,14.5,59.8,1033,SI_Urb_22-528,IL2021-34113
IL2021-40869,07-20728/14-28468//15-25742,keep,475.4,80.6,59.4,131.3,34.8,1.3,19.9,,KEEP,TRUE,,12,33,SI_Urb_22-972,7.3,15.4,59,949,SI_Urb_22-972,
IL2021-25157,12-17257/P05247A1-7-3-120,drop,449.8,80.6,58.9,131.9,35,2.2,31.3,YTUrb22[Leaning],DISCARD,TRUE,,29,43,SI_Urb_22-1289,5.49,11.8,60.3,332,SI_Urb_22-1289,IL2021-25157
IL2021-15228,07-20728/14-28468,keep,479.3,80.6,59.5,131.9,35.1,1,14.6,YTUrb22[Lodging],KEEP,TRUE,,12,44,SI_Urb_22-1309,4.61,11.6,62.1,289,SI_Urb_22-1309,IL2021-15228
IL2021-41350,12-8545/07-20728//14-28307,keep,484.3,80.6,58.9,132.1,36.4,0.8,11.7,YTUrb22[Tall],KEEP,TRUE,,5,41,SI_Urb_22-1205,6.92,11,62.2,476,SI_Urb_22-1205,IL2021-41350
IL2021-45701,12-8512/14-11916,keep,484.7,80.6,58.4,132.7,36.7,0.7,9.8,YTUrb22[Lodging],KEEP,TRUE,,6,46,SI_Urb_22-1375,6.79,11.8,60.9,175,SI_Urb_22-1375,IL2021-45701
IL2021-758,KY09C-0052-26-12-3/IL13-451,drop,468.7,80.6,58.7,131.7,36,1.5,22.5,YTUrb22[Leaf rust],DISCARD,TRUE,,30,47,SI_Urb_22-1410,5.42,12,60.4,91,SI_Urb_22-1410,IL2021-758
IL2021-21718,07-19334/12-21235,drop,465.4,80.5,58.1,132.6,37.7,1.5,18.3,YTUrb22[Tall],DISCARD,TRUE,,26,36,SI_Urb_22-1055,6.87,12.1,62.2,755,SI_Urb_22-1055,IL2021-21718
IL2021-34018,14-28468/16-9335,keep,498.2,80.5,60.2,131,36.1,0.6,4.7,YTUrb22[Leaning],KEEP,TRUE,,26,19,SI_Urb_22-566,7.02,14.8,60.3,1106,SI_Urb_22-566,IL2021-34018
IL2021-37674,07-4415/IL12-26004//10-21934,keep,485.7,80.5,58.6,131.1,36.4,0.9,16.2,,KEEP,TRUE,,14,12,SI_Urb_22-347,6.66,11.8,62.5,674,SI_Urb_22-347,
IL2021-41430,12-8545/07-20728//14-28307,keep,492.2,80.5,58.9,131.8,36,0.5,8.7,YTNeo22[sept],KEEP,TRUE,,13,34,SI_Urb_22-1008,6.78,16.1,58.9,888,SI_Urb_22-1008,IL2021-41430
IL2021-13321,07-4415/07-19334,keep,474.8,80.5,58.3,131.9,36.8,1.2,17.8,,KEEP,TRUE,,19,13,SI_Urb_22-379,7.13,11.9,62.4,739,SI_Urb_22-379,
IL2021-38672,14-11312/07-4415//14-28468,keep,481.4,80.5,58.4,132.2,36.4,0.9,11.7,,KEEP,TRUE,,23,13,SI_Urb_22-383,7.23,11.8,62.4,743,SI_Urb_22-383,
IL2021-46233,14-28468/12-26004,drop,475.5,80.5,58,131.4,36,1.2,21.5,,DISCARD,TRUE,,22,44,SI_Urb_22-1299,4.73,11.6,60.6,279,SI_Urb_22-1299,
IL2021-15138,07-20728/14-28462,keep,481.4,80.5,59.3,132.4,36.9,0.8,13.9,YTUrb22[Lodg],KEEP,TRUE,,14,34,SI_Urb_22-1007,7.68,15.9,60.4,887,SI_Urb_22-1007,IL2021-15138
IL2021-35763,16-4939/15-13159,drop,443.6,80.5,57.5,131.4,30.5,2,36.2,YTUrb22[Tall],DISCARD,TRUE,,1,16,SI_Urb_22-480,7.41,15.7,57.4,901,SI_Urb_22-480,IL2021-35763
IL2021-9334,IL13-20616/MD09W272-8-4-13-3-15,,456.3,80.5,58.1,133.7,34.7,1.5,24.6,"YTUrb22[Npt, tip awned]",DISCARD,TRUE,,16,29,SI_Urb_22-856,6.97,13.9,59.6,1185,SI_Urb_22-856,IL2021-9334
IL2021-19352,P0762A1-2-8/14-9542,drop,469.2,80.5,57.3,131.8,37.3,0.9,17.8,YTUrb22[Tall],DISCARD,TRUE,,21,33,SI_Urb_22-981,7.3,15.7,59,940,SI_Urb_22-981,IL2021-19352
IL2021-7550,IL12-26004/14-11750,keep,496.9,80.4,57.8,130.2,35.7,0.5,8.8,YTUrb22[Leaning],KEEP,TRUE,,26,27,SI_Urb_22-806,7.28,13.9,59.3,1295,SI_Urb_22-806,IL2021-7550
IL2021-5728,07-21847/IL13-451,drop,454,80.4,59,131.5,35.8,2.1,30.7,,DISCARD,TRUE,,14,17,SI_Urb_22-494,7.18,15.2,60.3,974,SI_Urb_22-494,
IL2021-42067,14-11772/14-11830//14-3934,,471.4,80.4,58,133.1,35.4,1,15.3,,DISCARD,TRUE,,27,39,SI_Urb_22-1167,6.57,12,60.9,574,SI_Urb_22-1167,
IL2021-18304,14-28468/14-11772,keep,480.5,80.4,59.9,131.6,37,1.1,14,,KEEP,TRUE,,30,14,SI_Urb_22-391,6.74,16.4,59.3,810,SI_Urb_22-391,
IL2021-33348,14-28462/12-21235,drop,476,80.4,59.2,131.7,38.1,1.3,14.9,,KEEP,TRUE,,7,11,SI_Urb_22-307,7.1,11.9,62.5,607,SI_Urb_22-307,
IL2021-39924,07-20728/07-4415//07-20728,keep,466.5,80.4,58.8,132.6,36.8,1.2,21.8,,KEEP,TRUE,,10,8,SI_Urb_22-231,6.61,11.3,61.3,430,SI_Urb_22-231,
IL2021-16544,14-11830/07-19334,keep,489.4,80.4,58.6,132.9,36.5,0.3,7,YTUrb22[Leaning],KEEP,TRUE,,17,45,SI_Urb_22-1337,4.64,11.6,60,224,SI_Urb_22-1337,IL2021-16544
IL2021-29134,14-9546/12-17257,keep,495.5,80.3,59.4,130.8,36.3,0.6,7.7,,KEEP,TRUE,,8,34,SI_Urb_22-1013,8.25,15.6,60.7,893,SI_Urb_22-1013,
IL2021-34252,15-10568/13-1910,keep,489.6,80.3,59.8,130.8,36,0.8,12.1,,KEEP,TRUE,,13,14,SI_Urb_22-408,8.22,16,60.8,793,SI_Urb_22-408,
IL2021-3902,P0566A1-3-1-52/IL13-20616,keep,477.8,80.3,59.9,131,36.9,1.2,19,,KEEP,TRUE,,8,15,SI_Urb_22-428,7.52,16.3,59.6,848,SI_Urb_22-428,
IL2021-13713,07-4415/14-28462,keep,475.9,80.3,58.2,131.3,35.2,1.2,17.5,,KEEP,TRUE,,23,10,SI_Urb_22-278,7.29,11.7,62.7,563,SI_Urb_22-278,
IL2021-43417,14-28462/07-20728//10-21934,drop,465.2,80.3,58.4,131.6,36.2,1.6,23.6,,DISCARD,TRUE,,14,30,SI_Urb_22-887,7.8,14.5,60.4,1127,SI_Urb_22-887,
IL2021-34163,15-10568/12-26004,,474.2,80.3,58,132.3,36.8,1,19.1,YTUrb22[Leaning],DISCARD,TRUE,,18,20,SI_Urb_22-583,7.39,14.3,59.7,1158,SI_Urb_22-583,IL2021-34163
IL2021-46428,15-27666/07-20728,keep,481,80.3,58.7,132.6,36.4,0.7,12.2,YTUrb22[Npt],KEEP,TRUE,,1,19,SI_Urb_22-541,7.2,15.2,59.6,1081,SI_Urb_22-541,IL2021-46428
IL2021-28708,14-9542/15-13159,keep,468.4,80.3,58.2,132.7,35.5,1.3,17.4,YTUrb22[Npt],KEEP,TRUE,,19,43,SI_Urb_22-1279,5.96,11.7,61.2,342,SI_Urb_22-1279,IL2021-28708
IL2021-4851,07-4415/IL12-26004,drop,485.8,80.2,57.9,130.9,37.4,0.9,13,YTUrb22[Tall],DISCARD,TRUE,,25,44,SI_Urb_22-1296,5.28,11.7,60.4,276,SI_Urb_22-1296,IL2021-4851
IL2021-25522,12-17428/07-4415,drop,480.9,80.2,57.8,132,36.9,0.6,14.4,,KEEP,TRUE,,23,40,SI_Urb_22-1178,6.54,11.3,61.5,518,SI_Urb_22-1178,
IL2021-11869,14-11772/07-4415,drop,463,80.2,58.7,131.7,37.5,1.6,24.9,YTUrb22[Tall],DISCARD,TRUE,,15,19,SI_Urb_22-555,7.99,14.8,60.4,1095,SI_Urb_22-555,IL2021-11869
IL2021-47141,14-11848/14-28462//16-9335,,461.5,80.2,58.2,133.1,35.5,1.3,21.5,YTNeo22[heavy scab],DISCARD,TRUE,,22,35,SI_Urb_22-1042,7.25,15.8,59,819,SI_Urb_22-1042,IL2021-47141
IL2021-47165,14-11848/14-28462//16-9335,drop,451,80.2,59.6,132.7,35.5,1.8,30.7,YTUrb22[Lodg],DISCARD,TRUE,,24,35,SI_Urb_22-1044,7.29,16,60.2,817,SI_Urb_22-1044,IL2021-47165
IL2021-33944,14-28468/16-9335,drop,459.8,80.2,58.9,132,35.7,1.8,22.8,,KEEP,TRUE,,12,15,SI_Urb_22-432,7.98,16.1,60.6,852,SI_Urb_22-432,
IL2021-22019,07-19334/14-9546,,467,80.1,58.4,133.1,37,1.1,18.8,YTUrb22[Leaning],KEEP,TRUE,,24,44,SI_Urb_22-1297,5.28,11.9,59.7,277,SI_Urb_22-1297,IL2021-22019
IL2021-13768,07-4415/14-28468,drop,481.1,80.1,58.8,130.6,37.3,1.2,15.8,YTUrb22[Lodging],DISCARD,TRUE,,2,42,SI_Urb_22-1259,5.65,11.4,62.8,419,SI_Urb_22-1259,IL2021-13768
IL2021-11107,14-11312/IL13-20616,,463.3,80.1,58.1,133.2,35.5,1.3,17.6,YTUrb22[Npt],DISCARD,TRUE,,17,19,SI_Urb_22-557,7.68,14.7,58.5,1097,SI_Urb_22-557,IL2021-11107
IL2021-30163,14-11772/12-8512,drop,469.7,80.1,59.6,132,38.3,1.3,18.1,,KEEP,TRUE,,5,13,SI_Urb_22-365,6.96,11.8,63.2,725,SI_Urb_22-365,
IL2021-41355,12-8545/07-20728//14-28307,keep,485.3,80.1,59.1,131.8,36.3,0.7,9.8,,KEEP,TRUE,,13,15,SI_Urb_22-433,7.55,16.4,58.6,853,SI_Urb_22-433,
IL2021-29071,14-9546/12-8512,,478,80.1,59.2,130.8,36,1.3,16.9,,DISCARD,TRUE,,27,43,SI_Urb_22-1287,5.48,11.6,62.2,334,SI_Urb_22-1287,
IL2021-21769,07-19334/12-21235,,476.3,80,59,131.5,36.9,1.2,14.7,,KEEP,TRUE,,5,9,SI_Urb_22-245,6.39,11,63.3,485,SI_Urb_22-245,
IL2021-32554,14-28444/02-19463-7,keep,483.9,80,58.9,130.5,36.9,1.1,12.2,,KEEP,TRUE,,9,20,SI_Urb_22-592,7.28,14.4,60.5,1149,SI_Urb_22-592,
IL2021-40573,07-20728/14-28462//12-26004,drop,492.7,80,59.6,130.6,37.4,0.6,11.7,YTUrb22[Leaning],DISCARD,TRUE,,4,43,SI_Urb_22-1264,6.88,11.2,62.6,357,SI_Urb_22-1264,IL2021-40573
IL2021-5833,07-21847/14-8147,drop,464,80,58.7,131.3,35.2,1.7,22.3,YTUrb22[Leaning],DISCARD,TRUE,,10,16,SI_Urb_22-471,8.07,15.4,59.9,910,SI_Urb_22-471,IL2021-5833
IL2021-8812,13-1960/IL12-26004,drop,476.9,80,57.5,131,36.5,0.9,13,"YTNeo22[ve, septoria]",DISCARD,TRUE,"6/27/2022, 3:53:10 PM, Tare Warning, Test Weight: 4.12",15,29,SI_Urb_22-855,7.53,13.4,61.6,1186,SI_Urb_22-855,IL2021-8812
IL2021-30170,14-11772/12-8512,,461.3,80,59.4,132.6,36.5,1.5,19.4,,KEEP,TRUE,,16,8,SI_Urb_22-225,6.81,11.2,62.6,436,SI_Urb_22-225,
IL2021-24956,12-8512/14-9542,keep,472,80,58.6,131.7,36.3,1.2,19.6,,KEEP,TRUE,,10,10,SI_Urb_22-291,6.61,11.6,63.6,550,SI_Urb_22-291,
IL2021-42522,14-11848/07-20728//13-1910,keep,476.8,80,59.3,131.8,36.4,1,16.5,,KEEP,TRUE,,25,29,SI_Urb_22-865,7.09,15.1,59.4,1176,SI_Urb_22-865,
IL2021-39857,07-19334/14-28462//15-27270,keep,496.6,80,59.4,131.9,37.2,0.1,4.8,YTUrb22[Leaning],KEEP,TRUE,,28,19,SI_Urb_22-568,7.24,15.2,60.9,1108,SI_Urb_22-568,IL2021-39857
IL2021-43336,14-28462/07-20728//10-21934,,458.5,80,59.1,133,37.6,1.5,20.7,,KEEP,TRUE,,18,11,SI_Urb_22-318,6.14,12.2,63.7,618,SI_Urb_22-318,
IL2021-27574,13-1910/12-17257,keep,478.9,80,59,132,35.4,0.9,13.1,YTUrb22[Leaning],KEEP,TRUE,,26,31,SI_Urb_22-926,7.35,15.5,60.3,1055,SI_Urb_22-926,IL2021-27574
IL2021-33712,14-28468/12-17257,drop,463.6,80,60,131.5,35.4,1.6,22.2,,KEEP,TRUE,,6,12,SI_Urb_22-355,6.45,11.8,62.7,666,SI_Urb_22-355,
IL2021-34322,15-10568/14-11312,keep,469.1,80,58.1,132.8,36.3,1.1,17.4,,KEEP,TRUE,,4,12,SI_Urb_22-357,6.4,11.8,61.9,664,SI_Urb_22-357,
IL2021-21737,07-19334/12-21235,drop,462.6,79.9,58.2,132.6,37,1.5,18.2,YTUrb22[Leaning],DISCARD,TRUE,,28,36,SI_Urb_22-1053,6.48,11.8,63.2,753,SI_Urb_22-1053,IL2021-21737
IL2021-16322,14-11772/14-28462,keep,477.8,79.9,59.6,130.5,37.9,1.3,18.2,,KEEP,TRUE,,11,15,SI_Urb_22-431,7.32,15.2,61.6,851,SI_Urb_22-431,
IL2021-24918,12-8512/14-9542,keep,484.3,79.9,58.5,130.9,37,0.8,15.4,,KEEP,TRUE,,6,36,SI_Urb_22-1075,6.76,11.5,62.9,775,SI_Urb_22-1075,
IL2021-5066,07-4415/13-1910,drop,487.8,79.9,58.2,132,37.9,0.4,11,,DISCARD,TRUE,,3,35,SI_Urb_22-1023,7.63,15.7,59.4,838,SI_Urb_22-1023,
IL2021-30022,14-11312/15-25742,keep,470.9,79.9,57.8,131.2,35.7,1.2,19.9,,KEEP,TRUE,,8,22,SI_Urb_22-653,7.18,13.9,59.6,1268,SI_Urb_22-653,
IL2021-24255,10-21934/14-28444,keep,476.9,79.9,58.8,131.5,37.1,1.1,15.5,,KEEP,TRUE,,4,36,SI_Urb_22-1077,7.83,11.6,63.9,777,SI_Urb_22-1077,
IL2021-40753,07-20728/14-28468//15-25742,keep,486.6,79.9,59.9,131.7,35.1,0.6,11.4,,KEEP,TRUE,,26,48,SI_Urb_22-1415,5.32,11.5,62.6,35,SI_Urb_22-1415,
IL2021-43345,14-28462/07-20728//10-21934,drop,472.4,79.9,59,131.5,36.8,1.2,18.7,"YTNeo22[scab, tall]",KEEP,,,14,44,SI_Urb_22-1307,5.64,11.8,62.8,287,SI_Urb_22-1307,IL2021-43345
IL2021-46002,14-28462/14-9546,keep,482,79.9,58.3,132.1,36.1,0.7,11.6,YTUrb22[Lodging],KEEP,TRUE,,2,19,SI_Urb_22-542,6.31,14.8,58.7,1082,SI_Urb_22-542,IL2021-46002
IL2021-40862,07-20728/14-28468//15-25742,keep,497,79.9,59.5,132.3,35.7,0,3.2,,KEEP,TRUE,,2,45,SI_Urb_22-1322,6.82,11.3,63.3,239,SI_Urb_22-1322,
IL2021-8249,IL13-451/12-8512,drop,462.6,79.9,58.1,131.7,35.6,1.6,23,YTUrb22[Lodging],DISCARD,TRUE,,21,29,SI_Urb_22-861,7.51,13.8,61.2,1180,SI_Urb_22-861,IL2021-8249
IL2021-29149,14-9546/12-17257,keep,484.6,79.8,58.9,130,35.2,1.1,13.8,,KEEP,TRUE,,2,37,SI_Urb_22-1082,6.96,11.9,63.3,719,SI_Urb_22-1082,
IL2021-18468,14-28468/14-11830,keep,481.2,79.8,59.5,130.5,35.7,1.1,15.8,YTUrb22[Leaning],KEEP,TRUE,,16,39,SI_Urb_22-1156,6.46,11.7,63.7,585,SI_Urb_22-1156,IL2021-18468
IL2021-18220,14-28468/07-20728,keep,473.5,79.8,59.2,130.7,36.6,1.3,20.5,YTUrb22[Mix],KEEP,TRUE,,30,43,SI_Urb_22-1290,5.39,14.5,50.3,331,SI_Urb_22-1290,IL2021-18220
IL2021-22350,07-20728/P0762A1-2-8,,467.4,79.8,58.1,132,34,1.2,22.3,,DISCARD,TRUE,,20,45,SI_Urb_22-1340,4.75,11.6,61.1,221,SI_Urb_22-1340,
IL2021-26755,12-26004/07-19334,,478.5,79.8,58.2,131.3,36.1,1,16.1,,DISCARD,TRUE,,2,23,SI_Urb_22-662,6.54,14.4,59.4,1322,SI_Urb_22-662,
IL2021-39959,07-20728/07-4415//07-20728,keep,474.1,79.8,59.3,131.4,36.8,1,20.8,,KEEP,TRUE,,30,22,SI_Urb_22-631,7.44,14.2,61.1,1290,SI_Urb_22-631,
IL2021-42149,14-11772/14-11830//15-27666,,463.1,79.8,58.3,132.3,36.6,1.2,24.6,,DISCARD,TRUE,,7,47,SI_Urb_22-1387,6.23,11.5,62,114,SI_Urb_22-1387,
IL2021-3567,P05247A1-7-3-120/14-11750,keep,471,79.8,58.9,131.9,34.9,1,20.9,,KEEP,TRUE,,7,20,SI_Urb_22-594,6.58,14.4,57.6,1147,SI_Urb_22-594,
IL2021-44650,14-28468/14-11848//16-4939,drop,476.4,79.8,58.8,132.7,37,0.7,14.7,,KEEP,TRUE,,2,13,SI_Urb_22-362,7.41,12,62,722,SI_Urb_22-362,
IL2021-22411,07-20728/10-21934,,465.7,79.7,58,132.5,37.4,1.2,18.1,,DISCARD,TRUE,,23,46,SI_Urb_22-1358,5.09,11.9,60.9,158,SI_Urb_22-1358,
IL2021-23767,10-21934/12-17428,,475.9,79.7,58.2,132.9,37.6,0.8,11.5,YTUrb22[Tall],DISCARD,TRUE,,26,22,SI_Urb_22-635,6.9,14.3,58.7,1286,SI_Urb_22-635,IL2021-23767
IL2021-46908,07-20728/14-11830//12-8512,keep,475,79.7,58.6,131.3,36.9,1.1,17.8,,KEEP,TRUE,,13,36,SI_Urb_22-1068,7.14,11.7,63.1,768,SI_Urb_22-1068,
IL2021-7544,IL12-26004/14-11750,keep,478.8,79.7,58.5,131.3,36,1,14.6,,KEEP,TRUE,,26,9,SI_Urb_22-266,6.93,11.2,61.6,506,SI_Urb_22-266,
IL2021-25121,12-8512/16-27570,,461.2,79.7,58.2,132.7,36.6,1.3,21.4,YTUrb22[Lodg],DISCARD,TRUE,,19,36,SI_Urb_22-1062,7.5,11.7,62.9,762,SI_Urb_22-1062,IL2021-25121
IL2021-6868,12-8512/IL12-26004,drop,479,79.7,58,130.2,34.9,1.2,17.8,"YTNeo22[ve, leaning]",DISCARD,TRUE,,28,47,SI_Urb_22-1408,4.27,0,0,93,SI_Urb_22-1408,IL2021-6868
IL2021-8477,13-1910/12-30879,drop,472.8,79.7,58.1,130.5,37.1,1.4,21.6,,DISCARD,TRUE,,10,47,SI_Urb_22-1390,4.56,11.8,60.6,111,SI_Urb_22-1390,
IL2021-16334,14-11772/14-28462,,467.7,79.7,60.3,130.6,35.1,1.6,23.2,YTUrb22[Lodg],DISCARD,TRUE,,25,24,SI_Urb_22-696,7.91,13.6,60.9,1405,SI_Urb_22-696,IL2021-16334
IL2021-47147,14-11848/14-28462//16-9335,,469.7,79.7,58.9,131.7,35,1.2,19.4,,DISCARD,TRUE,,12,47,SI_Urb_22-1392,4.41,0,0,109,SI_Urb_22-1392,
IL2021-31405,14-11916/12-17257,,462.9,79.7,59.1,132.1,36.3,1.4,22.2,YTUrb22[Leaning],DISCARD,TRUE,,1,41,SI_Urb_22-1201,6.39,11.4,62.9,480,SI_Urb_22-1201,IL2021-31405
IL2021-21356,07-4415/07-21847,keep,463.8,79.7,59.5,132.4,35.5,1.3,21.6,YTUrb22[Npt],KEEP,TRUE,,15,35,SI_Urb_22-1035,7.88,16.1,60.1,826,SI_Urb_22-1035,IL2021-21356
IL2021-33933,14-28468/16-9335,,459.2,79.7,59.9,132.5,36.6,1.6,21.3,YTUrb22[Npt],DISCARD,TRUE,,28,17,SI_Urb_22-508,8.05,15.1,61.4,988,SI_Urb_22-508,IL2021-33933
IL2021-36257,16-18944/14-9542,keep,484.3,79.6,58.6,130.4,35.3,0.9,15.7,YTUrb22[Npt],KEEP,TRUE,,8,30,SI_Urb_22-893,6.98,14.5,59.2,1133,SI_Urb_22-893,IL2021-36257
IL2021-18313,14-28468/14-11772,keep,475.6,79.6,60.4,130.9,37,1.2,16.9,,KEEP,TRUE,,24,34,SI_Urb_22-997,7.87,15.9,60.9,877,SI_Urb_22-997,
IL2021-39143,14-28864/14-9923//10-21934,keep,485,79.6,58.4,131.2,35.9,0.8,10.1,,KEEP,TRUE,,7,16,SI_Urb_22-474,7.62,15.9,59.2,907,SI_Urb_22-474,
IL2021-29002,14-9546/12-8512,keep,478,79.6,59.1,131.2,37.2,1,15.1,YTNeo22[clean],KEEP,TRUE,,6,39,SI_Urb_22-1146,6.49,11.5,63.7,595,SI_Urb_22-1146,IL2021-29002
IL2021-7259,12-21624/10-21934,drop,461.9,79.6,57.9,132.2,35.8,1.5,17.8,"YTUrb22[Looks nice, leans a little]",DISCARD,TRUE,,4,45,SI_Urb_22-1324,7.09,11.7,61.6,237,SI_Urb_22-1324,IL2021-7259
IL2021-17534,14-28462/07-20728,keep,473.2,79.6,59.2,131.4,35.5,1.2,17,,KEEP,TRUE,,22,14,SI_Urb_22-399,7.77,16.3,59.5,802,SI_Urb_22-399,
IL2021-29638,14-11312/12-8512,drop,473.8,79.6,58.6,131.7,37.3,1.1,14.3,YTUrb22[Leaning],DISCARD,TRUE,,13,42,SI_Urb_22-1248,4.38,0,0,408,SI_Urb_22-1248,IL2021-29638
IL2021-47071,14-11830/07-20728//16-4939,,459.3,79.6,58.3,132.5,33.2,1.3,26.6,,DISCARD,TRUE,,29,35,SI_Urb_22-1049,6.47,16.9,58.1,812,SI_Urb_22-1049,
IL2021-47227,14-11848/14-28468//12-8512,drop,464.6,79.6,57.9,132.9,37,1.1,16.8,YTUrb22[Lodg],DISCARD,TRUE,,10,24,SI_Urb_22-711,7.45,13.8,58.3,1390,SI_Urb_22-711,IL2021-47227
IL2021-45962,14-28444/P05247A1-7-3-120,drop,459,79.6,59.2,132.4,35.6,1.4,24.1,,DISCARD,TRUE,,14,19,SI_Urb_22-554,7.8,14.8,61.1,1094,SI_Urb_22-554,
IL2021-43313,14-28462/07-20728//02-19463-7,drop,473.8,79.6,59,132.8,38.3,0.9,11.1,YTUrb22[Leaning],DISCARD,TRUE,,19,21,SI_Urb_22-619,8.51,13.9,61.4,1219,SI_Urb_22-619,IL2021-43313
IL2021-27612,13-1910/12-17257,keep,486.1,79.6,58.7,132,35.7,0.6,7,YTUrb22[Lodging],KEEP,TRUE,,16,32,SI_Urb_22-945,7.21,15.1,59.3,1005,SI_Urb_22-945,IL2021-27612
IL2021-42115,14-11772/14-11830//14-3934,keep,478.8,79.6,58.6,132.3,35.7,0.8,10.1,,KEEP,TRUE,,19,41,SI_Urb_22-1219,7.17,11.2,62.5,462,SI_Urb_22-1219,
IL2021-30660,14-11772/16-27570,keep,470.4,79.6,59.9,132.4,36.3,1.1,14.7,,KEEP,TRUE,,29,16,SI_Urb_22-452,7.73,15.7,61.5,929,SI_Urb_22-452,
IL2021-33660,14-28468/MO080104,drop,468.8,79.6,58.6,131.2,36.4,1.5,19,,KEEP,TRUE,,11,11,SI_Urb_22-311,7.02,11.8,63.3,611,SI_Urb_22-311,
IL2021-33647,14-28468/MO080104,drop,466.6,79.6,58.9,132.2,36.9,1.3,16.2,,KEEP,TRUE,,10,11,SI_Urb_22-310,7.08,11.9,62.6,610,SI_Urb_22-310,
IL2021-29313,14-9546/12-26004,drop,484.2,79.6,58.5,132.2,37.5,0.5,9.2,,KEEP,TRUE,,4,11,SI_Urb_22-304,7.29,11.7,62.3,604,SI_Urb_22-304,
IL2021-29003,14-9546/12-8512,drop,468.1,79.6,58.5,132.3,37.1,1.2,16.9,YTUrb22[Tall],DISCARD,TRUE,,2,36,SI_Urb_22-1079,7.01,11.9,62.9,779,SI_Urb_22-1079,IL2021-29003
IL2021-15258,07-20728/14-28468,keep,465.6,79.6,60,132.7,36.2,1.1,19,,KEEP,TRUE,"6/25/2022, 10:28:20 AM, Tare Warning, Test Weight: 5.44",8,12,SI_Urb_22-353,7.04,11.9,64.2,668,SI_Urb_22-353,
IL2021-21674,07-19334/12-8512,,473.3,79.5,58.9,132.8,37.3,0.9,10.7,YTUrb22[Lodging],DISCARD,TRUE,,16,23,SI_Urb_22-676,7.02,14.2,59.9,1336,SI_Urb_22-676,IL2021-21674
IL2021-21655,07-19334/12-8512,,456.5,79.5,58.1,133.2,36.3,1.3,22.4,YTUrb22[Tall],DISCARD,TRUE,,12,37,SI_Urb_22-1092,6.35,12.1,63,709,SI_Urb_22-1092,IL2021-21655
IL2021-14713,07-19334/14-28468,,476.3,79.5,59.3,132.7,38,0.8,10.2,,KEEP,TRUE,,25,11,SI_Urb_22-325,7.41,11.9,64.6,625,SI_Urb_22-325,
IL2021-28973,14-9546/12-8512,keep,481.9,79.5,59,130.9,36.4,0.9,13.4,YTUrb22[Tall],KEEP,TRUE,,13,39,SI_Urb_22-1153,5.62,11.9,62.8,588,SI_Urb_22-1153,IL2021-28973
IL2021-13758,07-4415/14-28468,,473.3,79.5,59,130.7,36.9,1.3,19.4,YTUrb22[Tall],DISCARD,TRUE,,4,27,SI_Urb_22-784,6.91,14.5,59.9,1317,SI_Urb_22-784,IL2021-13758
IL2021-33507,14-28462/12-26004,keep,485,79.5,58.3,131.2,36.4,0.7,10.9,,KEEP,TRUE,,9,10,SI_Urb_22-292,7.35,11.8,63,549,SI_Urb_22-292,
IL2021-38661,14-11312/07-4415//14-28468,keep,482.7,79.5,58.6,131.3,35.8,0.9,9.9,YTUrb22[Leaning],KEEP,TRUE,,8,23,SI_Urb_22-668,7.95,13.7,60,1328,SI_Urb_22-668,IL2021-38661
IL2021-29158,14-9546/12-17257,keep,472.6,79.5,59.5,131.5,36.4,1.2,14.1,,KEEP,TRUE,,12,10,SI_Urb_22-289,7.01,11.5,63.5,552,SI_Urb_22-289,
IL2021-16668,14-11830/14-28462,,441.7,79.5,56.8,134.1,35.2,1,17.2,YTUrb22[Lodg],DISCARD,TRUE,,5,35,SI_Urb_22-1025,7.45,15.8,55.6,836,SI_Urb_22-1025,IL2021-16668
IL2021-40301,07-20728/14-11830//12-17257,keep,480.7,79.5,58.7,132.2,35.4,0.6,11.7,,KEEP,TRUE,,24,42,SI_Urb_22-1237,4.85,11.3,62.2,397,SI_Urb_22-1237,
IL2021-30029,14-11312/15-25742,keep,477.8,79.5,58.3,132.4,36.3,0.8,10.9,,KEEP,TRUE,,30,31,SI_Urb_22-930,6.51,15.4,58,1051,SI_Urb_22-930,
IL2021-40320,07-20728/14-11830//12-17257,drop,464.5,79.4,58.7,131.4,34.5,1.5,22.2,,KEEP,TRUE,,15,13,SI_Urb_22-375,6.49,12,62,735,SI_Urb_22-375,
IL2021-29425,14-9546/12-26004,keep,485.4,79.4,59,130.8,37.3,0.8,11.6,,KEEP,TRUE,,15,14,SI_Urb_22-406,8.07,16.1,59,795,SI_Urb_22-406,
IL2021-4674,07-4415/MD09W272-8-4-13-3-15,,442.3,79.4,56.7,132.3,36.2,1.3,21.7,,KEEP,TRUE,,21,14,SI_Urb_22-400,6.35,17.2,55.5,801,SI_Urb_22-400,
