germplasmName,purdy.pedigree,decision,merit,Grain.yield...bu.ac,Grain.test.weight...lbs.bu,Heading.time...Julian.date..JD..,Plant.height.inches,FHB.DON.content...ppm.,FHB.grain.incidence.....,notes3,action,Found,Quick.Note.,range.,row.,plot_me.,Weight..lb.,Moisture....,Test.Weight..lb.bu.,Harvest.Sequence.,seedlot_me,ugid
IL2021-11534,14-11750/13-1960,,472.5,78.1,58.6,131.9,35.7,0.7,12.5,YTUrb22[Npt],DISCARD,TRUE,,24,28,SI_Urb_22-817,7.34,14.5,60.8,1237,SI_Urb_22-817,IL2021-11534
IL2021-15931,14-11772/07-4415,,454.1,78.1,58.6,131.7,38.3,1.5,22.4,,KEEP,TRUE,,22,10,SI_Urb_22-279,6.88,11.7,62.1,562,SI_Urb_22-279,
IL2021-16170,14-11772/14-11830,,463.6,78.1,57.9,132.8,34.9,0.8,13.6,,KEEP,TRUE,,1,8,SI_Urb_22-240,6.62,11.5,60.4,421,SI_Urb_22-240,
IL2021-45117,14-11830/12-8512,,465.1,78.1,58,132.2,36.8,0.8,17.6,YTUrb22[Mix],DISCARD,TRUE,,28,26,SI_Urb_22-753,6.69,14.2,59.6,1353,SI_Urb_22-753,IL2021-45117
IL2021-43437,14-28462/07-20728//10-21934,,464.1,78.1,58.2,132.1,37.1,1,16.8,YTUrb22[Lodging],DISCARD,TRUE,,25,21,SI_Urb_22-625,7.65,14.3,57.6,1225,SI_Urb_22-625,IL2021-43437
IL2021-29107,14-9546/12-17257,,463.8,78.1,58.6,132.2,34.7,1,16.5,,DISCARD,TRUE,,10,27,SI_Urb_22-790,7.02,14.1,60,1311,SI_Urb_22-790,
IL2021-29337,14-9546/12-26004,,470.1,78.1,58.7,130.5,36.1,1.2,16.7,YTUrb22[Leaning],DISCARD,TRUE,,1,46,SI_Urb_22-1380,6.97,11.5,60.8,180,SI_Urb_22-1380,IL2021-29337
IL2021-9275,IL13-20616/MD09W272-8-4-13-3-15,,444.8,78.1,58.1,134.4,35.5,1.2,20.8,"YTUrb22[Short, too late]",DISCARD,TRUE,,13,29,SI_Urb_22-853,7.82,13.8,60.1,1188,SI_Urb_22-853,IL2021-9275
IL2021-3018,P05247A1-7-3-108-2/07-4415,drop,472.9,78.1,58.3,130.4,37.5,1,17.2,YTUrb22[Tall],DISCARD,TRUE,,20,37,SI_Urb_22-1100,6.83,11.7,63.8,701,SI_Urb_22-1100,IL2021-3018
IL2021-13851,07-4415/14-28468,,472.7,78,59.8,130.3,36.6,1.1,16.4,YTNeo22[leaning],DISCARD,TRUE,,28,46,SI_Urb_22-1353,4.01,0,0,153,SI_Urb_22-1353,IL2021-13851
IL2021-24129,10-21934/14-11772,,446.2,78,58.4,130.8,36.7,2,30.3,YTUrb22[Mix],DISCARD,TRUE,,4,46,SI_Urb_22-1377,6.89,11.5,61.6,177,SI_Urb_22-1377,IL2021-24129
IL2021-25533,12-17428/07-4415,,443.1,78,57.7,131.5,35,1.7,29.2,,DISCARD,TRUE,,6,41,SI_Urb_22-1206,7.03,10.9,62.9,475,SI_Urb_22-1206,
IL2021-26879,12-26004/14-11312,,469.5,78,57.7,131.4,36.4,0.8,9.2,,KEEP,TRUE,,14,13,SI_Urb_22-374,7.37,11.8,62.2,734,SI_Urb_22-374,
IL2021-15714,12-8545/14-28462,,475.3,78,59.9,131.1,36.1,0.8,12.4,,DISCARD,TRUE,,3,27,SI_Urb_22-783,7.5,14,60.2,1318,SI_Urb_22-783,
IL2021-27328,13-1910/07-4415,,460.5,78,57.5,131.9,37.6,0.8,14.3,YTUrb22[Lodg],DISCARD,TRUE,,13,32,SI_Urb_22-948,7.64,14.8,58.9,1008,SI_Urb_22-948,IL2021-27328
IL2021-42075,14-11772/14-11830//14-3934,,447.9,78,57.6,132.5,35.7,1.3,21.5,YTNeo22[scab],DISCARD,TRUE,,22,21,SI_Urb_22-622,7.47,14.3,57.4,1222,SI_Urb_22-622,IL2021-42075
IL2021-46411,15-27666/07-20728,keep,477.1,78,59.4,131.7,36.8,0.5,11.4,,KEEP,TRUE,,12,13,SI_Urb_22-372,7.35,12,63,732,SI_Urb_22-372,
IL2021-46009,14-28462/14-9546,,464,78,58.8,132,37.1,1,15.2,YTUrb22[Leaning],DISCARD,,,17,47,SI_Urb_22-1397,4.81,11.8,61,104,SI_Urb_22-1397,IL2021-46009
IL2021-21078,02-19463-7/12-26004,,458.7,77.9,57.7,131.6,37.7,1.2,15.9,,KEEP,TRUE,,25,15,SI_Urb_22-445,7.51,15.2,59.4,865,SI_Urb_22-445,
IL2021-33861,14-28468/12-21235,keep,487.3,77.9,59,130.9,37.1,0.4,3.8,YTUrb22[Plot damage 5%],KEEP,TRUE,,12,39,SI_Urb_22-1152,5.29,11.6,63.2,589,SI_Urb_22-1152,IL2021-33861
IL2021-40938,07-20728/14-28468//15-27666,,464.6,77.9,59.9,131.7,37.8,1,18.3,,KEEP,TRUE,,28,11,SI_Urb_22-328,6.99,11.9,64.3,628,SI_Urb_22-328,
IL2021-45214,07-4415/14-11830//14-28462,,465,77.9,59,131.6,35.8,1,16.3,"YTUrb22[Ve, sea of heads]",DISCARD,TRUE,,3,18,SI_Urb_22-538,7.03,14.9,60.4,1023,SI_Urb_22-538,IL2021-45214
IL2021-32967,14-28444/14-11911,keep,478.4,77.9,59.6,131.4,35.3,0.6,6.7,,KEEP,TRUE,,29,9,SI_Urb_22-269,6.44,11,63.2,509,SI_Urb_22-269,
IL2021-16043,14-11772/07-20728,,456.4,77.9,60.3,132.6,37.6,1.1,19.1,YTUrb22[Leaning],DISCARD,TRUE,,23,25,SI_Urb_22-743,6.6,13.9,61.1,1418,SI_Urb_22-743,IL2021-16043
IL2021-15973,14-11772/07-4415,,462.8,77.9,58,131.2,36.7,1.2,20.1,YTNeo22[lodging],DISCARD,TRUE,,16,38,SI_Urb_22-1125,6.86,11.6,62.2,645,SI_Urb_22-1125,IL2021-15973
IL2021-33141,14-28462/10-21934,,459.2,77.9,58.9,132.2,38.4,1.2,17.4,YTUrb22[Leaning],DISCARD,TRUE,,10,38,SI_Urb_22-1131,6.62,11.9,63,651,SI_Urb_22-1131,IL2021-33141
IL2021-45901,14-3934/07-20743,,466.3,77.9,57.5,130.9,36.9,0.8,14.9,YTUrb22[Leaning],DISCARD,TRUE,,6,47,SI_Urb_22-1386,6.49,11.6,61.5,115,SI_Urb_22-1386,IL2021-45901
IL2021-28071,14-3934/14-11312,,469.5,77.9,58.3,132.9,36.2,0.6,10.2,YTUrb22[Tall],DISCARD,TRUE,,21,38,SI_Urb_22-1120,6.82,11.7,62.2,640,SI_Urb_22-1120,IL2021-28071
IL2021-28402,14-3934/15-25742,,463.4,77.9,58.5,131.6,36.2,1,19.3,YTUrb22[Looks a bit weak],DISCARD,TRUE,,27,41,SI_Urb_22-1227,5.99,10.9,62.4,454,SI_Urb_22-1227,IL2021-28402
IL2021-35732,16-4939/15-13159,,438.6,77.9,57.9,131.7,32.5,1.8,34.6,"YTUrb22[Short, Npt]",DISCARD,TRUE,,17,30,SI_Urb_22-884,7.8,14.1,60.4,1124,SI_Urb_22-884,IL2021-35732
IL2021-2269,VA11W-108/12-21624,,451.1,77.9,57.8,132.3,36.2,1.2,25.3,,DISCARD,TRUE,,4,21,SI_Urb_22-604,7,14.5,58,1204,SI_Urb_22-604,
IL2021-21068,02-19463-7/12-26004,,444.1,77.8,56.7,129.9,35.9,1.5,22,,KEEP,TRUE,,30,12,SI_Urb_22-331,6.01,12.1,58.9,690,SI_Urb_22-331,
IL2021-22646,07-20728/14-28444,,456.4,77.8,57.9,132.3,35.3,1.2,18.8,YTUrb22[Npt],DISCARD,TRUE,,30,24,SI_Urb_22-691,6.79,14,58.3,1410,SI_Urb_22-691,IL2021-22646
IL2021-40865,07-20728/14-28468//15-25742,,467.1,77.8,59.7,131.5,35.9,0.8,18.7,"YTNeo22[ve, septoria]",KEEP,TRUE,,12,40,SI_Urb_22-1189,5.62,11,63.3,529,SI_Urb_22-1189,IL2021-40865
IL2021-22754,07-20743/P05247A1-7-3-108-2,,449.3,77.8,59.6,132.6,36.3,1.4,21.8,,DISCARD,TRUE,,11,23,SI_Urb_22-671,8.06,14.2,61.3,1331,SI_Urb_22-671,
IL2021-6522,10-21934/14-11750,,464.9,77.8,58.9,132.3,38.7,0.8,14.6,YTUrb22[Lodging],DISCARD,TRUE,,1,28,SI_Urb_22-840,6.24,14.3,60.1,1260,SI_Urb_22-840,IL2021-6522
IL2021-26275,12-21235/14-11312,,465.2,77.8,58.3,131.1,36.3,1.2,15.6,,KEEP,TRUE,,6,9,SI_Urb_22-246,6.17,11.6,59.7,486,SI_Urb_22-246,
IL2021-7948,12-30879/14-9923,,459.7,77.8,58.7,131.8,35.2,1.2,18.9,YTUrb22[Leaning],DISCARD,TRUE,,4,28,SI_Urb_22-837,7.31,14.1,60.5,1257,SI_Urb_22-837,IL2021-7948
IL2021-42120,14-11772/14-11830//14-3934,,477.5,77.8,58,131.8,36.9,0.5,6.2,YTNeo22[septoria],DISCARD,TRUE,,2,44,SI_Urb_22-1319,6.69,11.4,61.3,299,SI_Urb_22-1319,IL2021-42120
IL2021-28374,14-3934/15-25742,,468.6,77.8,58.5,131.1,36.7,1,15.2,YTUrb22[Leaning],DISCARD,TRUE,,4,41,SI_Urb_22-1204,6.93,11,63.2,477,SI_Urb_22-1204,IL2021-28374
IL2021-6838,12-8512/IL12-26004,keep,477.7,77.7,58.2,130.3,35.9,0.8,11,,KEEP,TRUE,,23,12,SI_Urb_22-338,6.59,11.7,62.5,683,SI_Urb_22-338,
IL2021-13734,07-4415/14-28462,keep,482.1,77.7,58.5,130.4,35.7,0.6,8.3,"YTUrb22[Ve, npt]",KEEP,TRUE,,18,25,SI_Urb_22-738,7.46,13.9,59.8,1423,SI_Urb_22-738,IL2021-13734
IL2021-24872,12-8512/14-9542,keep,475.8,77.7,58.5,130.6,35.4,0.7,14.8,,KEEP,TRUE,,2,39,SI_Urb_22-1142,6.42,11.5,62.7,599,SI_Urb_22-1142,
IL2021-37508,P0566A1-3-1-52/IL12-26004//14-11772,keep,469.5,77.7,59.8,130.8,36.6,1.1,12.9,,KEEP,TRUE,"6/24/2022, 6:28:06 PM, Tare Warning, Test Weight: 6.45",26,8,SI_Urb_22-215,7.82,11.3,62.9,446,SI_Urb_22-215,
IL2021-25757,12-17428/12-26004,,449.7,77.7,58.8,130.6,34.7,1.8,29.5,YTUrb22[Tall],DISCARD,TRUE,,7,31,SI_Urb_22-907,7.76,14.5,60.5,1074,SI_Urb_22-907,IL2021-25757
IL2021-26075,12-21235/KY09C-1245-99-8-5,,464,77.7,59,131.1,37.6,1.2,17.5,,KEEP,TRUE,,21,16,SI_Urb_22-460,6.59,15.8,59.7,921,SI_Urb_22-460,
IL2021-15706,12-8545/14-28462,,459.6,77.7,59.2,130.6,34.3,1.5,21.4,YTUrb22[Npt],DISCARD,TRUE,,4,44,SI_Urb_22-1317,6.88,11.3,63.4,297,SI_Urb_22-1317,IL2021-15706
IL2021-11217,14-11750/KY09C-0052-26-12-3,,475.4,77.7,59.7,131.5,35.2,0.6,9.4,YTUrb22[Leaning],DISCARD,TRUE,,9,19,SI_Urb_22-549,7.03,14.9,61.5,1089,SI_Urb_22-549,IL2021-11217
IL2021-41972,14-11772/07-20728//14-28462,,459.2,77.7,59.8,132.1,36.3,1.2,15.7,,DISCARD,TRUE,,16,34,SI_Urb_22-1005,7.72,15.8,60.8,885,SI_Urb_22-1005,
IL2021-16764,14-11830/14-28468,,465.8,77.7,58.9,132.2,35.4,0.8,13,,KEEP,TRUE,,1,12,SI_Urb_22-360,6.26,11.8,63.9,661,SI_Urb_22-360,
IL2021-29318,14-9546/12-26004,,471.2,77.7,58.8,130.3,34.2,1.1,14.6,"YTUrb22[Short and early, looks weak]",DISCARD,TRUE,,24,37,SI_Urb_22-1104,6.39,11.7,63,697,SI_Urb_22-1104,IL2021-29318
IL2021-32845,15-10568/14-11312,,473.1,77.7,59.8,131.2,36.7,0.9,9.5,YTUrb22[Leaning],DISCARD,TRUE,,8,21,SI_Urb_22-608,6.86,14.2,61.8,1208,SI_Urb_22-608,IL2021-32845
IL2021-13712,07-4415/14-28462,keep,454.2,77.6,58,130.2,35.4,1.7,27.1,,KEEP,TRUE,,21,10,SI_Urb_22-280,7.13,11.7,62.5,561,SI_Urb_22-280,
IL2021-15104,07-20728/14-11830,,458.8,77.6,58.8,132.7,35.1,0.9,18.4,YTUrb22[Tall],DISCARD,TRUE,,9,37,SI_Urb_22-1089,7.19,11.9,63.2,712,SI_Urb_22-1089,IL2021-15104
IL2021-15215,07-20728/14-28462,,467.8,77.6,59.7,131.1,36.3,1,16.7,,DISCARD,TRUE,,11,33,SI_Urb_22-971,7.79,15.3,61.1,950,SI_Urb_22-971,
IL2021-5367,07-21847/14-11750,,461.2,77.6,59.5,131.9,36.5,1,19.3,YTUrb22[Leaning],DISCARD,TRUE,"6/27/2022, 5:03:26 PM, Tare Warning, Test Weight: 4.27",2,28,SI_Urb_22-839,5.61,14.7,59.8,1259,SI_Urb_22-839,IL2021-5367
IL2021-23309,07-21847/14-3934,,464.9,77.6,57.9,132.1,36.8,0.8,13.8,,KEEP,TRUE,,20,15,SI_Urb_22-440,6.56,16.1,59.1,860,SI_Urb_22-440,
IL2021-26865,12-26004/14-11312,,453.8,77.6,57.2,131.1,36.7,1.1,13.9,YTUrb22[Npt],DISCARD,TRUE,,5,44,SI_Urb_22-1316,6.61,11.4,61,296,SI_Urb_22-1316,IL2021-26865
IL2021-15934,14-11772/07-4415,,458.6,77.6,58.9,131.8,37,1.2,19,YTUrb22[Leaning],DISCARD,TRUE,,14,48,SI_Urb_22-1427,5.56,11.8,63,47,SI_Urb_22-1427,IL2021-15934
IL2021-31473,14-11916/12-21235,,447.6,77.6,58.5,131.8,36.2,1.6,25.7,YTUrb22[Leaning],DISCARD,TRUE,,28,48,SI_Urb_22-1413,5.89,11.8,62.2,33,SI_Urb_22-1413,IL2021-31473
IL2021-12361,14-21519/14-11750,drop,456.2,77.6,58.7,131.6,35.2,1.4,19.9,,KEEP,TRUE,,24,10,SI_Urb_22-277,6.57,11.4,64.6,564,SI_Urb_22-277,
IL2021-18265,14-28468/07-20728,,464.5,77.6,60.7,131.9,38.1,1,14.4,YTUrb22[Tall],DISCARD,TRUE,,6,28,SI_Urb_22-835,7.13,14.3,61.1,1255,SI_Urb_22-835,IL2021-18265
IL2021-18543,14-28468/14-19503,,461.5,77.6,59.2,131.6,36.2,1.2,15.7,YTUrb22[Tall],DISCARD,TRUE,,19,33,SI_Urb_22-979,6.89,15.8,59.4,942,SI_Urb_22-979,IL2021-18543
IL2021-39956,07-20728/07-4415//07-20728,,462.1,77.5,59.1,132.1,36.8,0.9,17,,KEEP,TRUE,,4,30,SI_Urb_22-897,7.64,14.3,60.8,1137,SI_Urb_22-897,
IL2021-39424,07-4415/14-11848//12-8512,,457.9,77.5,58.7,131.6,35.2,1.2,19.7,,DISCARD,TRUE,,1,17,SI_Urb_22-481,7.07,15.9,58.8,961,SI_Urb_22-481,
IL2021-29623,14-11312/12-8512,,440.8,77.5,58.7,132.3,37.6,1.8,26.5,YTUrb22[Leaning],DISCARD,TRUE,,19,38,SI_Urb_22-1122,7.26,11.7,63.1,642,SI_Urb_22-1122,IL2021-29623
IL2021-41921,14-11772/07-20728//14-28462,,458.4,77.5,59.8,131.8,36.7,1.3,16.8,YTUrb22[Tall],DISCARD,TRUE,,18,44,SI_Urb_22-1303,3.48,0,0,283,SI_Urb_22-1303,IL2021-41921
IL2021-16270,14-11772/14-28462,,458.7,77.5,60.5,131.7,37.6,1.2,19.7,,KEEP,TRUE,,3,9,SI_Urb_22-243,6.7,11.1,64,483,SI_Urb_22-243,
IL2021-17621,14-28462/12-8545,,468.3,77.5,58.7,132.1,38,0.8,10.7,YTUrb22[Leaning],DISCARD,TRUE,"6/24/2022, 6:41:06 PM, Tare Warning, Test Weight: 5.36",24,41,SI_Urb_22-1224,5.11,11.3,61.2,457,SI_Urb_22-1224,IL2021-17621
IL2021-18141,14-28468/07-19334,,464.5,77.5,58.7,131.1,36.8,1.2,14,YTUrb22[Leaning],KEEP,TRUE,,22,34,SI_Urb_22-999,7.11,15.5,59.7,879,SI_Urb_22-999,IL2021-18141
IL2021-28377,14-3934/15-25742,,457.7,77.5,58,133,37,0.9,14.7,YTUrb22[Lodging],DISCARD,TRUE,,5,40,SI_Urb_22-1196,7.25,11,62.5,536,SI_Urb_22-1196,IL2021-28377
IL2021-1824,MO150624/07-4415,,445.9,77.5,57.9,132.1,36.4,1.6,23.7,YTUrb22[Tall],DISCARD,TRUE,,20,46,SI_Urb_22-1361,4.75,11.7,59.4,161,SI_Urb_22-1361,IL2021-1824
IL2021-1936,MO150624/14-21519,,444.8,77.5,57.9,131.2,35.8,1.9,26.6,,KEEP,TRUE,,20,9,SI_Urb_22-260,6.81,11.2,61.8,500,SI_Urb_22-260,
IL2021-3906,P0566A1-3-1-52/IL13-20616,,462.5,77.5,58.8,131.1,35.6,1.2,16.8,"YTUrb22[Septoria, ugly]",DISCARD,TRUE,,25,45,SI_Urb_22-1345,4.71,11.5,60.7,216,SI_Urb_22-1345,IL2021-3906
IL2021-15047,07-20728/14-11830,,453.4,77.4,58.8,131.9,36,1.2,22.9,YTUrb22[Leaning],DISCARD,TRUE,,22,41,SI_Urb_22-1222,5.59,11.4,62.2,459,SI_Urb_22-1222,IL2021-15047
IL2021-40762,07-20728/14-28468//15-25742,,476.1,77.4,59.8,130.1,35.6,0.8,14,"YTNeo22[leaning, ve]",DISCARD,TRUE,,17,42,SI_Urb_22-1244,4.63,11.3,61.6,404,SI_Urb_22-1244,IL2021-40762
IL2021-13615,07-4415/14-11830,,469.1,77.4,58.4,132.6,35.4,0.5,10.2,,KEEP,TRUE,,17,10,SI_Urb_22-284,6.17,11.9,62.5,557,SI_Urb_22-284,
IL2021-29630,14-11312/12-8512,,466.6,77.4,59.1,131.5,35.2,0.9,12.5,,DISCARD,TRUE,,2,40,SI_Urb_22-1199,6.22,11.7,60.4,539,SI_Urb_22-1199,
IL2021-30265,14-11772/12-8512,,459.3,77.4,59.9,131.5,37.3,1.3,16.8,YTNeo22[lodging],DISCARD,TRUE,,28,32,SI_Urb_22-933,5.63,15.5,58.5,993,SI_Urb_22-933,IL2021-30265
IL2021-17773,14-28462/14-19503,,470.8,77.4,59.1,130.5,35.9,0.9,16.1,"YTUrb22[Looks good, a bit tall]",DISCARD,TRUE,,26,33,SI_Urb_22-986,6.66,16.1,59.9,935,SI_Urb_22-986,IL2021-17773
IL2021-18225,14-28468/07-20728,,463.9,77.4,60.2,131.5,37.6,1,16.5,YTUrb22[Leaning],DISCARD,TRUE,,24,36,SI_Urb_22-1057,6.36,12,63.5,757,SI_Urb_22-1057,IL2021-18225
IL2021-44653,14-28468/14-11848//16-4939,,460.1,77.4,58.8,131.1,34.9,1.2,21.9,YTUrb22[Leaning],DISCARD,TRUE,,15,48,SI_Urb_22-1426,4.99,12,61.2,46,SI_Urb_22-1426,IL2021-44653
IL2021-26214,12-21235/12-26004,,459.8,77.3,58.6,130.7,35.8,1.4,19.3,YTUrb22[Leaning],DISCARD,TRUE,,21,20,SI_Urb_22-580,6.57,14.4,59.8,1161,SI_Urb_22-580,IL2021-26214
IL2021-27375,13-1910/07-4415,,468.3,77.3,58.1,131.9,36.2,0.7,11.9,YTUrb22[Lodging],DISCARD,TRUE,,20,31,SI_Urb_22-920,6.8,15.6,57.9,1061,SI_Urb_22-920,IL2021-27375
IL2021-41344,12-8545/07-20728//14-28307,keep,480.1,77.3,59.6,131.7,36.4,0.3,3.4,,KEEP,TRUE,,29,48,SI_Urb_22-1412,5.67,12,62,32,SI_Urb_22-1412,
IL2021-31572,14-11916/12-26004,,466.5,77.3,58.2,131.7,36.9,0.7,15.8,YTUrb22[Lodg],DISCARD,TRUE,,11,21,SI_Urb_22-611,7.22,14,59.9,1211,SI_Urb_22-611,IL2021-31572
IL2021-45951,14-28444/P05247A1-7-3-120,,471.9,77.3,58.9,131.5,35.8,0.7,9.1,,DISCARD,TRUE,,11,18,SI_Urb_22-530,6.91,14.8,60.5,1031,SI_Urb_22-530,
IL2021-33852,14-28468/12-21235,drop,483.9,77.3,58.6,131.2,37.3,0.3,2,"YTUrb22[Bearded, tall]",KEEP,TRUE,,5,33,SI_Urb_22-965,7.07,15.3,58.3,956,SI_Urb_22-965,IL2021-33852
IL2021-40813,07-20728/14-28468//15-25742,,464.1,77.2,59.7,130.6,34.4,1.1,20.6,,DISCARD,TRUE,,4,42,SI_Urb_22-1257,7.01,11.1,63.6,417,SI_Urb_22-1257,
IL2021-21241,07-4415/KY09C-1245-99-8-5,,452.3,77.2,57.9,131.2,35.2,1.4,23.1,,KEEP,TRUE,,15,12,SI_Urb_22-346,6.71,12.1,61.9,675,SI_Urb_22-346,
IL2021-29119,14-9546/12-17257,,462.8,77.2,58.6,131.6,35.5,0.9,16.9,,DISCARD,TRUE,,1,36,SI_Urb_22-1080,6.35,11.5,63.6,780,SI_Urb_22-1080,
IL2021-36570,16-27570/12-26004,,470.9,77.2,59.4,131.1,37.1,0.8,11.8,,DISCARD,TRUE,,26,17,SI_Urb_22-506,6.9,15.7,60.1,986,SI_Urb_22-506,
IL2021-1058,MO080104/07-4415,,456.4,77.2,57.8,130.3,35.1,1.5,20.1,,KEEP,TRUE,,19,8,SI_Urb_22-222,6.4,11.2,62.6,439,SI_Urb_22-222,
IL2021-4312,02-19463-5/IL12-26004,,464.4,77.1,58.2,131.8,36.3,0.7,16.5,,DISCARD,TRUE,,19,45,SI_Urb_22-1339,5.36,11.5,60.6,222,SI_Urb_22-1339,
IL2021-20673,02-19463-7/KY09C-1245-99-8-5,,436.6,77.1,57.9,132.1,37,1.9,27.3,"YTUrb22[Bearded, Scab]",DISCARD,TRUE,,28,18,SI_Urb_22-513,7.52,15,59,1048,SI_Urb_22-513,IL2021-20673
IL2021-39328,07-4415/14-11848//12-8512,,455.3,77.1,57.9,131.8,35.9,1.2,19.1,,KEEP,TRUE,,11,8,SI_Urb_22-230,7.26,11.1,62.4,431,SI_Urb_22-230,
IL2021-41718,12-8545/14-28462//12-17257,,475.2,77.1,59.1,130.8,35.1,0.7,8.8,YTUrb22[A bit tall],DISCARD,TRUE,,13,41,SI_Urb_22-1213,5.08,11.2,62.5,468,SI_Urb_22-1213,IL2021-41718
IL2021-29563,14-11312/10-21934,,445.8,77.1,58,132.7,37.2,1.4,20.3,,KEEP,TRUE,,27,10,SI_Urb_22-274,7.86,11.6,62.2,567,SI_Urb_22-274,
IL2021-33277,14-28462/12-21235,,463.8,77.1,60,130.9,36.8,1.1,14.9,YTUrb22[Leaning],DISCARD,TRUE,,7,38,SI_Urb_22-1134,7.09,11.6,64.3,654,SI_Urb_22-1134,IL2021-33277
IL2021-19504,P0762A1-2-8/14-11312,,449.8,77.1,58.4,130.8,35.6,1.7,24.9,YTUrb22[Leaning],DISCARD,TRUE,,12,18,SI_Urb_22-529,7.14,15.5,58.7,1032,SI_Urb_22-529,IL2021-19504
IL2021-14749,07-19334/14-28468,,455.8,77,59.6,132.5,36.5,1.1,13,YTUrb22[Short and early],DISCARD,TRUE,,12,46,SI_Urb_22-1369,4.61,12.1,62,169,SI_Urb_22-1369,IL2021-14749
IL2021-40967,07-20728/14-28468//15-27666,,461.6,77,60,131.3,34.8,1,19.2,YTUrb22[Short and early],DISCARD,TRUE,,23,41,SI_Urb_22-1223,5.39,11.1,62.5,458,SI_Urb_22-1223,IL2021-40967
IL2021-39325,07-4415/14-11848//12-8512,,465.6,77,58.7,132.4,36.9,0.6,11.8,,DISCARD,TRUE,,16,30,SI_Urb_22-885,6.97,14.9,59.3,1125,SI_Urb_22-885,
IL2021-6853,12-8512/IL12-26004,,455.9,77,57.4,131.3,36.3,1,12.4,"YTNeo22[leaning, clean]",DISCARD,TRUE,,19,46,SI_Urb_22-1362,4.98,11.9,60.7,162,SI_Urb_22-1362,IL2021-6853
IL2021-15823,12-8545/14-28468,,460.4,77,59.2,132,36.5,1,13.6,YTUrb22[Leaning],DISCARD,TRUE,,3,22,SI_Urb_22-658,7.64,14.2,59,1263,SI_Urb_22-658,IL2021-15823
IL2021-43324,14-28462/07-20728//02-19463-7,,460.4,77,59.1,131.4,37,1.1,15.3,,DISCARD,TRUE,,23,48,SI_Urb_22-1418,5.36,11.6,62.3,38,SI_Urb_22-1418,
IL2021-29238,14-9546/12-21235,,461,77,58.2,131,35.4,1.2,16.7,YTUrb22[Leaning],DISCARD,TRUE,,5,36,SI_Urb_22-1076,7.43,11.7,63.5,776,SI_Urb_22-1076,IL2021-29238
IL2021-29353,14-9546/12-26004,,463.9,77,58.9,131,37.4,1,15.4,,DISCARD,TRUE,,4,32,SI_Urb_22-957,6.97,15.5,59,1017,SI_Urb_22-957,
IL2021-2244,VA11W-108/12-21624,,447.6,77,58,132.2,37,1.3,25.6,,DISCARD,TRUE,,3,21,SI_Urb_22-603,7.34,14.7,58.2,1203,SI_Urb_22-603,
IL2021-4033,02-19463-5/P0566A1-3-1-52,,453.3,76.9,58,131.9,36.3,1.1,23.2,YTNeo22[npt],DISCARD,TRUE,,26,40,SI_Urb_22-1175,5.36,11.3,61.1,515,SI_Urb_22-1175,IL2021-4033
IL2021-29023,14-9546/12-8512,keep,480.4,76.9,59.1,130.8,36.5,0.4,5.5,YTUrb22[Leaning],KEEP,TRUE,,5,37,SI_Urb_22-1085,6.86,11.6,63.6,716,SI_Urb_22-1085,IL2021-29023
IL2021-25229,12-17257/P05247A1-7-3-120,,429.6,76.9,58,133,34.1,1.9,29.4,,KEEP,TRUE,,2,11,SI_Urb_22-302,6.85,11.8,61.6,602,SI_Urb_22-302,
IL2021-29659,14-11312/12-8512,,436.5,76.9,58.3,132.8,36.1,1.7,26.8,,KEEP,TRUE,,30,16,SI_Urb_22-451,6.43,15.6,60,930,SI_Urb_22-451,
IL2021-11573,14-11750/13-1960,,471.3,76.9,59.8,131.1,37.7,0.7,10.8,YTUrb22[Leaning],DISCARD,TRUE,,30,27,SI_Urb_22-810,5.06,14.5,60.1,1291,SI_Urb_22-810,IL2021-11573
IL2021-15933,14-11772/07-4415,,454.4,76.9,58.3,132.1,36.9,1.1,20,,DISCARD,TRUE,,10,39,SI_Urb_22-1150,6.13,11.6,63,591,SI_Urb_22-1150,
IL2021-11939,14-11772/12-8512,,460.5,76.9,59.4,131.4,36.1,1.2,14.3,YTNeo22[lodging],DISCARD,TRUE,,17,27,SI_Urb_22-797,7.44,14,59.8,1304,SI_Urb_22-797,IL2021-11939
IL2021-16567,14-11830/07-20728,,461.4,76.9,58.7,132.9,35.2,0.6,14.3,,DISCARD,TRUE,,15,45,SI_Urb_22-1335,5.14,11.3,62.7,226,SI_Urb_22-1335,
IL2021-32929,14-28444/14-11911,,468.5,76.9,58,131.1,34.5,0.8,10.8,,DISCARD,TRUE,,10,21,SI_Urb_22-610,7.57,14.1,59,1210,SI_Urb_22-610,
IL2021-43669,14-28462/14-11830//12-21235,,454.1,76.9,59.6,132.8,35.7,1,16.4,YTUrb22[Leaning],DISCARD,TRUE,,24,22,SI_Urb_22-637,6.93,14.2,61.7,1284,SI_Urb_22-637,IL2021-43669
IL2021-29351,14-9546/12-26004,,474.2,76.9,58.3,130.6,36.7,0.7,10.4,YTUrb22[Leaning],DISCARD,TRUE,,3,36,SI_Urb_22-1078,7.3,11.6,63.5,778,SI_Urb_22-1078,IL2021-29351
IL2021-34101,15-10568/12-26004,,473.2,76.9,58.4,130,35.8,0.8,14.3,YTUrb22[Leaning],DISCARD,TRUE,,22,18,SI_Urb_22-519,6.77,14.7,60.1,1042,SI_Urb_22-519,IL2021-34101
IL2021-21622,07-19334/12-8512,,448.8,76.8,59.5,133.6,36.9,1.1,14.3,,DISCARD,TRUE,,28,23,SI_Urb_22-688,6.97,14.7,59.7,1348,SI_Urb_22-688,
IL2021-25933,12-17428/14-11916,,464.5,76.8,58.7,131.2,36.4,0.9,15.6,,KEEP,TRUE,,28,8,SI_Urb_22-213,7.11,11.4,61.8,448,SI_Urb_22-213,
IL2021-41321,12-8545/07-20728//14-28307,,448.9,76.8,59.5,133.1,37.1,1.1,17,,DISCARD,TRUE,,10,45,SI_Urb_22-1330,4.99,11.5,62.7,231,SI_Urb_22-1330,
IL2021-31619,14-11916/12-26004,,453.2,76.8,58.7,132.5,37.1,1,18.9,YTUrb22[Lodging],DISCARD,TRUE,,2,21,SI_Urb_22-602,6.74,14.8,60.3,1202,SI_Urb_22-602,IL2021-31619
IL2021-39307,07-4415/14-11848//P0762A1-2-8,,408.6,76.7,55.5,133.8,35.4,0.9,19.4,YTUrb22[Looks nice],DISCARD,TRUE,,7,17,SI_Urb_22-487,6.75,15.2,56.9,967,SI_Urb_22-487,IL2021-39307
IL2021-15729,12-8545/14-28462,,457.6,76.7,59.6,131.2,35.1,1.2,17.3,,DISCARD,TRUE,,8,37,SI_Urb_22-1088,6.77,11.6,64.1,713,SI_Urb_22-1088,
IL2021-42041,14-11772/14-11830//14-3934,,461.6,76.7,58.7,132.5,36.5,0.7,10.7,YTUrb22[Tall],DISCARD,TRUE,,28,20,SI_Urb_22-573,7.51,14.7,61.1,1168,SI_Urb_22-573,IL2021-42041
IL2021-16410,14-11772/14-28468,,458.2,76.7,59.6,131.9,37.1,1.1,13.5,,KEEP,TRUE,,23,15,SI_Urb_22-443,7.43,16,59.5,863,SI_Urb_22-443,
IL2021-46051,14-28462/14-11911,drop,449.3,76.7,58.9,130.2,35.2,1.8,24.9,,DISCARD,TRUE,,10,18,SI_Urb_22-531,7.29,15.2,59.4,1030,SI_Urb_22-531,
IL2021-28432,14-9542/12-21235,,455,76.7,58.9,131,36.1,1.3,20,,KEEP,TRUE,,30,15,SI_Urb_22-450,5.79,16.4,57.6,870,SI_Urb_22-450,
IL2021-9345,IL13-20616/10-21934,,460.1,76.7,58,131.7,35.9,0.9,16.7,,DISCARD,TRUE,,17,29,SI_Urb_22-857,8.19,14.3,59.7,1184,SI_Urb_22-857,
IL2021-46635,P0566A1-3-1-52/13-1910//12-8512,,452.7,76.7,58.1,132.3,36.5,1.1,17.1,YTUrb22[Tall],DISCARD,TRUE,,25,35,SI_Urb_22-1045,7.05,16.4,58,816,SI_Urb_22-1045,IL2021-46635
IL2021-2314,VA11W-108/IL12-26004,,460.8,76.7,58.8,131.2,36.4,0.9,19.2,YTUrb22[Lodging],DISCARD,TRUE,,16,24,SI_Urb_22-705,7.09,13.6,59.7,1396,SI_Urb_22-705,IL2021-2314
IL2021-40765,07-20728/14-28468//15-25742,keep,476.9,76.6,60.1,130.2,34.4,0.6,9.5,"YTNeo22[ve, leaning]",KEEP,TRUE,,9,42,SI_Urb_22-1252,5.02,11,62.3,412,SI_Urb_22-1252,IL2021-40765
IL2021-26271,12-21235/14-11312,,449,76.6,57.5,132.5,37.6,1,12.3,YTUrb22[Tall],DISCARD,TRUE,,2,30,SI_Urb_22-899,6.47,15.7,56.6,1139,SI_Urb_22-899,IL2021-26271
IL2021-27364,13-1910/07-4415,,459.7,76.6,58.2,131.1,37.3,1,18.9,,KEEP,TRUE,,1,14,SI_Urb_22-420,7.5,17.1,57.9,781,SI_Urb_22-420,
IL2021-42061,14-11772/14-11830//14-3934,,456.9,76.6,58.7,132.5,35.9,1,12.7,YTNeo22[lodging],DISCARD,TRUE,,7,40,SI_Urb_22-1194,6.92,11,62.5,534,SI_Urb_22-1194,IL2021-42061
IL2021-12322,14-21519/14-11750,,459,76.6,59,132.6,37.6,0.8,12.4,,DISCARD,TRUE,,19,28,SI_Urb_22-822,6.93,14.4,61,1242,SI_Urb_22-822,
