germplasmName,purdy.pedigree,decision,merit,Grain.yield...bu.ac,Grain.test.weight...lbs.bu,Heading.time...Julian.date..JD..,Plant.height.inches,FHB.DON.content...ppm.,FHB.grain.incidence.....,notes3,action,Found,Quick.Note.,range.,row.,plot_me.,Weight..lb.,Moisture....,Test.Weight..lb.bu.,Harvest.Sequence.,seedlot_me,ugid
IL2021-22316,07-20728/P0762A1-2-8,keep,540.1,93.5,58.2,133.1,35.3,1.1,18.9,,KEEP,TRUE,,30,37,SI_Urb_22-1110,5.83,12,61.4,691,SI_Urb_22-1110,
IL2021-22514,07-20728/13-1910,keep,546.6,91.3,59.3,132.7,35.8,0.5,11.8,,KEEP,TRUE,,27,24,SI_Urb_22-694,8.39,14.4,61.1,1407,SI_Urb_22-694,
IL2021-18451,14-28468/14-11830,keep,521.6,90.6,58.1,132.7,34.7,1.3,19.8,,KEEP,TRUE,,15,39,SI_Urb_22-1155,7.33,11.9,62.4,586,SI_Urb_22-1155,
IL2021-18124,14-28468/07-19334,keep,522.5,90.3,58.9,132.9,37.3,1.3,16.7,,KEEP,TRUE,,19,34,SI_Urb_22-1002,8.09,15.3,59.1,882,SI_Urb_22-1002,
IL2021-15134,07-20728/14-28462,keep,532.1,90.2,59.4,132.1,34.5,0.9,16.5,,KEEP,TRUE,,13,45,SI_Urb_22-1333,5.15,11.7,63.2,228,SI_Urb_22-1333,
IL2021-17463,14-28462/07-20728,keep,529.3,90.2,59.5,132.5,36.9,1.1,14.6,,KEEP,TRUE,,22,20,SI_Urb_22-579,7.89,14.4,60.9,1162,SI_Urb_22-579,
IL2021-23158,07-21847/12-17257,drop,502.7,89.7,58.3,132.7,36.8,1.8,28.5,,KEEP,TRUE,,29,45,SI_Urb_22-1349,6.35,11.8,59.9,212,SI_Urb_22-1349,
IL2021-17749,14-28462/14-11830,keep,521.1,89.5,58.8,131.6,35.1,1.2,23.4,YTUrb22[Leaning],KEEP,TRUE,,25,34,SI_Urb_22-996,7.23,15.7,59.7,876,SI_Urb_22-996,IL2021-17749
IL2021-41738,12-8545/14-28462//12-17257,keep,528.4,89.2,58.6,132.7,35.6,0.9,12,YTUrb22[Npt],KEEP,TRUE,,17,44,SI_Urb_22-1304,5.78,11.6,61.4,284,SI_Urb_22-1304,IL2021-41738
IL2021-42012,14-11772/07-20728//14-28462,drop,507.1,88.9,60.6,134.1,37.6,1.2,20.8,,KEEP,TRUE,,10,15,SI_Urb_22-430,7.21,15.3,62.2,850,SI_Urb_22-430,
IL2021-43878,14-28462/14-11830//14-28468,keep,518.1,88.6,58.9,131.6,33.4,1.4,17.3,"YTUrb22[Mix, Npt]",KEEP,TRUE,,27,21,SI_Urb_22-627,7.56,14.4,59.3,1227,SI_Urb_22-627,IL2021-43878
IL2021-43872,14-28462/14-11830//14-28468,keep,511.2,88.6,58.9,131.9,33.8,1.5,21.8,,KEEP,TRUE,,30,20,SI_Urb_22-571,6.8,14.7,60,1170,SI_Urb_22-571,
IL2021-15175,07-20728/14-28462,drop,521.2,88.5,59.3,131.9,38.2,1,17.9,,DISCARD,TRUE,,18,45,SI_Urb_22-1338,4.48,11.3,63.1,223,SI_Urb_22-1338,
IL2021-18172,14-28468/07-19334,drop,489.2,88.5,58.3,133.2,37.1,2,27.9,,KEEP,TRUE,,26,24,SI_Urb_22-695,8.72,13.9,59,1406,SI_Urb_22-695,
IL2021-39253,07-4415/14-11848//P0762A1-2-8,keep,513.5,88.4,58.7,132.8,35.1,1.3,16,YTUrb22[Sea of heads],KEEP,TRUE,,15,17,SI_Urb_22-495,8.53,15.2,59.7,975,SI_Urb_22-495,IL2021-39253
IL2021-36639,16-27570/14-28462,keep,513.7,88.2,59.5,132.1,36.5,1.2,19.5,"YTUrb22[Erect, npt]",KEEP,TRUE,,26,18,SI_Urb_22-515,7.68,15.2,60.2,1046,SI_Urb_22-515,IL2021-36639
IL2021-39238,07-4415/14-11848//P0762A1-2-8,keep,514.3,88.2,59.1,132.5,36.3,1.2,15.6,YTUrb22[Tall],KEEP,TRUE,,6,16,SI_Urb_22-475,7.71,15.9,59.6,906,SI_Urb_22-475,IL2021-39238
IL2021-31004,14-11848/12-26004,keep,518.4,88.2,59.9,132.6,36.8,1,14,,KEEP,TRUE,,28,16,SI_Urb_22-453,7.41,15.4,60.8,928,SI_Urb_22-453,
IL2021-28801,14-9542/16-27570,keep,516.7,88.1,58.9,132.8,36.1,0.9,17.4,,KEEP,TRUE,,25,43,SI_Urb_22-1285,5.9,11.5,60.8,336,SI_Urb_22-1285,
07-19334,,,496,88.1,58.6,135.2,37.6,1.3,18.4,,,,,,,,,,,,,
IL2021-24143,10-21934/14-11772,keep,507.6,87.8,58.2,132.5,37,1.3,19.6,,KEEP,TRUE,,13,11,SI_Urb_22-313,7.64,11.7,61.8,613,SI_Urb_22-313,
IL2021-36632,16-27570/14-28462,drop,483.4,87.8,58.9,133.2,37.8,2.1,30.8,,KEEP,TRUE,,11,13,SI_Urb_22-371,7.95,11.9,64.1,731,SI_Urb_22-371,
IL2021-19808,P05247A1-7-3-108-2/12-21235,drop,491.3,87.7,56.6,132.2,36.1,1,18,,KEEP,TRUE,,2,47,SI_Urb_22-1382,6.99,12,59.5,119,SI_Urb_22-1382,
IL2021-19401,P0762A1-2-8/14-9542,keep,507.3,87.6,57.4,131.5,35.3,1,20.6,,KEEP,TRUE,,30,17,SI_Urb_22-510,7.2,15.5,58.3,990,SI_Urb_22-510,
IL2021-16459,14-11772/14-28468,keep,502.8,87.6,59.3,131.9,36.7,1.7,21.3,YTNeo22[clean],KEEP,TRUE,,2,34,SI_Urb_22-1019,7.59,15.8,60.8,899,SI_Urb_22-1019,IL2021-16459
16-8048,,,515.4,87.4,58.6,133.2,36.9,0.8,12.1,,,,,,,,,,,,,
IL2021-28712,14-9542/15-13159,keep,490.3,87.3,58,132.1,33.6,1.8,31.6,YTUrb22[Npt],KEEP,TRUE,,20,43,SI_Urb_22-1280,5.54,11.4,61.3,341,SI_Urb_22-1280,IL2021-28712
IL2021-25359,12-17257/07-20728,keep,493.8,87.3,59.3,133.6,36.4,1.5,23.2,,KEEP,TRUE,,10,35,SI_Urb_22-1030,7.56,15.5,60.5,831,SI_Urb_22-1030,
IL2021-46842,07-20728/07-4415//15-27270,keep,507,87.2,58.3,133.1,35.1,1.1,17.7,YTUrb22[Lodging],KEEP,TRUE,,22,43,SI_Urb_22-1282,5.88,12.1,60.4,339,SI_Urb_22-1282,IL2021-46842
IL2021-36731,16-27570/14-28468,keep,509.5,87.2,58.5,133.2,35.8,1.1,12.9,,KEEP,TRUE,,18,18,SI_Urb_22-523,7.56,15.1,59.9,1038,SI_Urb_22-523,
IL2021-5070,07-4415/13-1910,drop,500.4,87.1,57.3,131.5,36.6,1,21.4,,KEEP,TRUE,,14,35,SI_Urb_22-1034,8.1,16.1,59.2,827,SI_Urb_22-1034,
IL2021-5108,07-4415/13-1910,drop,496.4,87.1,57.5,132,36,1.4,20,,KEEP,TRUE,,20,29,SI_Urb_22-860,7.86,14.7,57.9,1181,SI_Urb_22-860,
IL2021-13577,07-4415/14-11772,keep,507.1,87,58.6,131.2,36.4,1.5,20.8,,KEEP,TRUE,,3,12,SI_Urb_22-358,7.66,11.9,61.9,663,SI_Urb_22-358,
IL2021-36748,16-27570/14-28468,keep,513,87,60,131.3,36,1.3,16.5,YTUrb22[Npt],KEEP,TRUE,,21,23,SI_Urb_22-681,7.79,14.2,60.9,1341,SI_Urb_22-681,IL2021-36748
IL2021-17213,14-19503/14-28462,drop,510.3,87,58.6,133.1,37,0.9,14.8,YTUrb22[Lodging],KEEP,TRUE,,16,31,SI_Urb_22-916,7.36,14.5,60.4,1065,SI_Urb_22-916,IL2021-17213
IL2021-39636,07-19334/07-20728//16-18944,keep,503,87,58.6,132.7,36.3,1.3,19.9,,KEEP,TRUE,,3,15,SI_Urb_22-423,7.61,16.3,59.9,843,SI_Urb_22-423,
IL2021-36450,16-27570/07-20728,keep,507.8,87,59.6,133,36,0.9,18.8,YTUrb22[Lodg],KEEP,TRUE,,11,22,SI_Urb_22-650,7.82,14.3,61.7,1271,SI_Urb_22-650,IL2021-36450
IL2021-14741,07-19334/14-28468,drop,501.4,86.9,57.5,132.2,37.5,1.1,16.1,YTUrb22[Tall],DISCARD,TRUE,,30,42,SI_Urb_22-1231,5.31,11.6,58.7,391,SI_Urb_22-1231,IL2021-14741
IL2021-17841,14-28462/14-28468,keep,506.9,86.8,59.7,131.2,35.3,1.5,20.5,,KEEP,TRUE,,20,14,SI_Urb_22-401,7.39,16,60.1,800,SI_Urb_22-401,
IL2021-28678,14-9542/14-9546,keep,505.6,86.8,58,131.4,36.7,1.4,22,YTUrb22[Tall],KEEP,,,23,44,SI_Urb_22-1298,5.52,11.5,61.2,278,SI_Urb_22-1298,IL2021-28678
IL2021-42039,14-11772/14-11830//14-3934,drop,479.1,86.8,56.7,132.7,35.7,1.3,20.3,,KEEP,TRUE,,30,13,SI_Urb_22-390,6.36,12.1,60.9,750,SI_Urb_22-390,
IL2021-15219,07-20728/14-28462,keep,512.7,86.8,60.5,131.9,36.5,1.1,16,YTNeo22[leaning],KEEP,TRUE,,16,45,SI_Urb_22-1336,5.43,11.6,63.6,225,SI_Urb_22-1336,IL2021-15219
IL2021-17428,14-28462/07-19334,keep,516.3,86.7,59.6,132.5,37.1,0.8,11.8,YTUrb22[Tall],KEEP,TRUE,,15,31,SI_Urb_22-915,7.4,14.8,60,1066,SI_Urb_22-915,IL2021-17428
IL2021-43177,14-28462/07-19334//12-26004,keep,512.5,86.6,59.9,131.8,36.6,1.1,15.9,,KEEP,TRUE,,24,47,SI_Urb_22-1404,5.26,11.8,62.5,97,SI_Urb_22-1404,
IL2021-15254,07-20728/14-28468,keep,523,86.6,60.2,132,37.2,0.7,7.7,YTUrb22[Leaning],KEEP,TRUE,,4,24,SI_Urb_22-717,8.49,14.2,62.1,1384,SI_Urb_22-717,IL2021-15254
IL2021-13707,07-4415/14-28462,keep,503.6,86.5,58.4,130.9,36.3,1.5,24.3,,KEEP,TRUE,,30,26,SI_Urb_22-751,7.26,13.9,58.1,1351,SI_Urb_22-751,
IL2021-27466,13-1910/12-8512,keep,512.3,86.5,58.4,132.2,35.7,1,14.7,YTUrb22[Lodging],KEEP,TRUE,,12,32,SI_Urb_22-949,8.04,15.2,59.6,1009,SI_Urb_22-949,IL2021-27466
IL2021-46033,14-28462/14-9546,keep,518.7,86.5,58.5,132.3,35.5,0.7,11.1,YTNeo22[scab],KEEP,TRUE,,1,18,SI_Urb_22-540,6.49,15.2,58.6,1021,SI_Urb_22-540,IL2021-46033
IL2021-36630,16-27570/14-28462,keep,504.5,86.4,59.5,132.8,36.4,1.2,14.1,,KEEP,TRUE,"6/27/2022, 11:08:25 AM, Tare Warning, Weight: 32.90 : 6/27/2022, 11:08:25 AM, Tare Warning, Test Weight: -9.87",24,16,SI_Urb_22-457,7.89,15.4,60.9,924,SI_Urb_22-457,
IL2021-43877,14-28462/14-11830//14-28468,keep,507,86.3,59.3,132.3,35.7,1.1,15.8,YTUrb22[Lodg],KEEP,TRUE,,23,47,SI_Urb_22-1403,5.52,11.5,62.8,98,SI_Urb_22-1403,IL2021-43877
IL2021-36756,16-27570/14-28468,keep,531.7,86.2,59.6,130,34.6,0.7,8.9,,KEEP,TRUE,,20,16,SI_Urb_22-461,7.22,16.2,59.4,920,SI_Urb_22-461,
IL2021-43921,14-28462/14-11830//14-28468,keep,515.4,86.2,59,131.8,35.8,0.9,12.7,"YTNeo22[late, npt]",KEEP,TRUE,,28,29,SI_Urb_22-868,8.04,14.6,59.9,1173,SI_Urb_22-868,IL2021-43921
IL2021-17475,14-28462/07-20728,keep,500,86.2,58.9,132.4,35.2,1.3,19.8,YTUrb22[ve],KEEP,TRUE,,15,42,SI_Urb_22-1246,7.4,11.2,62.5,406,SI_Urb_22-1246,IL2021-17475
IL2021-25339,12-17257/07-20728,keep,505.5,86.2,59.7,132.6,35.9,1,17.3,,KEEP,,,7,42,SI_Urb_22-1254,6.91,11.2,62.7,414,SI_Urb_22-1254,
IL2021-16419,14-11772/14-28468,keep,511.7,86.1,59.5,131.5,36.6,1.1,13.7,,KEEP,TRUE,,14,10,SI_Urb_22-287,7.52,11.6,63.5,554,SI_Urb_22-287,
IL2021-46035,14-28462/14-9546,keep,506.9,86.1,59.4,132.7,36,1,13.1,YTUrb22[Lodging],KEEP,TRUE,,8,18,SI_Urb_22-533,8.19,14.1,61.2,1028,SI_Urb_22-533,IL2021-46035
IL2021-41721,12-8545/14-28462//12-17257,keep,494.4,86,58.6,131.1,34.2,1.7,26.1,YTUrb22[Npt],KEEP,TRUE,,9,41,SI_Urb_22-1209,7.02,11.1,63.3,472,SI_Urb_22-1209,IL2021-41721
IL2021-19766,P05247A1-7-3-108-2/12-17257,keep,508.5,86,59.1,131.5,36.4,1.2,15.2,YTUrb22[Tall],KEEP,TRUE,,18,17,SI_Urb_22-498,7.76,14.9,61.4,978,SI_Urb_22-498,IL2021-19766
IL2021-14320,07-19334/14-11772,keep,497.8,86,59.2,133.3,36.6,1.2,16.4,YTUrb22[Leaning],KEEP,TRUE,,4,25,SI_Urb_22-724,7.73,13.7,61.4,1437,SI_Urb_22-724,IL2021-14320
IL2021-36445,16-27570/07-20728,keep,508.1,86,59.7,133.5,35.8,0.7,13.3,YTUrb22[Npt],KEEP,TRUE,,13,26,SI_Urb_22-768,8.45,14.3,60.7,1368,SI_Urb_22-768,IL2021-36445
IL2021-14672,07-19334/14-28462,drop,519.7,85.9,59,132.9,37.9,0.5,5.3,YTUrb22[Tall],DISCARD,TRUE,,12,45,SI_Urb_22-1332,5.14,11.5,62.3,229,SI_Urb_22-1332,IL2021-14672
IL2021-36725,16-27570/14-28468,keep,524.6,85.9,60.3,131.1,36.3,0.6,9.5,YTUrb22[Leaning],KEEP,TRUE,,25,18,SI_Urb_22-516,8.16,15.3,61.1,1045,SI_Urb_22-516,IL2021-36725
IL2021-16642,14-11830/14-11848,drop,482.4,85.9,57.4,134.4,35.1,1,18.9,,KEEP,TRUE,,21,15,SI_Urb_22-441,6.71,16.2,56.4,861,SI_Urb_22-441,
IL2021-19253,P0762A1-2-8/12-17257,drop,477,85.9,56.8,132.8,34.9,1.3,18.6,,KEEP,TRUE,"6/27/2022, 4:00:32 PM, Tare Warning, Test Weight: -7.54",3,29,SI_Urb_22-843,8.08,14.4,58.3,1198,SI_Urb_22-843,
IL2021-43415,14-28462/07-20728//10-21934,keep,509.2,85.8,58.9,132.3,36.9,1,11.9,,KEEP,TRUE,,8,46,SI_Urb_22-1373,6.56,11.6,61.9,173,SI_Urb_22-1373,
IL2021-26829,12-26004/07-19334,keep,492.3,85.8,57.7,132.8,35.9,1.3,17.6,"YTUrb22[Sea of heads, npt]",KEEP,TRUE,,6,22,SI_Urb_22-655,7.37,14.5,59,1266,SI_Urb_22-655,IL2021-26829
IL2021-2915,P0762A1-2-8/13-1910,drop,505.6,85.8,58.3,132.9,35.8,0.8,17.3,YTUrb22[Npt],DISCARD,TRUE,mix with 22,23,37,SI_Urb_22-1103,7.29,11.6,62.6,698,SI_Urb_22-1103,IL2021-2915
IL2021-17845,14-28462/14-28468,keep,496.2,85.7,59.5,131.5,35.3,1.6,22,YTNeo22[sept],KEEP,TRUE,,5,27,SI_Urb_22-785,8.16,14,61.1,1316,SI_Urb_22-785,IL2021-17845
IL2021-45950,14-28444/P05247A1-7-3-120,drop,483.6,85.7,59.3,133.8,38.1,1.6,21.9,"YTUrb22[Late, tall]",DISCARD,TRUE,,3,47,SI_Urb_22-1383,5.83,11.7,60.5,118,SI_Urb_22-1383,IL2021-45950
IL2021-22564,07-20728/14-28444,keep,506.7,85.7,60.4,132.1,37.1,1,15.1,YTUrb22[Lodging],KEEP,TRUE,,10,23,SI_Urb_22-670,8.21,14.1,61.7,1330,SI_Urb_22-670,IL2021-22564
IL2021-14925,07-20728/07-19334,keep,515.7,85.7,59.6,132.3,38.1,0.5,13.1,,KEEP,TRUE,,1,10,SI_Urb_22-300,7.66,12.3,61.8,541,SI_Urb_22-300,
IL2021-17857,14-28462/14-28468,keep,497.8,85.6,59.5,131.4,35.1,1.5,20.6,YTUrb22[Npt],KEEP,TRUE,,24,18,SI_Urb_22-517,8.41,15,60.4,1044,SI_Urb_22-517,IL2021-17857
IL2021-16676,14-11830/14-28462,keep,509.7,85.6,58.5,132,35.2,0.9,13.4,YTUrb22[Mix],KEEP,TRUE,,25,19,SI_Urb_22-565,8.04,14.8,59.2,1105,SI_Urb_22-565,IL2021-16676
IL2021-21969,07-19334/14-9546,keep,491.1,85.6,58.1,132.3,35.8,1.6,22.1,YTUrb22[Leaning],KEEP,TRUE,,15,22,SI_Urb_22-646,8.06,14.3,59.8,1275,SI_Urb_22-646,IL2021-21969
IL2021-26813,12-26004/07-19334,keep,511,85.6,57.9,132.8,35.5,0.6,9.1,"YTUrb22[Sea of heads, late]",KEEP,TRUE,,3,43,SI_Urb_22-1263,7.47,11.5,59.9,358,SI_Urb_22-1263,IL2021-26813
IL2021-25411,12-17257/07-20728,keep,507.7,85.6,59.6,132.9,35.7,0.8,11.9,YTUrb22[A bit tall],KEEP,TRUE,,14,40,SI_Urb_22-1187,6.87,11.4,62.9,527,SI_Urb_22-1187,IL2021-25411
IL2021-42959,14-28462/07-4415//14-3934,keep,500.3,85.5,58.7,133,36.3,0.9,18.1,,KEEP,TRUE,,25,22,SI_Urb_22-636,7.21,14.2,60.9,1285,SI_Urb_22-636,
IL2021-16612,14-11830/07-20728,keep,493.6,85.5,58.1,133.2,34.7,1.2,20.1,YTUrb22[Lodging],KEEP,TRUE,,16,44,SI_Urb_22-1305,6.26,11.8,61.3,285,SI_Urb_22-1305,IL2021-16612
IL2021-16814,02-19463-7/16-9335,drop,499.4,85.4,57.5,131.5,36.6,1,16,"YTUrb22[Mix, tall]",KEEP,TRUE,,20,20,SI_Urb_22-581,6.9,14.8,59.3,1160,SI_Urb_22-581,IL2021-16814
IL2021-15149,07-20728/14-28462,keep,501.9,85.4,59.8,131.2,36.6,1.3,20.9,,KEEP,TRUE,,20,44,SI_Urb_22-1301,4.84,11.5,62.8,281,SI_Urb_22-1301,
IL2021-16473,14-11772/14-28468,drop,484.1,85.4,59.9,131.9,36.1,1.8,27.9,,KEEP,TRUE,,26,47,SI_Urb_22-1406,4.87,11.5,63.9,95,SI_Urb_22-1406,
IL2021-16330,14-11772/14-28462,keep,494.9,85.4,59.9,131.7,36.7,1.5,20.6,,KEEP,TRUE,,1,34,SI_Urb_22-1020,6.59,15.8,59.7,900,SI_Urb_22-1020,
IL2021-5047,07-4415/13-1910,drop,470.4,85.3,56.6,131.3,37.7,1.5,26.4,YTUrb22[Tall],DISCARD,TRUE,,12,36,SI_Urb_22-1069,6.81,11.9,62.3,769,SI_Urb_22-1069,IL2021-5047
IL2021-33409,14-28462/12-26004,keep,496.6,85.3,57.9,131.9,36.3,1.4,18.2,YTUrb22[Sea of heads],KEEP,TRUE,,24,19,SI_Urb_22-564,7.93,14.6,57.8,1104,SI_Urb_22-564,IL2021-33409
IL2021-28714,14-9542/15-13159,keep,494.8,85.3,58.6,132.2,34.4,1.2,23.5,YTUrb22[Leaning],KEEP,TRUE,,26,43,SI_Urb_22-1286,5.95,11.2,60.8,335,SI_Urb_22-1286,IL2021-28714
IL2021-9529,IL13-20616/14-9527,keep,489.9,85.3,58.7,132.3,35.4,1.4,24.5,,KEEP,TRUE,,8,19,SI_Urb_22-548,7.91,14.6,60.5,1088,SI_Urb_22-548,
IL2021-15245,07-20728/14-28468,keep,511.2,85.3,59.7,132.4,36.3,0.7,10.6,,KEEP,TRUE,,5,34,SI_Urb_22-1016,7.55,15.6,60.8,896,SI_Urb_22-1016,
IL2021-27763,14-3934/P05247A1-7-3-29,drop,498.5,85.3,58.6,133.8,36.7,0.9,13.7,YTUrb22[Mixed],KEEP,TRUE,,19,32,SI_Urb_22-942,7.39,14.9,60,1002,SI_Urb_22-942,IL2021-27763
IL2021-3403,P05247A1-7-3-120/07-4415,keep,490,85.2,58.2,131.8,35.5,1.5,25.2,,KEEP,TRUE,,3,10,SI_Urb_22-298,7.15,11.9,61.2,543,SI_Urb_22-298,
IL2021-28826,14-9542/16-27570,keep,494.7,85.2,59.3,132.2,34.6,1.3,21.8,,KEEP,TRUE,,5,39,SI_Urb_22-1145,7.47,11.5,64.6,596,SI_Urb_22-1145,
IL2021-16576,14-11830/07-20728,keep,497,85.2,58.9,133.2,35.8,1,18.2,,KEEP,TRUE,,9,27,SI_Urb_22-789,7.54,14.2,60.8,1312,SI_Urb_22-789,
IL2021-39950,07-20728/07-4415//07-20728,drop,494.2,85.1,58.9,132.5,37.7,1.2,20.8,YTNeo22[leaning],DISCARD,TRUE,,25,30,SI_Urb_22-876,7.89,14.3,61.4,1116,SI_Urb_22-876,IL2021-39950
IL2021-26834,12-26004/07-19334,keep,506.4,85.1,58,131.4,35,1.1,14.4,YTUrb22[Sea of heads],KEEP,TRUE,,10,36,SI_Urb_22-1071,7.45,11.7,62.5,771,SI_Urb_22-1071,IL2021-26834
IL2021-17866,14-28462/14-28468,keep,497.7,85.1,59.4,131.5,35.7,1.4,18.2,YTNeo22[ve npt],KEEP,TRUE,,17,33,SI_Urb_22-977,7.42,15.7,59.4,944,SI_Urb_22-977,IL2021-17866
IL2021-17373,14-28462/07-19334,keep,509.7,85,59.4,132,36.3,0.8,10.7,,KEEP,TRUE,,21,19,SI_Urb_22-561,7.51,14.7,60.1,1101,SI_Urb_22-561,
IL2021-43865,14-28462/14-11830//14-28468,keep,505.8,85,59.4,132,35.6,0.9,13.4,,KEEP,TRUE,,26,20,SI_Urb_22-575,7.75,14.5,60.3,1166,SI_Urb_22-575,
IL2021-14669,07-19334/14-28462,keep,503.7,85,59.4,132.2,36.4,1,14.4,,KEEP,TRUE,,3,8,SI_Urb_22-238,7.3,11.3,62.9,423,SI_Urb_22-238,
IL2021-47142,14-11848/14-28462//16-9335,keep,492.5,85,59.4,133,36.6,1.1,20.7,,KEEP,TRUE,,30,36,SI_Urb_22-1051,5.92,12.1,64.4,751,SI_Urb_22-1051,
IL2021-19708,P0762A1-2-8/16-18944,drop,477.7,85,57.5,132.6,33.6,1.4,27.7,"YTUrb22[Npt, late, green leaves]",KEEP,TRUE,,19,17,SI_Urb_22-499,7.42,15.5,58.7,979,SI_Urb_22-499,IL2021-19708
IL2021-43764,14-28462/14-11830//12-26004,keep,513.1,84.9,58.2,131.8,36.3,0.7,9.6,,KEEP,TRUE,,20,30,SI_Urb_22-881,7.88,14.2,59.7,1121,SI_Urb_22-881,
IL2021-36613,16-27570/12-26004,keep,500.9,84.9,58.7,131.8,35.7,1.1,17,,KEEP,TRUE,,23,16,SI_Urb_22-458,7.45,15.4,60.4,923,SI_Urb_22-458,
IL2021-45928,14-9542/KY09C-1245-99-8-5,drop,475.1,84.9,58.5,132.4,36.7,1.8,32.7,"YTUrb22[Late, scab]",KEEP,TRUE,,4,19,SI_Urb_22-544,7.78,14.7,59.7,1084,SI_Urb_22-544,IL2021-45928
IL2021-18457,14-28468/14-11830,keep,515.9,84.9,58.9,132.8,36,0.4,6,,KEEP,TRUE,,13,40,SI_Urb_22-1188,6.32,11.2,62.3,528,SI_Urb_22-1188,
IL2021-15179,07-20728/14-28462,keep,498.9,84.9,59.5,132.9,36.9,0.9,16,,KEEP,TRUE,,16,15,SI_Urb_22-436,7.8,15.6,61.2,856,SI_Urb_22-436,
IL2021-46626,P0566A1-3-1-52/13-1910//12-8512,drop,479.8,84.9,57.5,132.8,36.9,1.4,20.8,,KEEP,TRUE,,23,35,SI_Urb_22-1043,6.71,16.4,57.3,818,SI_Urb_22-1043,
IL2021-22474,07-20728/13-1910,drop,481.4,84.8,59.6,133.1,34.5,1.5,25.9,YTUrb22[Leaning],KEEP,TRUE,,2,46,SI_Urb_22-1379,7.69,11.4,63.1,179,SI_Urb_22-1379,IL2021-22474
IL2021-15210,07-20728/14-28462,drop,481,84.8,59,132.1,35.4,1.7,28.3,,KEEP,TRUE,,27,25,SI_Urb_22-747,8.33,13.9,60.8,1414,SI_Urb_22-747,
IL2021-26754,12-26004/07-19334,drop,487.7,84.8,57.7,132.5,35.3,1.2,18.7,"YTNeo22[scab,npt]",KEEP,TRUE,,1,23,SI_Urb_22-661,7.36,14.1,57.7,1321,SI_Urb_22-661,IL2021-26754
IL2021-11821,14-11772/07-4415,drop,493.9,84.8,58.4,133.3,37.4,1.1,16.2,YTNeo22[leaning bit],DISCARD,TRUE,,23,27,SI_Urb_22-803,6.93,14.2,59.9,1298,SI_Urb_22-803,IL2021-11821
IL2021-19404,P0762A1-2-8/14-9542,keep,500,84.8,57.9,132.1,35.2,0.9,17,,KEEP,TRUE,,14,18,SI_Urb_22-527,7.57,15.3,58.8,1034,SI_Urb_22-527,
IL2021-17409,14-28462/07-19334,keep,497.4,84.8,59.1,132.3,36.9,1.1,17.3,,KEEP,TRUE,,21,41,SI_Urb_22-1221,6.25,11.2,62.9,460,SI_Urb_22-1221,
IL2021-18365,14-28468/14-11772,drop,491.2,84.8,59.1,131.9,37.8,1.5,19.3,YTUrb22[Npt],DISCARD,TRUE,,18,34,SI_Urb_22-1003,8.07,15.4,59.6,883,SI_Urb_22-1003,IL2021-18365
IL2021-16807,02-19463-7/16-9335,keep,496,84.8,58.4,133.1,35.5,1,17.6,,KEEP,TRUE,,27,44,SI_Urb_22-1294,5.19,11.7,60,274,SI_Urb_22-1294,
IL2021-17813,14-28462/14-28468,keep,497.2,84.7,59.7,131,34.8,1.4,19.5,"YTNeo22[npt, early]",KEEP,TRUE,,24,33,SI_Urb_22-984,7.07,15.7,59.7,937,SI_Urb_22-984,IL2021-17813
IL2021-16226,14-11772/14-11848,drop,489.8,84.7,58.6,133.1,36,1.2,19,,KEEP,TRUE,,1,9,SI_Urb_22-241,7.07,11.2,61.4,481,SI_Urb_22-241,
IL2021-43257,14-28462/07-20728//02-19463-7,drop,509.6,84.7,58.8,132.6,39.6,0.7,7.7,,DISCARD,TRUE,,20,48,SI_Urb_22-1421,6.21,11.7,62.5,41,SI_Urb_22-1421,
IL2021-44542,14-28468/14-11848//14-11312,drop,494,84.7,57.5,132.4,36.3,0.9,13.4,,KEEP,TRUE,,13,25,SI_Urb_22-733,7.78,13.6,59.4,1428,SI_Urb_22-733,
IL2021-43926,14-28462/14-11830//14-28468,keep,518.8,84.6,59.7,131.4,36,0.5,7.8,"YTUrb22[Npt, erect, green leaves]",KEEP,TRUE,,30,25,SI_Urb_22-750,6.57,13.9,60.9,1411,SI_Urb_22-750,IL2021-43926
IL2021-17968,14-28462/14-28468,keep,492.1,84.6,59.5,131.9,36,1.4,19.1,YTUrb22[Looks good],KEEP,TRUE,,18,36,SI_Urb_22-1063,7.76,11.6,63.2,763,SI_Urb_22-1063,IL2021-17968
IL2021-45638,07-20728/P05247A1-7-3-120,keep,482.6,84.6,59.3,132.2,34.4,1.5,29.3,,KEEP,TRUE,,28,27,SI_Urb_22-808,7.52,14,60.8,1293,SI_Urb_22-808,
IL2021-18152,14-28468/07-19334,keep,516.8,84.6,59.5,132.2,35.6,0.5,2.7,,KEEP,TRUE,,15,36,SI_Urb_22-1066,7.52,11.9,63.2,766,SI_Urb_22-1066,
IL2021-46563,P0566A1-3-1-52/IL12-26004//07-4415,drop,466.6,84.6,56.3,131.1,36.1,1.4,22.6,,DISCARD,TRUE,,17,35,SI_Urb_22-1037,7.5,16,56.9,824,SI_Urb_22-1037,
IL2021-44026,14-28462/14-19503//14-28462,keep,517.5,84.5,60.1,130.6,36.6,0.8,8.4,YTUrb22[Tall],KEEP,TRUE,,13,30,SI_Urb_22-888,8.65,14.7,60.9,1128,SI_Urb_22-888,IL2021-44026
IL2021-42045,14-11772/14-11830//14-3934,drop,490.6,84.5,57.4,132.7,37.3,0.8,14.8,YTUrb22[Lodging],DISCARD,TRUE,,22,47,SI_Urb_22-1402,5.25,11.9,60,99,SI_Urb_22-1402,IL2021-42045
IL2021-25152,12-8512/16-27570,keep,483.2,84.5,59.3,132.1,36.4,1.6,24.8,YTUrb22[Leaning],KEEP,TRUE,,21,36,SI_Urb_22-1060,7.39,12,63.2,760,SI_Urb_22-1060,IL2021-25152
IL2021-4856,07-4415/IL12-26004,keep,506,84.4,57.5,130.6,36,0.7,13.1,YTUrb22[Leaning],KEEP,TRUE,,2,38,SI_Urb_22-1139,6.93,11.8,61,659,SI_Urb_22-1139,IL2021-4856
IL2021-22459,07-20728/13-1910,drop,491.2,84.4,59.7,132.7,38.2,1.2,17,YTUrb22[Tall],DISCARD,TRUE,"6/27/2022, 6:12:33 PM, Tare Warning, Test Weight: 5.05",15,23,SI_Urb_22-675,8.61,14.1,61.9,1335,SI_Urb_22-675,IL2021-22459
IL2021-16415,14-11772/14-28468,keep,492.5,84.4,59.8,130.9,35.6,1.6,21.2,,KEEP,TRUE,,11,10,SI_Urb_22-290,8.5,11.8,64.5,551,SI_Urb_22-290,
IL2021-46132,14-28468/12-8512,keep,501.3,84.4,58.3,131,36.1,1.3,14.8,YTUrb22[Lodging],KEEP,TRUE,,2,18,SI_Urb_22-539,7.05,15,59.3,1022,SI_Urb_22-539,IL2021-46132
IL2021-13345,07-4415/07-19334,drop,479.3,84.4,57.5,132.4,36.1,1.4,20.5,,KEEP,TRUE,,2,12,SI_Urb_22-359,7.22,12.2,60.8,662,SI_Urb_22-359,
IL2021-25528,12-17428/07-4415,drop,496.3,84.4,57.3,131.7,36.8,0.6,15.9,,KEEP,TRUE,,6,40,SI_Urb_22-1195,6.91,11.1,61.2,535,SI_Urb_22-1195,
IL2021-16726,14-11830/14-28462,keep,507.6,84.4,57.9,132.2,34.1,0.6,9.4,,KEEP,TRUE,,23,20,SI_Urb_22-578,7.67,14.9,59.4,1163,SI_Urb_22-578,
IL2021-19549,P0762A1-2-8/14-11911,keep,507.7,84.4,58.5,132.3,36.5,0.6,12.3,,KEEP,TRUE,,11,27,SI_Urb_22-791,7.87,13.9,60.2,1310,SI_Urb_22-791,
IL2021-36441,16-27570/07-20728,keep,498.1,84.4,60,132.6,35.6,0.9,16.8,,KEEP,TRUE,,17,12,SI_Urb_22-344,6.88,12.1,62.8,677,SI_Urb_22-344,
IL2021-40138,07-20728/07-19334//07-4415,keep,502.5,84.3,58.8,131.3,35.9,1,17.5,,KEEP,TRUE,,7,43,SI_Urb_22-1267,6.36,11.4,62.8,354,SI_Urb_22-1267,
IL2021-12550,14-26228/07-4415,drop,499.7,84.3,58.1,131.8,37.7,1,16.7,,DISCARD,TRUE,,25,27,SI_Urb_22-805,7.21,14.1,58.5,1296,SI_Urb_22-805,
IL2021-33148,14-28462/10-21934,drop,473.6,84.3,57.3,132.2,35.9,1.6,21.6,,KEEP,TRUE,,12,8,SI_Urb_22-229,7.78,11.1,61.1,432,SI_Urb_22-229,
IL2021-16452,14-11772/14-28468,keep,483.7,84.3,59.1,132,35.5,1.6,23.5,,KEEP,TRUE,,6,35,SI_Urb_22-1026,8.44,15.6,59.3,835,SI_Urb_22-1026,
IL2021-40608,07-20728/14-28462//12-26004,keep,495.7,84.3,59.8,132.4,36.5,1,19,YTUrb22[Lodg],KEEP,TRUE,,7,45,SI_Urb_22-1327,6.74,11.3,63.5,234,SI_Urb_22-1327,IL2021-40608
